,date,job_link,title,company,company_link,location,benefit,description,applicant_caption,posted_time_ago,seniority_level,employment_type,job_function,industry,date_posted,description_json,employment_type_json,industry_json,latitude,longitude,education_type,education_category,experience_type,experience_time,job_location_type,location_requirement_type,location_requirement_name
9,2023-07-15,https://www.linkedin.com/jobs/view/one-demand-data-analytics-odda-devops-engineer-at-mars-3307206072?refId=BI%2F07r6F2pnOj%2BxxbndMag%3D%3D&trackingId=aZzO3pm0lbGqlwR27ChDYg%3D%3D&position=10&pageNum=0&trk=public_jobs_jserp-result_search-card,One Demand Data Analytics (ODDA) DevOps Engineer,Mars,https://www.linkedin.com/company/mars?trk=public_jobs_jserp-result_job-search-card-subtitle,"Chicago, IL",Be an early applicant,"This is an exciting opportunity for a software engineer passionate about open source software, Linux, Python, and web services at scale. We are building the next generation management solution for Ubuntu in the enterprise - on premise and on the public cloud - to enable large estate observability, telemetry, security, compliance and operations. Build a rewarding, meaningful career working with the best and brightest people in technology at Canonical, a growing international software company.&lt;p&gt;&lt;br&gt;&lt;/p&gt;Landscape is the leading management tool to deploy, monitor and manage fleets of Ubuntu systems, including package and repository management, health and security monitoring, hardware inventory, and automation. As Landscape software engineer you will be responsible for contributing on a distributed development team participating in all facets of the development process.&lt;p&gt;&lt;br&gt;&lt;/p&gt;What you'll do&lt;p&gt;&lt;br&gt;&lt;/p&gt;&lt;ul&gt;&lt;li&gt;Collaborate proactively with a distributed team&lt;/li&gt;&lt;li&gt;Write high-quality code to create new features, fix bugs and modernize the Landscape codebase&lt;/li&gt;&lt;li&gt;Demonstrate your strong commitment to code quality and automated testing&lt;/li&gt;&lt;li&gt;Participate in the engineering process with code and architectural reviews&lt;/li&gt;&lt;li&gt;Take personal ownership of problems and design and deliver solutions&lt;/li&gt;&lt;li&gt;Work remotely with global travel 2 to 4 weeks for internal and external events&lt;/li&gt;&lt;li&gt;Assist with release management during each development cycle&lt;/li&gt;&lt;li&gt;Collaborate with devops for Landscape SaaS, Canonical's hosted Landscape&lt;/li&gt;&lt;/ul&gt;&lt;p&gt;&lt;br&gt;&lt;/p&gt;Who you are&lt;p&gt;&lt;br&gt;&lt;/p&gt;&lt;ul&gt;&lt;li&gt;You love technology and working with brilliant people&lt;/li&gt;&lt;li&gt;You are curious, flexible, articulate, and accountable&lt;/li&gt;&lt;li&gt;You value soft skills and are passionate, enterprising, thoughtful, and self-motivated&lt;/li&gt;&lt;li&gt;You have a Bachelor's or equivalent in Computer Science, STEM or similar degree&lt;/li&gt;&lt;li&gt;You have proficiency developing public-facing APIs and web applications, preferably using Python. &lt;/li&gt;&lt;li&gt;Experience with Python and web frameworks such as Flask and Django. &lt;/li&gt;&lt;li&gt;Experience with databases, and ORMs (PostgreSQL a plus)&lt;/li&gt;&lt;li&gt;You are comfortable with Ubuntu as a development and deployment platform. &lt;/li&gt;&lt;/ul&gt;&lt;p&gt;&lt;br&gt;&lt;/p&gt;&lt;em&gt;Canonical is proud to foster a workplace free from discrimination. We truly believe that diversity of experience, perspectives, and background will lead to a better environment for our employees and a better platform for our users and customers. This is something we value deeply and we encourage everyone to come be a part of the world of Ubuntu.&lt;/em&gt;&lt;p&gt;&lt;br&gt;&lt;/p&gt;#stack&lt;p&gt;&lt;br&gt;&lt;/p&gt;",Be among the first 25 applicants,13 hours ago,Entry level,FULL_TIME,Engineering and Information Technology,"Technology, Information and Internet",2023-07-14T22:39:28.000Z,"This is an exciting opportunity for a software engineer passionate about open source software, Linux, Python, and web services at scale. We are building the next generation management solution for Ubuntu in the enterprise - on premise and on the public cloud - to enable large estate observability, telemetry, security, compliance and operations. Build a rewarding, meaningful career working with the best and brightest people in technology at Canonical, a growing international software company.&lt;p&gt;&lt;br&gt;&lt;/p&gt;Landscape is the leading management tool to deploy, monitor and manage fleets of Ubuntu systems, including package and repository management, health and security monitoring, hardware inventory, and automation. As Landscape software engineer you will be responsible for contributing on a distributed development team participating in all facets of the development process.&lt;p&gt;&lt;br&gt;&lt;/p&gt;What you'll do&lt;p&gt;&lt;br&gt;&lt;/p&gt;&lt;ul&gt;&lt;li&gt;Collaborate proactively with a distributed team&lt;/li&gt;&lt;li&gt;Write high-quality code to create new features, fix bugs and modernize the Landscape codebase&lt;/li&gt;&lt;li&gt;Demonstrate your strong commitment to code quality and automated testing&lt;/li&gt;&lt;li&gt;Participate in the engineering process with code and architectural reviews&lt;/li&gt;&lt;li&gt;Take personal ownership of problems and design and deliver solutions&lt;/li&gt;&lt;li&gt;Work remotely with global travel 2 to 4 weeks for internal and external events&lt;/li&gt;&lt;li&gt;Assist with release management during each development cycle&lt;/li&gt;&lt;li&gt;Collaborate with devops for Landscape SaaS, Canonical's hosted Landscape&lt;/li&gt;&lt;/ul&gt;&lt;p&gt;&lt;br&gt;&lt;/p&gt;Who you are&lt;p&gt;&lt;br&gt;&lt;/p&gt;&lt;ul&gt;&lt;li&gt;You love technology and working with brilliant people&lt;/li&gt;&lt;li&gt;You are curious, flexible, articulate, and accountable&lt;/li&gt;&lt;li&gt;You value soft skills and are passionate, enterprising, thoughtful, and self-motivated&lt;/li&gt;&lt;li&gt;You have a Bachelor's or equivalent in Computer Science, STEM or similar degree&lt;/li&gt;&lt;li&gt;You have proficiency developing public-facing APIs and web applications, preferably using Python. &lt;/li&gt;&lt;li&gt;Experience with Python and web frameworks such as Flask and Django. &lt;/li&gt;&lt;li&gt;Experience with databases, and ORMs (PostgreSQL a plus)&lt;/li&gt;&lt;li&gt;You are comfortable with Ubuntu as a development and deployment platform. &lt;/li&gt;&lt;/ul&gt;&lt;p&gt;&lt;br&gt;&lt;/p&gt;&lt;em&gt;Canonical is proud to foster a workplace free from discrimination. We truly believe that diversity of experience, perspectives, and background will lead to a better environment for our employees and a better platform for our users and customers. This is something we value deeply and we encourage everyone to come be a part of the world of Ubuntu.&lt;/em&gt;&lt;p&gt;&lt;br&gt;&lt;/p&gt;#stack&lt;p&gt;&lt;br&gt;&lt;/p&gt;",FULL_TIME,"Technology, Information and Internet",41.88323,-87.6324,EducationalOccupationalCredential,bachelor degree,,,TELECOMMUTE,Country,United States
10,2023-07-15,https://www.linkedin.com/jobs/view/infrastructure-engineer-multiple-openings-ihm-at-discover-financial-services-3661577682?refId=BI%2F07r6F2pnOj%2BxxbndMag%3D%3D&trackingId=HG5NIl1jbKmuhp34c2a4ZA%3D%3D&position=11&pageNum=0&trk=public_jobs_jserp-result_search-card,Infrastructure Engineer (multiple openings) - IHM,Discover Financial Services,https://www.linkedin.com/company/discover-financial-services?trk=public_jobs_jserp-result_job-search-card-subtitle,"Riverwoods, IL",Be an early applicant,"&lt;strong&gt;Discover. A brighter future.&lt;/strong&gt;&lt;p&gt;&lt;br&gt;&lt;/p&gt;With us, you’ll do meaningful work from Day 1. Our collaborative culture is built on three core behaviors: We Play to Win, We Get Better Every Day &amp;amp; We Succeed Together. And we mean it — we want you to grow and make a difference at one of the world's leading digital banking and payments companies. We value what makes you unique so that you have an opportunity to shine.&lt;p&gt;&lt;br&gt;&lt;/p&gt;Come build your future, while being the reason millions of people find a brighter financial future with Discover.&lt;p&gt;&lt;br&gt;&lt;/p&gt;Job Description:&lt;p&gt;&lt;br&gt;&lt;/p&gt;&lt;strong&gt;Employer:&lt;/strong&gt;                   DFS Corporate Services LLC&lt;p&gt;&lt;br&gt;&lt;/p&gt;&lt;strong&gt;Job Title:&lt;/strong&gt; Infrastructure Engineer (multiple openings)&lt;p&gt;&lt;br&gt;&lt;/p&gt;&lt;strong&gt;Job Location:&lt;/strong&gt; Riverwoods, IL&lt;p&gt;&lt;br&gt;&lt;/p&gt;&lt;strong&gt;Job Type:&lt;/strong&gt;                    Full Time&lt;p&gt;&lt;br&gt;&lt;/p&gt;&lt;strong&gt;Duties:&lt;/strong&gt; Work on holistic engineering deliverables across different stages of the product lifecycle and determine technology patterns for the overall solution. Achieve product commitments (and influence others to do the same) by using informal leadership and highly developed communication skills, and contribute to or lead technology communities. Telecommuting and/or working from home may be permissible pursuant to company policies.&lt;p&gt;&lt;br&gt;&lt;/p&gt;&lt;strong&gt;Requirements:&lt;/strong&gt; Employer will accept a Bachelor’s degree in Computer Science, Engineering (any), or a related field and 36 months of experience in Software Engineer-2 or related occupation&lt;p&gt;&lt;br&gt;&lt;/p&gt;&lt;strong&gt;Position required skills:&lt;/strong&gt; Three (3) years of experience in the job offered or related occupation: Installing and configuring OpenShift and Kubernetes clusters on AWS cloud; administering worker node configurations, including docker configuration, Kubernetes, Cloud Container services, and deployments; provisioning infrastructure in AWS, including nodes, security groups, S3, Elb, volumes, IAM role and policies using Terraform; Utilize GitHub, Jira, and Jfro Artifactory; deploying applications, including Splunk, CLS, IDAP, and Instana using Ansible playbooks with Jenkins (CI/CD); managing and supporting Linux based application servers; migrating and upgrading OpenShift environments with Jenkins; and installing, operating, and recovering Linux operation systems as well as OpenShift Clusters and Nodes using Jenkins. Telecommuting and/or working from home may be permissible pursuant to company policies.&lt;p&gt;&lt;br&gt;&lt;/p&gt;Position eligible for incentives under Employee Referral Program.&lt;p&gt;&lt;br&gt;&lt;/p&gt;&lt;strong&gt;Rate of Pay:&lt;/strong&gt; &lt;em&gt;The base pay for this position generally ranges between $94,016 to $142,500. Additional incentives may be provided as part of a market competitive total compensation package. Factors, such as but not limited to, geographical location, relevant experience, education, and skill level may impact the pay for this position. We also offer a range of benefits and programs based on eligibility. Learn more at &lt;/em&gt;&lt;em&gt;MyDiscoverBenefits.com&lt;/em&gt;.&lt;p&gt;&lt;br&gt;&lt;/p&gt;&lt;em&gt;QUALIFIED APPLICANTS: Please apply directly through our website by clicking on “Apply Now.” No calls. Equal Opportunity Employer/disability/vet&lt;/em&gt;.&lt;p&gt;&lt;br&gt;&lt;/p&gt;What are you waiting for? Apply today!&lt;p&gt;&lt;br&gt;&lt;/p&gt;All Discover employees place our customers at the very center of our work. To deliver on our promises to our customers, each of us contribute every day to a culture that values compliance and risk management.&lt;p&gt;&lt;br&gt;&lt;/p&gt;Discover is committed to a diverse and inclusive workplace. Discover is an equal opportunity employer and does not discriminate on the basis of race, color, religion, sex, sexual orientation, gender identity, national origin, age, disability, protected veteran status, or other legally protected status. (Know Your Rights)",Be among the first 25 applicants,6 hours ago,Entry level,FULL_TIME,Information Technology,"Banking, Financial Services, and Hospitality",2023-07-15T05:43:54.000Z,"&lt;strong&gt;Discover. A brighter future.&lt;/strong&gt;&lt;p&gt;&lt;br&gt;&lt;/p&gt;With us, you’ll do meaningful work from Day 1. Our collaborative culture is built on three core behaviors: We Play to Win, We Get Better Every Day &amp;amp; We Succeed Together. And we mean it — we want you to grow and make a difference at one of the world's leading digital banking and payments companies. We value what makes you unique so that you have an opportunity to shine.&lt;p&gt;&lt;br&gt;&lt;/p&gt;Come build your future, while being the reason millions of people find a brighter financial future with Discover.&lt;p&gt;&lt;br&gt;&lt;/p&gt;Job Description:&lt;p&gt;&lt;br&gt;&lt;/p&gt;&lt;strong&gt;Employer:&lt;/strong&gt;                   DFS Corporate Services LLC&lt;p&gt;&lt;br&gt;&lt;/p&gt;&lt;strong&gt;Job Title:&lt;/strong&gt; Infrastructure Engineer (multiple openings)&lt;p&gt;&lt;br&gt;&lt;/p&gt;&lt;strong&gt;Job Location:&lt;/strong&gt; Riverwoods, IL&lt;p&gt;&lt;br&gt;&lt;/p&gt;&lt;strong&gt;Job Type:&lt;/strong&gt;                    Full Time&lt;p&gt;&lt;br&gt;&lt;/p&gt;&lt;strong&gt;Duties:&lt;/strong&gt; Work on holistic engineering deliverables across different stages of the product lifecycle and determine technology patterns for the overall solution. Achieve product commitments (and influence others to do the same) by using informal leadership and highly developed communication skills, and contribute to or lead technology communities. Telecommuting and/or working from home may be permissible pursuant to company policies.&lt;p&gt;&lt;br&gt;&lt;/p&gt;&lt;strong&gt;Requirements:&lt;/strong&gt; Employer will accept a Bachelor’s degree in Computer Science, Engineering (any), or a related field and 36 months of experience in Software Engineer-2 or related occupation&lt;p&gt;&lt;br&gt;&lt;/p&gt;&lt;strong&gt;Position required skills:&lt;/strong&gt; Three (3) years of experience in the job offered or related occupation: Installing and configuring OpenShift and Kubernetes clusters on AWS cloud; administering worker node configurations, including docker configuration, Kubernetes, Cloud Container services, and deployments; provisioning infrastructure in AWS, including nodes, security groups, S3, Elb, volumes, IAM role and policies using Terraform; Utilize GitHub, Jira, and Jfro Artifactory; deploying applications, including Splunk, CLS, IDAP, and Instana using Ansible playbooks with Jenkins (CI/CD); managing and supporting Linux based application servers; migrating and upgrading OpenShift environments with Jenkins; and installing, operating, and recovering Linux operation systems as well as OpenShift Clusters and Nodes using Jenkins. Telecommuting and/or working from home may be permissible pursuant to company policies.&lt;p&gt;&lt;br&gt;&lt;/p&gt;Position eligible for incentives under Employee Referral Program.&lt;p&gt;&lt;br&gt;&lt;/p&gt;&lt;strong&gt;Rate of Pay:&lt;/strong&gt; &lt;em&gt;The base pay for this position generally ranges between $94,016 to $142,500. Additional incentives may be provided as part of a market competitive total compensation package. Factors, such as but not limited to, geographical location, relevant experience, education, and skill level may impact the pay for this position. We also offer a range of benefits and programs based on eligibility. Learn more at &lt;/em&gt;&lt;em&gt;MyDiscoverBenefits.com&lt;/em&gt;.&lt;p&gt;&lt;br&gt;&lt;/p&gt;&lt;em&gt;QUALIFIED APPLICANTS: Please apply directly through our website by clicking on “Apply Now.” No calls. Equal Opportunity Employer/disability/vet&lt;/em&gt;.&lt;p&gt;&lt;br&gt;&lt;/p&gt;What are you waiting for? Apply today!&lt;p&gt;&lt;br&gt;&lt;/p&gt;All Discover employees place our customers at the very center of our work. To deliver on our promises to our customers, each of us contribute every day to a culture that values compliance and risk management.&lt;p&gt;&lt;br&gt;&lt;/p&gt;Discover is committed to a diverse and inclusive workplace. Discover is an equal opportunity employer and does not discriminate on the basis of race, color, religion, sex, sexual orientation, gender identity, national origin, age, disability, protected veteran status, or other legally protected status. (Know Your Rights)",FULL_TIME,"Banking,Financial Services,Hospitality",42.16751,-87.896996,EducationalOccupationalCredential,bachelor degree,OccupationalExperienceRequirements,36,,,
11,2023-07-15,https://www.linkedin.com/jobs/view/software-engineer-ubuntu-systems-management-at-canonical-3663796411?refId=BI%2F07r6F2pnOj%2BxxbndMag%3D%3D&trackingId=OA78VVeEvI3aFFuSzQ2rKQ%3D%3D&position=12&pageNum=0&trk=public_jobs_jserp-result_search-card,Software Engineer - Ubuntu Systems Management,Canonical,https://uk.linkedin.com/company/canonical?trk=public_jobs_jserp-result_job-search-card-subtitle,"Chicago, IL",Be an early applicant,"&lt;strong&gt;Company Overview&lt;br&gt;&lt;br&gt;&lt;/strong&gt;At Motorola Solutions, we believe that everything starts with safety. It’s the constant that empowers people to confidently move forward. It can fill a flight or sell out a stadium. It can care for a patient or graduate a class.&lt;br&gt;&lt;br&gt;As a global leader in public safety and enterprise security, we create and connect the technologies that help to keep people safe where they live, learn, work and play. Our integrated technology ecosystem unifies critical communications, video security and access control, and command center software, enabling collaboration in more powerful ways.&lt;br&gt;&lt;br&gt;At Motorola Solutions, we’re ushering in a new era in public safety and security. Bring your passion, potential and talents to a career that matters.&lt;br&gt;&lt;br&gt;&lt;strong&gt;Department Overview&lt;br&gt;&lt;br&gt;&lt;/strong&gt;Motorola Solutions, Inc.&lt;br&gt;&lt;br&gt;&lt;strong&gt;Job Description&lt;br&gt;&lt;/strong&gt;&lt;ul&gt;&lt;li&gt;Develop and support configurations, commerce, integrations, reports, workflow, and custom development in Oracle CPQ environment. &lt;/li&gt;&lt;li&gt;Complete complex programs to translate requirement specifications into code. &lt;/li&gt;&lt;li&gt;Provide technical design to business solutions and test the modules. &lt;/li&gt;&lt;li&gt;Conduct solutions presentations and obtain business acceptance to solution design. &lt;/li&gt;&lt;li&gt;Apply application-specific technical skills to independently produce deliverables. &lt;/li&gt;&lt;li&gt;Acquire and utilize more in-depth business knowledge to support the applications. &lt;/li&gt;&lt;li&gt;Plan, document, and execute unit test plans to ensure all code changes meet requirements, and specifications. &lt;/li&gt;&lt;li&gt;Support programming changes during quality assurance, user acceptance testing, and post implementation to ensure the integrity of application. &lt;/li&gt;&lt;li&gt;Respond to questions, research and resolve issues to provide technical support for production applications. &lt;/li&gt;&lt;li&gt;Telecommuting permitted from anywhere within the U.S. &lt;br&gt;&lt;br&gt;&lt;/li&gt;&lt;/ul&gt;&lt;strong&gt;Basic Requirements&lt;br&gt;&lt;/strong&gt;&lt;ul&gt;&lt;li&gt;Bachelors degree + 4 years experience. &lt;br&gt;&lt;br&gt;&lt;/li&gt;&lt;/ul&gt;&lt;strong&gt;Travel Requirements&lt;br&gt;&lt;br&gt;&lt;/strong&gt;None&lt;br&gt;&lt;br&gt;&lt;strong&gt;Relocation Provided&lt;br&gt;&lt;br&gt;&lt;/strong&gt;None&lt;br&gt;&lt;br&gt;&lt;strong&gt;Position Type&lt;br&gt;&lt;br&gt;&lt;/strong&gt;Experienced&lt;br&gt;&lt;br&gt;&lt;strong&gt;Referral Payment Plan&lt;br&gt;&lt;br&gt;&lt;/strong&gt;No&lt;br&gt;&lt;br&gt;&lt;strong&gt;Our U.S. Benefits include:&lt;br&gt;&lt;/strong&gt;&lt;ul&gt;&lt;li&gt;Incentive Bonus Plans&lt;/li&gt;&lt;li&gt;Medical, Dental, Vision benefits&lt;/li&gt;&lt;li&gt;401K with Company Match&lt;/li&gt;&lt;li&gt;9 Paid Holidays&lt;/li&gt;&lt;li&gt;Generous Paid Time Off Packages&lt;/li&gt;&lt;li&gt;Employee Stock Purchase Plan&lt;/li&gt;&lt;li&gt;Paid Parental &amp;amp; Family Leave&lt;/li&gt;&lt;li&gt;and more!&lt;br&gt;&lt;br&gt;&lt;/li&gt;&lt;/ul&gt;&lt;em&gt;&lt;strong&gt;EEO Statement&lt;br&gt;&lt;br&gt;&lt;/strong&gt;&lt;/em&gt;Motorola Solutions is an Equal Opportunity Employer and all qualified applicants will receive consideration for employment without regard to race, color, religion, sex, sexual orientation, gender identity, national origin, disability, veteran's status, or, any other protected characteristic.",,2 hours ago,Entry level,FULL_TIME,Information Technology,Telecommunications,2023-07-15T09:17:52.000Z,"&lt;strong&gt;Company Overview&lt;br&gt;&lt;br&gt;&lt;/strong&gt;At Motorola Solutions, we believe that everything starts with safety. It’s the constant that empowers people to confidently move forward. It can fill a flight or sell out a stadium. It can care for a patient or graduate a class.&lt;br&gt;&lt;br&gt;As a global leader in public safety and enterprise security, we create and connect the technologies that help to keep people safe where they live, learn, work and play. Our integrated technology ecosystem unifies critical communications, video security and access control, and command center software, enabling collaboration in more powerful ways.&lt;br&gt;&lt;br&gt;At Motorola Solutions, we’re ushering in a new era in public safety and security. Bring your passion, potential and talents to a career that matters.&lt;br&gt;&lt;br&gt;&lt;strong&gt;Department Overview&lt;br&gt;&lt;br&gt;&lt;/strong&gt;Motorola Solutions, Inc.&lt;br&gt;&lt;br&gt;&lt;strong&gt;Job Description&lt;br&gt;&lt;/strong&gt;&lt;ul&gt;&lt;li&gt;Develop and support configurations, commerce, integrations, reports, workflow, and custom development in Oracle CPQ environment. &lt;/li&gt;&lt;li&gt;Complete complex programs to translate requirement specifications into code. &lt;/li&gt;&lt;li&gt;Provide technical design to business solutions and test the modules. &lt;/li&gt;&lt;li&gt;Conduct solutions presentations and obtain business acceptance to solution design. &lt;/li&gt;&lt;li&gt;Apply application-specific technical skills to independently produce deliverables. &lt;/li&gt;&lt;li&gt;Acquire and utilize more in-depth business knowledge to support the applications. &lt;/li&gt;&lt;li&gt;Plan, document, and execute unit test plans to ensure all code changes meet requirements, and specifications. &lt;/li&gt;&lt;li&gt;Support programming changes during quality assurance, user acceptance testing, and post implementation to ensure the integrity of application. &lt;/li&gt;&lt;li&gt;Respond to questions, research and resolve issues to provide technical support for production applications. &lt;/li&gt;&lt;li&gt;Telecommuting permitted from anywhere within the U.S. &lt;br&gt;&lt;br&gt;&lt;/li&gt;&lt;/ul&gt;&lt;strong&gt;Basic Requirements&lt;br&gt;&lt;/strong&gt;&lt;ul&gt;&lt;li&gt;Bachelors degree + 4 years experience. &lt;br&gt;&lt;br&gt;&lt;/li&gt;&lt;/ul&gt;&lt;strong&gt;Travel Requirements&lt;br&gt;&lt;br&gt;&lt;/strong&gt;None&lt;br&gt;&lt;br&gt;&lt;strong&gt;Relocation Provided&lt;br&gt;&lt;br&gt;&lt;/strong&gt;None&lt;br&gt;&lt;br&gt;&lt;strong&gt;Position Type&lt;br&gt;&lt;br&gt;&lt;/strong&gt;Experienced&lt;br&gt;&lt;br&gt;&lt;strong&gt;Referral Payment Plan&lt;br&gt;&lt;br&gt;&lt;/strong&gt;No&lt;br&gt;&lt;br&gt;&lt;strong&gt;Our U.S. Benefits include:&lt;br&gt;&lt;/strong&gt;&lt;ul&gt;&lt;li&gt;Incentive Bonus Plans&lt;/li&gt;&lt;li&gt;Medical, Dental, Vision benefits&lt;/li&gt;&lt;li&gt;401K with Company Match&lt;/li&gt;&lt;li&gt;9 Paid Holidays&lt;/li&gt;&lt;li&gt;Generous Paid Time Off Packages&lt;/li&gt;&lt;li&gt;Employee Stock Purchase Plan&lt;/li&gt;&lt;li&gt;Paid Parental &amp;amp; Family Leave&lt;/li&gt;&lt;li&gt;and more!&lt;br&gt;&lt;br&gt;&lt;/li&gt;&lt;/ul&gt;&lt;em&gt;&lt;strong&gt;EEO Statement&lt;br&gt;&lt;br&gt;&lt;/strong&gt;&lt;/em&gt;Motorola Solutions is an Equal Opportunity Employer and all qualified applicants will receive consideration for employment without regard to race, color, religion, sex, sexual orientation, gender identity, national origin, disability, veteran's status, or, any other protected characteristic.",FULL_TIME,Telecommunications,41.88323,-87.6324,EducationalOccupationalCredential,bachelor degree,OccupationalExperienceRequirements,48,,,
