,date,job_link,title,company,company_link,location,benefit,description,applicant_caption,posted_time_ago,seniority_level,employment_type,job_function,industry,date_posted,description_json,employment_type_json,industry_json,latitude,longitude,education_type,education_category,experience_type,experience_time,job_location_type,location_requirement_type,location_requirement_name
0,2023-06-22,https://www.linkedin.com/jobs/view/data-analyst-at-lumere-3641306072?refId=PAuiy7ieoQppKhhC6nWs8w%3D%3D&trackingId=n7JDwA5gNJhx2x8YXg%2FDxg%3D%3D&position=1&pageNum=0&trk=public_jobs_jserp-result_search-card,Data Analyst,Lumere,https://www.linkedin.com/company/lumere?trk=public_jobs_jserp-result_job-search-card-subtitle,"Chicago, IL",,"&lt;strong&gt;What you will be doing:&lt;/strong&gt;&lt;p&gt;&lt;br&gt;&lt;/p&gt;As a Data Analyst, you will work in a client facing role to improve and scale data analysis and processing capabilities. Your work will enable the insights provided to hospitals through Lumere’s software solutions.&lt;p&gt;&lt;br&gt;&lt;/p&gt;&lt;strong&gt;Responsibilities:&lt;/strong&gt;&lt;p&gt;&lt;br&gt;&lt;/p&gt;&lt;ul&gt;&lt;li&gt;Systematically connect disparate data sets&lt;/li&gt;&lt;li&gt;Develop and monitor metrics related to customer data and Lumere data sets&lt;/li&gt;&lt;li&gt;Take initiative to generate and test algorithms for insights driven from data&lt;/li&gt;&lt;li&gt;Collaborate with ETL engineering teams to automate processes for consistent and efficient analysis&lt;/li&gt;&lt;/ul&gt;&lt;p&gt;&lt;br&gt;&lt;/p&gt;&lt;strong&gt;Qualifications:&lt;/strong&gt;&lt;p&gt;&lt;br&gt;&lt;/p&gt;&lt;ul&gt;&lt;li&gt;Bachelors in Mathematics, Statistics, Engineering, Economics or similar&lt;/li&gt;&lt;li&gt;1+ years professional background in mathematics, statistics, engineering, and/or informatics&lt;/li&gt;&lt;li&gt;High degree of competence and comfort using MS Excel and basic familiarity with SQL is preferred&lt;/li&gt;&lt;li&gt;Familiarity with data science tools, like python or R, is a plus&lt;/li&gt;&lt;li&gt;Experience working with large data sets &lt;/li&gt;&lt;li&gt;Familiarity with healthcare data a plus&lt;/li&gt;&lt;li&gt;Excellent communication and organizational skills&lt;/li&gt;&lt;li&gt;Detail-oriented and thorough&lt;/li&gt;&lt;li&gt;A demonstrated track record of accomplishing goals, meeting deadlines, and holding yourself and others to a high standard&lt;/li&gt;&lt;li&gt;Excellent written and oral communication skills with a proven ability to present solutions with both technical and non-technical arguments&lt;/li&gt;&lt;/ul&gt;&lt;p&gt;&lt;br&gt;&lt;/p&gt;Powered by JazzHR&lt;p&gt;&lt;br&gt;&lt;/p&gt;ZvQbyNt8CW",,12 hours ago,Entry level,FULL_TIME,Information Technology,Internet Publishing,2023-06-21T23:19:47.000Z,"&lt;strong&gt;What you will be doing:&lt;/strong&gt;&lt;p&gt;&lt;br&gt;&lt;/p&gt;As a Data Analyst, you will work in a client facing role to improve and scale data analysis and processing capabilities. Your work will enable the insights provided to hospitals through Lumere’s software solutions.&lt;p&gt;&lt;br&gt;&lt;/p&gt;&lt;strong&gt;Responsibilities:&lt;/strong&gt;&lt;p&gt;&lt;br&gt;&lt;/p&gt;&lt;ul&gt;&lt;li&gt;Systematically connect disparate data sets&lt;/li&gt;&lt;li&gt;Develop and monitor metrics related to customer data and Lumere data sets&lt;/li&gt;&lt;li&gt;Take initiative to generate and test algorithms for insights driven from data&lt;/li&gt;&lt;li&gt;Collaborate with ETL engineering teams to automate processes for consistent and efficient analysis&lt;/li&gt;&lt;/ul&gt;&lt;p&gt;&lt;br&gt;&lt;/p&gt;&lt;strong&gt;Qualifications:&lt;/strong&gt;&lt;p&gt;&lt;br&gt;&lt;/p&gt;&lt;ul&gt;&lt;li&gt;Bachelors in Mathematics, Statistics, Engineering, Economics or similar&lt;/li&gt;&lt;li&gt;1+ years professional background in mathematics, statistics, engineering, and/or informatics&lt;/li&gt;&lt;li&gt;High degree of competence and comfort using MS Excel and basic familiarity with SQL is preferred&lt;/li&gt;&lt;li&gt;Familiarity with data science tools, like python or R, is a plus&lt;/li&gt;&lt;li&gt;Experience working with large data sets &lt;/li&gt;&lt;li&gt;Familiarity with healthcare data a plus&lt;/li&gt;&lt;li&gt;Excellent communication and organizational skills&lt;/li&gt;&lt;li&gt;Detail-oriented and thorough&lt;/li&gt;&lt;li&gt;A demonstrated track record of accomplishing goals, meeting deadlines, and holding yourself and others to a high standard&lt;/li&gt;&lt;li&gt;Excellent written and oral communication skills with a proven ability to present solutions with both technical and non-technical arguments&lt;/li&gt;&lt;/ul&gt;&lt;p&gt;&lt;br&gt;&lt;/p&gt;Powered by JazzHR&lt;p&gt;&lt;br&gt;&lt;/p&gt;ZvQbyNt8CW",FULL_TIME,Internet Publishing,41.88323,-87.6324,EducationalOccupationalCredential,bachelor degree,OccupationalExperienceRequirements,12,,,
1,2023-06-22,https://www.linkedin.com/jobs/view/data-analyst-at-g2a-executive-search-3641339532?refId=PAuiy7ieoQppKhhC6nWs8w%3D%3D&trackingId=Hq2PSv8zmPt0%2FlY02Pv6Rw%3D%3D&position=2&pageNum=0&trk=public_jobs_jserp-result_search-card,Data Analyst,G2A Executive Search,https://www.linkedin.com/company/g2a-executive-search?trk=public_jobs_jserp-result_job-search-card-subtitle,"Chicago, IL",Be an early applicant,"Outstanding opportunity with a fast growing AI technology software company. Working remote for a DC area based company.&lt;p&gt;&lt;br&gt;&lt;/p&gt;We have an immediate need for a talented individual with a computer science or information technology related degree with a focus on database administration or data analysis to join our clients fast growing team. The Data Analyst/DBA will service clients by providing structured and non-structured data analysis, custom scripting using various programming platforms, database creation, searching, and modification; and custom load file creation. In addition, the data analyst/DBA will provide data modeling and optimization; make recommendations related to performance and efficiency of data storage including more effective use of indexes or other DBMS specific features; assume responsibility for administration of existing enterprise databases; make recommendation for standards and best practices for SQL; and interact with and write complex SQL queries.&lt;p&gt;&lt;br&gt;&lt;/p&gt;Requirements for this role;&lt;p&gt;&lt;br&gt;&lt;/p&gt;&lt;ul&gt;&lt;li&gt;SQL Certification and/or 1+ year of database administration considered a strong plus.&lt;/li&gt;&lt;li&gt;Experience with parsing and scripting languages such as SQL, Perl, VBscript, etc.&lt;/li&gt;&lt;li&gt;Knowledge interacting with .NET, C#, Java, or other programming languages.&lt;/li&gt;&lt;li&gt;Extensive experience with Microsoft Windows Operating Systems &amp;amp; general networking concepts as well as virtual technologies.&lt;/li&gt;&lt;li&gt;Bachelors Degree in Computer Science or related IT Field.&lt;/li&gt;&lt;/ul&gt;&lt;p&gt;&lt;br&gt;&lt;/p&gt;Powered by JazzHR&lt;p&gt;&lt;br&gt;&lt;/p&gt;4584XUP0T8",Be among the first 25 applicants,12 hours ago,Entry level,FULL_TIME,Information Technology,Internet Publishing,2023-06-21T23:24:30.000Z,"Outstanding opportunity with a fast growing AI technology software company. Working remote for a DC area based company.&lt;p&gt;&lt;br&gt;&lt;/p&gt;We have an immediate need for a talented individual with a computer science or information technology related degree with a focus on database administration or data analysis to join our clients fast growing team. The Data Analyst/DBA will service clients by providing structured and non-structured data analysis, custom scripting using various programming platforms, database creation, searching, and modification; and custom load file creation. In addition, the data analyst/DBA will provide data modeling and optimization; make recommendations related to performance and efficiency of data storage including more effective use of indexes or other DBMS specific features; assume responsibility for administration of existing enterprise databases; make recommendation for standards and best practices for SQL; and interact with and write complex SQL queries.&lt;p&gt;&lt;br&gt;&lt;/p&gt;Requirements for this role;&lt;p&gt;&lt;br&gt;&lt;/p&gt;&lt;ul&gt;&lt;li&gt;SQL Certification and/or 1+ year of database administration considered a strong plus.&lt;/li&gt;&lt;li&gt;Experience with parsing and scripting languages such as SQL, Perl, VBscript, etc.&lt;/li&gt;&lt;li&gt;Knowledge interacting with .NET, C#, Java, or other programming languages.&lt;/li&gt;&lt;li&gt;Extensive experience with Microsoft Windows Operating Systems &amp;amp; general networking concepts as well as virtual technologies.&lt;/li&gt;&lt;li&gt;Bachelors Degree in Computer Science or related IT Field.&lt;/li&gt;&lt;/ul&gt;&lt;p&gt;&lt;br&gt;&lt;/p&gt;Powered by JazzHR&lt;p&gt;&lt;br&gt;&lt;/p&gt;4584XUP0T8",FULL_TIME,Internet Publishing,41.88323,-87.6324,EducationalOccupationalCredential,bachelor degree,OccupationalExperienceRequirements,12,,,
2,2023-06-22,https://www.linkedin.com/jobs/view/chicago-entry-level-business-intelligence-consultant-analyst-at-vistrada-3641305479?refId=PAuiy7ieoQppKhhC6nWs8w%3D%3D&trackingId=WGc4b8EhO63OR11jUP4jNA%3D%3D&position=3&pageNum=0&trk=public_jobs_jserp-result_search-card,(Chicago) Entry Level Business Intelligence Consultant/Analyst,VISTRADA,https://www.linkedin.com/company/vistrada?trk=public_jobs_jserp-result_job-search-card-subtitle,"Chicago, IL",Be an early applicant,"Passionate about making a difference in the world of cancer genomics?&lt;p&gt;&lt;br&gt;&lt;/p&gt;With the advent of genomic sequencing, we can finally decode and process our genetic makeup. We now have more data than ever before, but providers don't have the infrastructure or expertise to make sense of this data. We are on a mission to connect an entire ecosystem to redefine how genomic data is used in clinical settings.&lt;p&gt;&lt;br&gt;&lt;/p&gt;We are looking for a Jr. Clinical Trials Data Analyst who will work with our clinical and computational biology team on reports for clinical and research use.&lt;p&gt;&lt;br&gt;&lt;/p&gt;Responsibilities:&lt;p&gt;&lt;br&gt;&lt;/p&gt;&lt;ul&gt;&lt;li&gt;Works collaboratively within cross-functional teams at Tempus (including but not limited to scientists, pathologists, product development) to create customized clinical reports.&lt;/li&gt;&lt;li&gt;Analyze patient clinical records and molecular testing results to identify potential clinical trials.&lt;/li&gt;&lt;li&gt;Perform critical quality control functions in clinical report workflow.&lt;/li&gt;&lt;li&gt;Support ongoing and future projects within the team.&lt;/li&gt;&lt;/ul&gt;&lt;p&gt;&lt;br&gt;&lt;/p&gt;Required Experience and Skills:&lt;p&gt;&lt;br&gt;&lt;/p&gt;&lt;ul&gt;&lt;li&gt;Minimum of a BS or MS degree in Genetics, Molecular Genetics, Cancer Biology or Biological Sciences.&lt;/li&gt;&lt;li&gt;0-2 years working experience.&lt;/li&gt;&lt;li&gt;Oncology and medical terminology knowledge are strongly preferred.&lt;/li&gt;&lt;li&gt;Ability to learn new skills quickly and adapt to new processes smoothly. &lt;/li&gt;&lt;li&gt;Detail-oriented with strong critical-thinking skills.&lt;/li&gt;&lt;li&gt;Excellent communication skills with the ability to work both independently and in a group setting.&lt;/li&gt;&lt;li&gt;Excitement and drive to make a difference in a fast-paced energetic work environment!&lt;/li&gt;&lt;/ul&gt;&lt;p&gt;&lt;br&gt;&lt;/p&gt;Powered by JazzHR&lt;p&gt;&lt;br&gt;&lt;/p&gt;9psCUWWt2S",Be among the first 25 applicants,12 hours ago,Entry level,FULL_TIME,"Research, Analyst, and Information Technology",Internet Publishing,2023-06-21T23:21:40.000Z,"Passionate about making a difference in the world of cancer genomics?&lt;p&gt;&lt;br&gt;&lt;/p&gt;With the advent of genomic sequencing, we can finally decode and process our genetic makeup. We now have more data than ever before, but providers don't have the infrastructure or expertise to make sense of this data. We are on a mission to connect an entire ecosystem to redefine how genomic data is used in clinical settings.&lt;p&gt;&lt;br&gt;&lt;/p&gt;We are looking for a Jr. Clinical Trials Data Analyst who will work with our clinical and computational biology team on reports for clinical and research use.&lt;p&gt;&lt;br&gt;&lt;/p&gt;Responsibilities:&lt;p&gt;&lt;br&gt;&lt;/p&gt;&lt;ul&gt;&lt;li&gt;Works collaboratively within cross-functional teams at Tempus (including but not limited to scientists, pathologists, product development) to create customized clinical reports.&lt;/li&gt;&lt;li&gt;Analyze patient clinical records and molecular testing results to identify potential clinical trials.&lt;/li&gt;&lt;li&gt;Perform critical quality control functions in clinical report workflow.&lt;/li&gt;&lt;li&gt;Support ongoing and future projects within the team.&lt;/li&gt;&lt;/ul&gt;&lt;p&gt;&lt;br&gt;&lt;/p&gt;Required Experience and Skills:&lt;p&gt;&lt;br&gt;&lt;/p&gt;&lt;ul&gt;&lt;li&gt;Minimum of a BS or MS degree in Genetics, Molecular Genetics, Cancer Biology or Biological Sciences.&lt;/li&gt;&lt;li&gt;0-2 years working experience.&lt;/li&gt;&lt;li&gt;Oncology and medical terminology knowledge are strongly preferred.&lt;/li&gt;&lt;li&gt;Ability to learn new skills quickly and adapt to new processes smoothly. &lt;/li&gt;&lt;li&gt;Detail-oriented with strong critical-thinking skills.&lt;/li&gt;&lt;li&gt;Excellent communication skills with the ability to work both independently and in a group setting.&lt;/li&gt;&lt;li&gt;Excitement and drive to make a difference in a fast-paced energetic work environment!&lt;/li&gt;&lt;/ul&gt;&lt;p&gt;&lt;br&gt;&lt;/p&gt;Powered by JazzHR&lt;p&gt;&lt;br&gt;&lt;/p&gt;9psCUWWt2S",FULL_TIME,Internet Publishing,41.88323,-87.6324,EducationalOccupationalCredential,bachelor degree,,,,,
3,2023-06-22,https://www.linkedin.com/jobs/view/jr-clinical-trials-data-specialist-at-tempus-labs-inc-3641314855?refId=PAuiy7ieoQppKhhC6nWs8w%3D%3D&trackingId=I%2BWrjr538zwwchHJooPzyw%3D%3D&position=4&pageNum=0&trk=public_jobs_jserp-result_search-card,Jr. Clinical Trials Data Specialist,"Tempus Labs, Inc.",https://www.linkedin.com/company/tempuslabs?trk=public_jobs_jserp-result_job-search-card-subtitle,"Chicago, IL",Be an early applicant,"Want to learn more about this role and Jobot? Click our Jobot logo and follow our LinkedIn page!&lt;p&gt;&lt;br&gt;&lt;/p&gt;Job details&lt;p&gt;&lt;br&gt;&lt;/p&gt;&lt;strong&gt;Tech startup looking for a Senior Data Analyst to provide data analysis and visualization for their healthcare clients nationwide!&lt;/strong&gt;&lt;p&gt;&lt;br&gt;&lt;/p&gt;This Jobot Job is hosted by Christine McNamara&lt;p&gt;&lt;br&gt;&lt;/p&gt;Are you a fit? Easy Apply now by clicking the ""Apply"" button and sending us your resume.&lt;p&gt;&lt;br&gt;&lt;/p&gt;Salary $75,000 - $90,000 per year&lt;p&gt;&lt;br&gt;&lt;/p&gt;&lt;strong&gt;A Bit About Us&lt;/strong&gt;&lt;p&gt;&lt;br&gt;&lt;/p&gt;SaaS based tech company that devotes their time to fostering a healthy and diverse work culture is actively looking to bring on a Data Analyst to join their team. They offer tons of room for career growth and advancement, so if you are looking for a role to move forward in your career- this is the role for you.&lt;p&gt;&lt;br&gt;&lt;/p&gt;&lt;strong&gt;&lt;br&gt;&lt;br&gt;&lt;strong&gt;Why join us?&lt;br&gt;&lt;/strong&gt;&lt;/strong&gt;&lt;p&gt;&lt;br&gt;&lt;/p&gt;&lt;ul&gt;&lt;li&gt;100% coverage for medical, dental, and vision&lt;/li&gt;&lt;li&gt;401k with company match&lt;/li&gt;&lt;li&gt;Unlimited PTO&lt;/li&gt;&lt;li&gt;Flexible work schedule&lt;/li&gt;&lt;li&gt;Unlimited snacks&lt;/li&gt;&lt;li&gt;Company outings &amp;amp; volunteering events&lt;/li&gt;&lt;li&gt;Gym Discounts&lt;/li&gt;&lt;li&gt;Annual performance bonuses&lt;/li&gt;&lt;/ul&gt;&lt;p&gt;&lt;br&gt;&lt;/p&gt;&lt;strong&gt;Job Details&lt;/strong&gt;&lt;p&gt;&lt;br&gt;&lt;/p&gt;&lt;ul&gt;&lt;li&gt; Bachelors degree in STEM related field&lt;/li&gt;&lt;li&gt; 2+ years of data visualization experience using Tableau, Qlik, Power BI or Looker&lt;/li&gt;&lt;li&gt; 1+ year of experience with analytics, database, or business intelligence in the healthcare field&lt;/li&gt;&lt;li&gt; Strong analytical aptitude and an understanding of statistical methods&lt;/li&gt;&lt;li&gt; Experience with statistical modeling tools using R, Python, or SAS&lt;/li&gt;&lt;li&gt; 1+ years of Strong SQL querying experience both creating and updating and stored procedures&lt;/li&gt;&lt;li&gt; Excellent problem-solving skills&lt;/li&gt;&lt;li&gt; Excellent oral and written communication skills&lt;/li&gt;&lt;li&gt; Desire to improve and expand analytical and data visualization skills with new technology&lt;/li&gt;&lt;/ul&gt;&lt;p&gt;&lt;br&gt;&lt;/p&gt;Interested in hearing more? Easy Apply now by clicking the ""Apply"" button.&lt;p&gt;&lt;br&gt;&lt;/p&gt;&lt;strong&gt;Want to learn more about this role and Jobot?&lt;/strong&gt;&lt;p&gt;&lt;br&gt;&lt;/p&gt;Click our Jobot logo and follow our LinkedIn page!&lt;p&gt;&lt;br&gt;&lt;/p&gt;",Be among the first 25 applicants,1 hour ago,Entry level,FULL_TIME,Information Technology,Staffing and Recruiting,2023-06-22T10:35:06.000Z,"Want to learn more about this role and Jobot? Click our Jobot logo and follow our LinkedIn page!&lt;p&gt;&lt;br&gt;&lt;/p&gt;Job details&lt;p&gt;&lt;br&gt;&lt;/p&gt;&lt;strong&gt;Tech startup looking for a Senior Data Analyst to provide data analysis and visualization for their healthcare clients nationwide!&lt;/strong&gt;&lt;p&gt;&lt;br&gt;&lt;/p&gt;This Jobot Job is hosted by Christine McNamara&lt;p&gt;&lt;br&gt;&lt;/p&gt;Are you a fit? Easy Apply now by clicking the ""Apply"" button and sending us your resume.&lt;p&gt;&lt;br&gt;&lt;/p&gt;Salary $75,000 - $90,000 per year&lt;p&gt;&lt;br&gt;&lt;/p&gt;&lt;strong&gt;A Bit About Us&lt;/strong&gt;&lt;p&gt;&lt;br&gt;&lt;/p&gt;SaaS based tech company that devotes their time to fostering a healthy and diverse work culture is actively looking to bring on a Data Analyst to join their team. They offer tons of room for career growth and advancement, so if you are looking for a role to move forward in your career- this is the role for you.&lt;p&gt;&lt;br&gt;&lt;/p&gt;&lt;strong&gt;&lt;br&gt;&lt;br&gt;&lt;strong&gt;Why join us?&lt;br&gt;&lt;/strong&gt;&lt;/strong&gt;&lt;p&gt;&lt;br&gt;&lt;/p&gt;&lt;ul&gt;&lt;li&gt;100% coverage for medical, dental, and vision&lt;/li&gt;&lt;li&gt;401k with company match&lt;/li&gt;&lt;li&gt;Unlimited PTO&lt;/li&gt;&lt;li&gt;Flexible work schedule&lt;/li&gt;&lt;li&gt;Unlimited snacks&lt;/li&gt;&lt;li&gt;Company outings &amp;amp; volunteering events&lt;/li&gt;&lt;li&gt;Gym Discounts&lt;/li&gt;&lt;li&gt;Annual performance bonuses&lt;/li&gt;&lt;/ul&gt;&lt;p&gt;&lt;br&gt;&lt;/p&gt;&lt;strong&gt;Job Details&lt;/strong&gt;&lt;p&gt;&lt;br&gt;&lt;/p&gt;&lt;ul&gt;&lt;li&gt; Bachelors degree in STEM related field&lt;/li&gt;&lt;li&gt; 2+ years of data visualization experience using Tableau, Qlik, Power BI or Looker&lt;/li&gt;&lt;li&gt; 1+ year of experience with analytics, database, or business intelligence in the healthcare field&lt;/li&gt;&lt;li&gt; Strong analytical aptitude and an understanding of statistical methods&lt;/li&gt;&lt;li&gt; Experience with statistical modeling tools using R, Python, or SAS&lt;/li&gt;&lt;li&gt; 1+ years of Strong SQL querying experience both creating and updating and stored procedures&lt;/li&gt;&lt;li&gt; Excellent problem-solving skills&lt;/li&gt;&lt;li&gt; Excellent oral and written communication skills&lt;/li&gt;&lt;li&gt; Desire to improve and expand analytical and data visualization skills with new technology&lt;/li&gt;&lt;/ul&gt;&lt;p&gt;&lt;br&gt;&lt;/p&gt;Interested in hearing more? Easy Apply now by clicking the ""Apply"" button.&lt;p&gt;&lt;br&gt;&lt;/p&gt;&lt;strong&gt;Want to learn more about this role and Jobot?&lt;/strong&gt;&lt;p&gt;&lt;br&gt;&lt;/p&gt;Click our Jobot logo and follow our LinkedIn page!&lt;p&gt;&lt;br&gt;&lt;/p&gt;",FULL_TIME,Staffing and Recruiting,41.88323,-87.6324,EducationalOccupationalCredential,bachelor degree,OccupationalExperienceRequirements,24,,,
