,date,job_link,title,company,company_link,location,benefit,description,applicant_caption,posted_time_ago,seniority_level,employment_type,job_function,industry,date_posted,description_json,employment_type_json,industry_json,latitude,longitude,education_type,education_category,experience_type,experience_time,job_location_type,location_requirement_type,location_requirement_name
33,2023-05-30,https://www.linkedin.com/jobs/view/business-analyst-at-micasa-global-3620008275?refId=M%2Ft6NtnWHWUORxNTpzu04Q%3D%3D&trackingId=fcMIV%2Bu8PwToPhAA4KXF%2Bg%3D%3D&position=9&pageNum=1&trk=public_jobs_jserp-result_search-card,Business Analyst,Micasa Global,https://www.linkedin.com/company/micasa-global?trk=public_jobs_jserp-result_job-search-card-subtitle,"Chicago, IL",Be an early applicant,"&lt;strong&gt;Job Title: Sr. Systems Engineer &lt;/strong&gt;&lt;p&gt;&lt;br&gt;&lt;/p&gt;&lt;strong&gt;Location: Lisle IL (Day 1 onsite)&lt;/strong&gt;&lt;p&gt;&lt;br&gt;&lt;/p&gt;&lt;strong&gt;Job Type: Permanent/ Contract&lt;/strong&gt;&lt;p&gt;&lt;br&gt;&lt;/p&gt;&lt;strong&gt;&lt;u&gt;Job Descriptions&lt;/u&gt;&lt;/strong&gt;&lt;p&gt;&lt;br&gt;&lt;/p&gt;This position is part of Application algorithm team developing Controls and Software logic for &lt;strong&gt;ECU applications&lt;/strong&gt; including Body Controls and Engine Controls&lt;p&gt;&lt;br&gt;&lt;/p&gt;The Engineer will also have exposure to or participate in the development of closed loop vehicle &lt;strong&gt;HIL system&lt;/strong&gt; that is a critical tool in controls development and test.&lt;p&gt;&lt;br&gt;&lt;/p&gt;&lt;strong&gt;&lt;u&gt;Roles And Responsibilities&lt;/u&gt;&lt;/strong&gt;&lt;p&gt;&lt;br&gt;&lt;/p&gt;&lt;ul&gt;&lt;li&gt;Development of control algorithms utilizing embedded software development process&lt;/li&gt;&lt;li&gt;Define CAN system requirements and interface specifications&lt;/li&gt;&lt;li&gt;Develop vehicle topology / network architecture&lt;/li&gt;&lt;li&gt;Develop Interface Control Documents (ICDs)&lt;/li&gt;&lt;li&gt;Write and/or review system and subsystem specifications and requirements from vehicle/customer level requirements&lt;/li&gt;&lt;li&gt;Development of system requirements, design, simulation, and tests of various mechatronic systems&lt;/li&gt;&lt;li&gt;Development of appropriate documentation to support process compliance&lt;/li&gt;&lt;li&gt;Collaborate with functional safety engineers and integrate safety requirements into system design&lt;/li&gt;&lt;li&gt;Lead / participate in issue resolution activities during development, validation, and vehicle launch&lt;/li&gt;&lt;li&gt;Utilization of systems development tools and processes Embedded software development experience&lt;/li&gt;&lt;li&gt;Engineering tool MatLab, Simulink, MS Visio, INCA calibration tool, Software configuration management tools&lt;/li&gt;&lt;li&gt;Software programming language such as C/C++, embedded software development and testing tools (Canalyzer, HILs etc.)&lt;/li&gt;&lt;/ul&gt;&lt;p&gt;&lt;br&gt;&lt;/p&gt;&lt;strong&gt;&lt;u&gt;Basic Requirements&lt;/u&gt;&lt;/strong&gt;&lt;p&gt;&lt;br&gt;&lt;/p&gt;&lt;ul&gt;&lt;li&gt;Bachelor's degree in Engineering or Engineering Technology&lt;/li&gt;&lt;li&gt;At least 12 years of experience in product design/development or new technologies&lt;/li&gt;&lt;li&gt;At least 2 years of experience leading new technologies or specialized technologies&lt;/li&gt;&lt;/ul&gt;&lt;p&gt;&lt;br&gt;&lt;/p&gt;OR&lt;p&gt;&lt;br&gt;&lt;/p&gt;&lt;ul&gt;&lt;li&gt;Master's degree in Engineering or Engineering Technology&lt;/li&gt;&lt;li&gt;At least 8 years of experience in product design/development or new technologies&lt;/li&gt;&lt;li&gt;At least 2 years of experience leading new technologies or specialized technologies&lt;/li&gt;&lt;/ul&gt;",Be among the first 25 applicants,48 minutes ago,Entry level,CONTRACTOR,Engineering,IT Services and IT Consulting,2023-05-30T11:15:13.000Z,"&lt;strong&gt;Job Title: Sr. Systems Engineer &lt;/strong&gt;&lt;p&gt;&lt;br&gt;&lt;/p&gt;&lt;strong&gt;Location: Lisle IL (Day 1 onsite)&lt;/strong&gt;&lt;p&gt;&lt;br&gt;&lt;/p&gt;&lt;strong&gt;Job Type: Permanent/ Contract&lt;/strong&gt;&lt;p&gt;&lt;br&gt;&lt;/p&gt;&lt;strong&gt;&lt;u&gt;Job Descriptions&lt;/u&gt;&lt;/strong&gt;&lt;p&gt;&lt;br&gt;&lt;/p&gt;This position is part of Application algorithm team developing Controls and Software logic for &lt;strong&gt;ECU applications&lt;/strong&gt; including Body Controls and Engine Controls&lt;p&gt;&lt;br&gt;&lt;/p&gt;The Engineer will also have exposure to or participate in the development of closed loop vehicle &lt;strong&gt;HIL system&lt;/strong&gt; that is a critical tool in controls development and test.&lt;p&gt;&lt;br&gt;&lt;/p&gt;&lt;strong&gt;&lt;u&gt;Roles And Responsibilities&lt;/u&gt;&lt;/strong&gt;&lt;p&gt;&lt;br&gt;&lt;/p&gt;&lt;ul&gt;&lt;li&gt;Development of control algorithms utilizing embedded software development process&lt;/li&gt;&lt;li&gt;Define CAN system requirements and interface specifications&lt;/li&gt;&lt;li&gt;Develop vehicle topology / network architecture&lt;/li&gt;&lt;li&gt;Develop Interface Control Documents (ICDs)&lt;/li&gt;&lt;li&gt;Write and/or review system and subsystem specifications and requirements from vehicle/customer level requirements&lt;/li&gt;&lt;li&gt;Development of system requirements, design, simulation, and tests of various mechatronic systems&lt;/li&gt;&lt;li&gt;Development of appropriate documentation to support process compliance&lt;/li&gt;&lt;li&gt;Collaborate with functional safety engineers and integrate safety requirements into system design&lt;/li&gt;&lt;li&gt;Lead / participate in issue resolution activities during development, validation, and vehicle launch&lt;/li&gt;&lt;li&gt;Utilization of systems development tools and processes Embedded software development experience&lt;/li&gt;&lt;li&gt;Engineering tool MatLab, Simulink, MS Visio, INCA calibration tool, Software configuration management tools&lt;/li&gt;&lt;li&gt;Software programming language such as C/C++, embedded software development and testing tools (Canalyzer, HILs etc.)&lt;/li&gt;&lt;/ul&gt;&lt;p&gt;&lt;br&gt;&lt;/p&gt;&lt;strong&gt;&lt;u&gt;Basic Requirements&lt;/u&gt;&lt;/strong&gt;&lt;p&gt;&lt;br&gt;&lt;/p&gt;&lt;ul&gt;&lt;li&gt;Bachelor's degree in Engineering or Engineering Technology&lt;/li&gt;&lt;li&gt;At least 12 years of experience in product design/development or new technologies&lt;/li&gt;&lt;li&gt;At least 2 years of experience leading new technologies or specialized technologies&lt;/li&gt;&lt;/ul&gt;&lt;p&gt;&lt;br&gt;&lt;/p&gt;OR&lt;p&gt;&lt;br&gt;&lt;/p&gt;&lt;ul&gt;&lt;li&gt;Master's degree in Engineering or Engineering Technology&lt;/li&gt;&lt;li&gt;At least 8 years of experience in product design/development or new technologies&lt;/li&gt;&lt;li&gt;At least 2 years of experience leading new technologies or specialized technologies&lt;/li&gt;&lt;/ul&gt;",CONTRACTOR,IT Services and IT Consulting,41.80125,-88.07478,EducationalOccupationalCredential,bachelor degree,OccupationalExperienceRequirements,144,,,
34,2023-05-30,https://www.linkedin.com/jobs/view/infrastructure-security-engineer-at-winston-strawn-llp-3389745927?refId=M%2Ft6NtnWHWUORxNTpzu04Q%3D%3D&trackingId=a3cxLP1cwKA3NluIxI%2FaqQ%3D%3D&position=10&pageNum=1&trk=public_jobs_jserp-result_search-card,Infrastructure Security Engineer,Winston & Strawn LLP,https://www.linkedin.com/company/winston-&-strawn-llp?trk=public_jobs_jserp-result_job-search-card-subtitle,"Chicago, IL",,"*Position is Bonus eligible*&lt;p&gt;&lt;br&gt;&lt;/p&gt;Prestigious Financial Company is currently seeking a DevOps Kubernetes Engineer. Candidate will be joining the DevOps team and supporting the development efforts for a team that strives for goals that refine and automate the processes needed to support the Software Development Life Cycle (SDLC).&lt;p&gt;&lt;br&gt;&lt;/p&gt;&lt;strong&gt;&lt;u&gt;Responsibilities&lt;/u&gt;&lt;/strong&gt;&lt;p&gt;&lt;br&gt;&lt;/p&gt;&lt;ul&gt;&lt;li&gt;Enable development teams to self-service build and deployment processes through process automation.&lt;/li&gt;&lt;li&gt;Design and implement process improvements across the build, deployment, and monitoring of Clearing applications.&lt;/li&gt;&lt;li&gt;Support the maintenance and configuration of development environments in Kubernetes and AWS.&lt;/li&gt;&lt;li&gt;Develop and support Terraform, Ansible, Harness, and Jenkins jobs used to instantiate and manage development environments.&lt;/li&gt;&lt;/ul&gt;&lt;p&gt;&lt;br&gt;&lt;/p&gt;&lt;strong&gt;&lt;u&gt;Qualifications&lt;/u&gt;&lt;/strong&gt;&lt;p&gt;&lt;br&gt;&lt;/p&gt;&lt;ul&gt;&lt;li&gt;Understanding of Kanban and/or Agile methodologies&lt;/li&gt;&lt;li&gt;Able to succeed in fast-paced environment with frequent changes&lt;/li&gt;&lt;li&gt;Comfortable communicating with both technical and non-technical audiences&lt;/li&gt;&lt;li&gt;Self-starter - takes the initiative to research, learn and deliver&lt;/li&gt;&lt;li&gt;Team player - humble, collaborative, and focused on making sure the entire team succeeds&lt;/li&gt;&lt;li&gt;Programming/Scripting experience in languages like Java, Bash, Python or Go is required.&lt;/li&gt;&lt;li&gt;Knowledge and experience with Continuous Integration and Continuous Delivery (CI/CD) tools (examples - GitHub, Jenkins, Artifactory, Docker, Compose, K8s).&lt;/li&gt;&lt;li&gt;Java development experience is desirable.&lt;/li&gt;&lt;li&gt;Experience with distributed message brokers like Kafka, RabbitMQ, ActiveMQ, Amazon Kinesis, etc.&lt;/li&gt;&lt;li&gt;Experience with cloud technologies and migrations is required.&lt;/li&gt;&lt;li&gt;Experience preferred with AWS foundational services like VPCs, Security groups, EC2, RDS, S3 ACLs, KMS, AWS CLI and IAM etc.&lt;/li&gt;&lt;li&gt;Experience developing and delivering technical solutions using public cloud service providers like Amazon, Google, etc.&lt;/li&gt;&lt;li&gt;Familiarity with monitoring related tools and frameworks like Splunk, ElasticSearch, Prometheus, AppDynamics. Working knowledge of DevOps tools. Eg Terraform, Ansible, Jenkins, Kubernetes, Helm and CI/CD pipeline etc. is required.&lt;/li&gt;&lt;li&gt;Experience with RESTful APIs and JSON RPC. Experience following Git workflows.&lt;/li&gt;&lt;li&gt;BS degree in Computer Science, similar technical field, or equivalent experience&lt;/li&gt;&lt;li&gt;1+ years of experience in building large scale, data-centric solutions&lt;/li&gt;&lt;li&gt;3+ years of experience (recent) participating on a DevOps team or as product owner for DevOps team&lt;/li&gt;&lt;/ul&gt;",Be among the first 25 applicants,13 hours ago,Entry level,FULL_TIME,Engineering and Information Technology,IT Services and IT Consulting,2023-05-29T22:12:16.000Z,"*Position is Bonus eligible*&lt;p&gt;&lt;br&gt;&lt;/p&gt;Prestigious Financial Company is currently seeking a DevOps Kubernetes Engineer. Candidate will be joining the DevOps team and supporting the development efforts for a team that strives for goals that refine and automate the processes needed to support the Software Development Life Cycle (SDLC).&lt;p&gt;&lt;br&gt;&lt;/p&gt;&lt;strong&gt;&lt;u&gt;Responsibilities&lt;/u&gt;&lt;/strong&gt;&lt;p&gt;&lt;br&gt;&lt;/p&gt;&lt;ul&gt;&lt;li&gt;Enable development teams to self-service build and deployment processes through process automation.&lt;/li&gt;&lt;li&gt;Design and implement process improvements across the build, deployment, and monitoring of Clearing applications.&lt;/li&gt;&lt;li&gt;Support the maintenance and configuration of development environments in Kubernetes and AWS.&lt;/li&gt;&lt;li&gt;Develop and support Terraform, Ansible, Harness, and Jenkins jobs used to instantiate and manage development environments.&lt;/li&gt;&lt;/ul&gt;&lt;p&gt;&lt;br&gt;&lt;/p&gt;&lt;strong&gt;&lt;u&gt;Qualifications&lt;/u&gt;&lt;/strong&gt;&lt;p&gt;&lt;br&gt;&lt;/p&gt;&lt;ul&gt;&lt;li&gt;Understanding of Kanban and/or Agile methodologies&lt;/li&gt;&lt;li&gt;Able to succeed in fast-paced environment with frequent changes&lt;/li&gt;&lt;li&gt;Comfortable communicating with both technical and non-technical audiences&lt;/li&gt;&lt;li&gt;Self-starter - takes the initiative to research, learn and deliver&lt;/li&gt;&lt;li&gt;Team player - humble, collaborative, and focused on making sure the entire team succeeds&lt;/li&gt;&lt;li&gt;Programming/Scripting experience in languages like Java, Bash, Python or Go is required.&lt;/li&gt;&lt;li&gt;Knowledge and experience with Continuous Integration and Continuous Delivery (CI/CD) tools (examples - GitHub, Jenkins, Artifactory, Docker, Compose, K8s).&lt;/li&gt;&lt;li&gt;Java development experience is desirable.&lt;/li&gt;&lt;li&gt;Experience with distributed message brokers like Kafka, RabbitMQ, ActiveMQ, Amazon Kinesis, etc.&lt;/li&gt;&lt;li&gt;Experience with cloud technologies and migrations is required.&lt;/li&gt;&lt;li&gt;Experience preferred with AWS foundational services like VPCs, Security groups, EC2, RDS, S3 ACLs, KMS, AWS CLI and IAM etc.&lt;/li&gt;&lt;li&gt;Experience developing and delivering technical solutions using public cloud service providers like Amazon, Google, etc.&lt;/li&gt;&lt;li&gt;Familiarity with monitoring related tools and frameworks like Splunk, ElasticSearch, Prometheus, AppDynamics. Working knowledge of DevOps tools. Eg Terraform, Ansible, Jenkins, Kubernetes, Helm and CI/CD pipeline etc. is required.&lt;/li&gt;&lt;li&gt;Experience with RESTful APIs and JSON RPC. Experience following Git workflows.&lt;/li&gt;&lt;li&gt;BS degree in Computer Science, similar technical field, or equivalent experience&lt;/li&gt;&lt;li&gt;1+ years of experience in building large scale, data-centric solutions&lt;/li&gt;&lt;li&gt;3+ years of experience (recent) participating on a DevOps team or as product owner for DevOps team&lt;/li&gt;&lt;/ul&gt;",FULL_TIME,IT Services and IT Consulting,41.88323,-87.6324,EducationalOccupationalCredential,bachelor degree,OccupationalExperienceRequirements,36,,,
35,2023-05-30,https://www.linkedin.com/jobs/view/test-engineer-at-actalent-3622336529?refId=M%2Ft6NtnWHWUORxNTpzu04Q%3D%3D&trackingId=iobUPKuCEgrfkEG8HOfxxg%3D%3D&position=11&pageNum=1&trk=public_jobs_jserp-result_search-card,Test Engineer,Actalent,https://www.linkedin.com/company/actalentservices?trk=public_jobs_jserp-result_job-search-card-subtitle,"Woodridge, IL",Be an early applicant,"&lt;u&gt;&lt;strong&gt;Position Purpose&lt;br&gt;&lt;br&gt;&lt;/strong&gt;&lt;/u&gt;Development of health monitoring electronics for mechanical systems in the transportation sector.&lt;br&gt;&lt;br&gt;&lt;strong&gt;Essential Functions&lt;br&gt;&lt;/strong&gt;&lt;ul&gt;&lt;li&gt; Develops robust, low-power, wireless condition monitoring sensors&lt;/li&gt;&lt;li&gt; Designs, validates, and ensures production readiness for small signal and power management circuitry and PCBs.&lt;/li&gt;&lt;li&gt; Optimizes power management of wireless sensors. Evaluates code improvements through empirical testing of power draw in various conditions.&lt;/li&gt;&lt;li&gt; Evaluates low-power hardware improvements along with energy storage and management technologies (batteries, super-capacitors, energy harvesting options, etc)&lt;/li&gt;&lt;li&gt; Coordinates the interface of microcontrollers with digital and analog sensors.&lt;/li&gt;&lt;li&gt; Completes interfacing with multiple ICs and systems using standard communication protocols (UART, I2C, SPI, etc.)&lt;/li&gt;&lt;li&gt; Creates PC level utilities for interfacing and debugging the embedded firmware, including program in the C Programming language&lt;/li&gt;&lt;li&gt; Provides and maintains test reports and proper design documentation&lt;/li&gt;&lt;li&gt; Ensures compliance of designs with applicable regulatory standards (RoHS, FCC, etc)&lt;/li&gt;&lt;li&gt; Maintains detailed action item lists for all development programs. Coordinates regular meetings with required resources to review and update program status, goals and action item. Works in conjunction with senior engineering manager to address resource or timing concerns.&lt;/li&gt;&lt;li&gt; Coordinates the technical design and test aspects of new development programs with suppliers and divisions in conjunction with the senior ATG management as required.&lt;/li&gt;&lt;li&gt; Provides continuous improvement through employee development, process improvement and elimination of waste. Helps to assure safety in the office and laboratory.&lt;br&gt;&lt;br&gt;&lt;/li&gt;&lt;/ul&gt;&lt;u&gt;&lt;em&gt;&lt;strong&gt;Education and Training&lt;br&gt;&lt;br&gt;&lt;/strong&gt;&lt;/em&gt;&lt;/u&gt;Bachelor of Science degree in Engineering. Electronics/Electrical/Computer Engineering or Mechatronics preferred&lt;br&gt;&lt;br&gt;The ideal candidate can be entry level or junior level with 1-3 years of experience with the following:&lt;br&gt;&lt;ul&gt;&lt;li&gt; C / C++Programming&lt;/li&gt;&lt;li&gt; Hardware/Software Testing and Debugging&lt;/li&gt;&lt;li&gt; Experience with CANoe or similar CAN software desired&lt;/li&gt;&lt;li&gt; Knowledge of standard communication protocols used on heavy vehicles such as CAN (ISO, J-1939, J-1708), Serial (RS-232, 485).&lt;/li&gt;&lt;li&gt; Experience with wireless data communications including (RF, Bluetooth, Thread, Wi-Fi, etc)&lt;/li&gt;&lt;li&gt; Low-Power Microcontroller Development (preferably with the MSP430)&lt;/li&gt;&lt;li&gt; Circuit Layout (preferably with OrCAD PCB Editor)&lt;/li&gt;&lt;li&gt; Signal Conditioning and data acquisition at the ADC level.&lt;/li&gt;&lt;li&gt; Demonstrated ability to manage major development projects and meet deadlines.&lt;/li&gt;&lt;li&gt; Demonstrated product innovation.&lt;/li&gt;&lt;li&gt; Experience with managing multi-level projects&lt;/li&gt;&lt;li&gt; Experience with sensor technologies in the vehicle industry&lt;br&gt;&lt;br&gt;&lt;/li&gt;&lt;/ul&gt;&lt;strong&gt;Minimum Qualifications&lt;br&gt;&lt;br&gt;&lt;/strong&gt;The following skills are desirable for the position and would help distinguish the candidate:&lt;br&gt;&lt;ul&gt;&lt;li&gt; Software/coding experience: C++, Python, Embedded C, RTOS, Openthread, IPv6, IPv4, IEEE 802.15.4, CoaP Servers&lt;/li&gt;&lt;li&gt; Experience coding ARM based MCU’s, creating embedded C libraries.&lt;/li&gt;&lt;li&gt; Circuit Design and Prototyping (OrCAD, Eagle)&lt;/li&gt;&lt;li&gt; Cybersecurity for wireless electronics&lt;/li&gt;&lt;li&gt; Qualification Standards and Testing Procedures (FCC and Automotive markets)&lt;/li&gt;&lt;li&gt; Development of low-power electronics (battery)&lt;/li&gt;&lt;li&gt; PCB Level Soldering&lt;/li&gt;&lt;li&gt; Knowledge of Circuit Assembly and Mass Production&lt;/li&gt;&lt;li&gt; Position may require some travel up to 10% as needed&lt;br&gt;&lt;br&gt;&lt;/li&gt;&lt;/ul&gt;&lt;em&gt;&lt;strong&gt;Hendrickson is an Equal Opportunity Employer. All qualified applicants will receive consideration for employment without regard to race, color, religion, sex, sexual orientation, gender identity, national origin, disability, or status as a protected veteran.&lt;br&gt;&lt;br&gt;&lt;/strong&gt;&lt;/em&gt;Additional Information&lt;br&gt;&lt;ul&gt;&lt;li&gt;Requisition ID: 2200012U&lt;/li&gt;&lt;/ul&gt;",,1 hour ago,Entry level,FULL_TIME,Engineering and Information Technology,"Motor Vehicle Manufacturing, Industrial Machinery Manufacturing, and Truck Transportation",2023-05-30T10:21:53.000Z,"&lt;u&gt;&lt;strong&gt;Position Purpose&lt;br&gt;&lt;br&gt;&lt;/strong&gt;&lt;/u&gt;Development of health monitoring electronics for mechanical systems in the transportation sector.&lt;br&gt;&lt;br&gt;&lt;strong&gt;Essential Functions&lt;br&gt;&lt;/strong&gt;&lt;ul&gt;&lt;li&gt; Develops robust, low-power, wireless condition monitoring sensors&lt;/li&gt;&lt;li&gt; Designs, validates, and ensures production readiness for small signal and power management circuitry and PCBs.&lt;/li&gt;&lt;li&gt; Optimizes power management of wireless sensors. Evaluates code improvements through empirical testing of power draw in various conditions.&lt;/li&gt;&lt;li&gt; Evaluates low-power hardware improvements along with energy storage and management technologies (batteries, super-capacitors, energy harvesting options, etc)&lt;/li&gt;&lt;li&gt; Coordinates the interface of microcontrollers with digital and analog sensors.&lt;/li&gt;&lt;li&gt; Completes interfacing with multiple ICs and systems using standard communication protocols (UART, I2C, SPI, etc.)&lt;/li&gt;&lt;li&gt; Creates PC level utilities for interfacing and debugging the embedded firmware, including program in the C Programming language&lt;/li&gt;&lt;li&gt; Provides and maintains test reports and proper design documentation&lt;/li&gt;&lt;li&gt; Ensures compliance of designs with applicable regulatory standards (RoHS, FCC, etc)&lt;/li&gt;&lt;li&gt; Maintains detailed action item lists for all development programs. Coordinates regular meetings with required resources to review and update program status, goals and action item. Works in conjunction with senior engineering manager to address resource or timing concerns.&lt;/li&gt;&lt;li&gt; Coordinates the technical design and test aspects of new development programs with suppliers and divisions in conjunction with the senior ATG management as required.&lt;/li&gt;&lt;li&gt; Provides continuous improvement through employee development, process improvement and elimination of waste. Helps to assure safety in the office and laboratory.&lt;br&gt;&lt;br&gt;&lt;/li&gt;&lt;/ul&gt;&lt;u&gt;&lt;em&gt;&lt;strong&gt;Education and Training&lt;br&gt;&lt;br&gt;&lt;/strong&gt;&lt;/em&gt;&lt;/u&gt;Bachelor of Science degree in Engineering. Electronics/Electrical/Computer Engineering or Mechatronics preferred&lt;br&gt;&lt;br&gt;The ideal candidate can be entry level or junior level with 1-3 years of experience with the following:&lt;br&gt;&lt;ul&gt;&lt;li&gt; C / C++Programming&lt;/li&gt;&lt;li&gt; Hardware/Software Testing and Debugging&lt;/li&gt;&lt;li&gt; Experience with CANoe or similar CAN software desired&lt;/li&gt;&lt;li&gt; Knowledge of standard communication protocols used on heavy vehicles such as CAN (ISO, J-1939, J-1708), Serial (RS-232, 485).&lt;/li&gt;&lt;li&gt; Experience with wireless data communications including (RF, Bluetooth, Thread, Wi-Fi, etc)&lt;/li&gt;&lt;li&gt; Low-Power Microcontroller Development (preferably with the MSP430)&lt;/li&gt;&lt;li&gt; Circuit Layout (preferably with OrCAD PCB Editor)&lt;/li&gt;&lt;li&gt; Signal Conditioning and data acquisition at the ADC level.&lt;/li&gt;&lt;li&gt; Demonstrated ability to manage major development projects and meet deadlines.&lt;/li&gt;&lt;li&gt; Demonstrated product innovation.&lt;/li&gt;&lt;li&gt; Experience with managing multi-level projects&lt;/li&gt;&lt;li&gt; Experience with sensor technologies in the vehicle industry&lt;br&gt;&lt;br&gt;&lt;/li&gt;&lt;/ul&gt;&lt;strong&gt;Minimum Qualifications&lt;br&gt;&lt;br&gt;&lt;/strong&gt;The following skills are desirable for the position and would help distinguish the candidate:&lt;br&gt;&lt;ul&gt;&lt;li&gt; Software/coding experience: C++, Python, Embedded C, RTOS, Openthread, IPv6, IPv4, IEEE 802.15.4, CoaP Servers&lt;/li&gt;&lt;li&gt; Experience coding ARM based MCU’s, creating embedded C libraries.&lt;/li&gt;&lt;li&gt; Circuit Design and Prototyping (OrCAD, Eagle)&lt;/li&gt;&lt;li&gt; Cybersecurity for wireless electronics&lt;/li&gt;&lt;li&gt; Qualification Standards and Testing Procedures (FCC and Automotive markets)&lt;/li&gt;&lt;li&gt; Development of low-power electronics (battery)&lt;/li&gt;&lt;li&gt; PCB Level Soldering&lt;/li&gt;&lt;li&gt; Knowledge of Circuit Assembly and Mass Production&lt;/li&gt;&lt;li&gt; Position may require some travel up to 10% as needed&lt;br&gt;&lt;br&gt;&lt;/li&gt;&lt;/ul&gt;&lt;em&gt;&lt;strong&gt;Hendrickson is an Equal Opportunity Employer. All qualified applicants will receive consideration for employment without regard to race, color, religion, sex, sexual orientation, gender identity, national origin, disability, or status as a protected veteran.&lt;br&gt;&lt;br&gt;&lt;/strong&gt;&lt;/em&gt;Additional Information&lt;br&gt;&lt;ul&gt;&lt;li&gt;Requisition ID: 2200012U&lt;/li&gt;&lt;/ul&gt;",FULL_TIME,"Motor Vehicle Manufacturing,Industrial Machinery Manufacturing,Truck Transportation",41.750183,-88.0436,EducationalOccupationalCredential,bachelor degree,OccupationalExperienceRequirements,12,,,
