,date,job_link,title,company,company_link,location,benefit,description,applicant_caption,posted_time_ago,seniority_level,employment_type,job_function,industry,date_posted,description_json,employment_type_json,industry_json,latitude,longitude,education_type,education_category,experience_type,experience_time,job_location_type,location_requirement_type,location_requirement_name
0,2023-07-14,https://www.linkedin.com/jobs/view/entry-level-data-analyst-remote-wfh-at-get-it-recruit-information-technology-3660367823?refId=lsIBEfFUwccbuycEnre28Q%3D%3D&trackingId=Ax%2Fp7cGdHwsXO8cmjEffTQ%3D%3D&position=1&pageNum=0&trk=public_jobs_jserp-result_search-card,Entry Level Data Analyst - Remote | WFH,Get It Recruit - Information Technology,https://www.linkedin.com/company/get-it-recruit-information-technology?trk=public_jobs_jserp-result_job-search-card-subtitle,"Chicago, IL",Be an early applicant,"Are you a recent graduate in Computer Science, Engineering, Mathematics, Statistics, or a related field, eager to kick-start your career in the IT industry? Look no further! We are a leading tech company dedicated to empowering job seekers like you and helping you build successful careers. Join us and unlock a world of opportunities!&lt;br&gt;&lt;br&gt;&lt;strong&gt;&lt;u&gt;Why Choose Us&lt;br&gt;&lt;br&gt;&lt;/u&gt;&lt;/strong&gt;Career Development: We go beyond merely securing you a job; we build careers. Our proven track record since 2010 speaks for itself, with thousands of candidates successfully placed at renowned technology companies such as Apple, Google, Paypal, Western Union, Visa, Walmart Labs, and more.&lt;br&gt;&lt;br&gt;Inclusive Hiring: All positions are open to candidates of all visas and US citizens. We understand the challenges of finding the perfect match between employer requirements and employee skills, and we are here to bridge that gap.&lt;br&gt;&lt;br&gt;Skill Enhancement Programs: We offer comprehensive skill enhancement programs designed to bolster your skills and industry/client experience. Whether you're lacking certain skills, struggling to crack interviews, or aiming to enhance your skill portfolio, we have you covered.&lt;br&gt;&lt;br&gt;Visa Support: We provide assistance with filing for STEM extensions, H1B visas, and Green Cards, ensuring a seamless transition for qualified candidates.&lt;br&gt;&lt;br&gt;&lt;strong&gt;&lt;u&gt;Who Should Apply&lt;br&gt;&lt;br&gt;&lt;/u&gt;&lt;/strong&gt;We enthusiastically welcome recent graduates in Computer Science, Engineering, Mathematics, Statistics, or related fields who are passionate about pursuing a rewarding career in the IT industry. Candidates of all visas and US citizens are encouraged to apply.&lt;br&gt;&lt;br&gt;Candidates can benefit from our skill enhancement programs if they fall into the following categories:&lt;br&gt;&lt;br&gt;Lack Experience: Freshers or those with no actual job experience, we offer hands-on projects with clients to provide real-world exposure.&lt;br&gt;&lt;br&gt;Career Break: Candidates who have taken a break in their careers can regain their momentum by acquiring industry/client experience and skills through our programs.&lt;br&gt;&lt;br&gt;Technical Competency: If you lack specific technical skills that are in high demand, our skill enhancement programs will equip you with the necessary expertise.&lt;br&gt;&lt;br&gt;Different Visa Holders: Candidates on OPT, H4EAD, L2EAD visas seeking employment opportunities and a stable career in the USA can rely on our support.&lt;br&gt;&lt;br&gt;&lt;strong&gt;&lt;u&gt;Join Our Successful Candidates&lt;br&gt;&lt;br&gt;&lt;/u&gt;&lt;/strong&gt;Discover the success stories of our candidates on our website at [insert link to candidate outcomes page]. Watch our team in action at industry events, including Oracle Cloud World and Gartner Data Analytics Summit, on our YouTube channel at [insert YouTube channel link].&lt;br&gt;&lt;br&gt;&lt;strong&gt;&lt;u&gt;How To Apply&lt;br&gt;&lt;br&gt;&lt;/u&gt;&lt;/strong&gt;If you possess the required skills and industry experience, don't hesitate to submit your application. However, if you feel the need for skill enhancement, we encourage you to explore our programs. For assistance with interviews, we have a dedicated section on our website offering helpful resources and interview questions at [insert link].&lt;br&gt;&lt;br&gt;&lt;strong&gt;&lt;u&gt;Job Requirements&lt;br&gt;&lt;br&gt;&lt;/u&gt;&lt;/strong&gt;Java / Software Programmers:&lt;br&gt;&lt;br&gt;Bachelor's or Master's degree in Computer Science, Computer Engineering, Electrical Engineering, Information Systems, or IT.&lt;br&gt;&lt;br&gt;Highly motivated, self-learner, and technically inquisitive.&lt;br&gt;&lt;br&gt;Proficiency in Java and understanding of the software development life cycle.&lt;br&gt;&lt;br&gt;Project work and experience in Core Java, JavaScript, C++, or software programming.&lt;br&gt;&lt;br&gt;Familiarity with Spring Boot, Microservices, Docker, Jenkins, and REST APIs.&lt;br&gt;&lt;br&gt;Excellent written and verbal communication skills.&lt;br&gt;&lt;br&gt;&lt;strong&gt;&lt;u&gt;Data Science / Machine Learning&lt;br&gt;&lt;br&gt;&lt;/u&gt;&lt;/strong&gt;Bachelor's or Master's degree in Computer Science, Computer Engineering, Electrical Engineering, Information Systems, or IT.&lt;br&gt;&lt;br&gt;&lt;strong&gt;&lt;u&gt;Project Work And Experience In The Required Technologies.&lt;br&gt;&lt;br&gt;&lt;/u&gt;&lt;/strong&gt;Highly motivated, self-learner, and technically inquisitive.&lt;br&gt;&lt;br&gt;Proficiency in Java and understanding of the software development life cycle.&lt;br&gt;&lt;br&gt;Knowledge of Statistics, SAS, Python, Computer Vision, and data visualization tools.&lt;br&gt;&lt;br&gt;Excellent written and verbal communication skills.&lt;br&gt;&lt;br&gt;Preferred skills: NLP, Text Mining, Tableau, Power BI, Time Series Analysis.&lt;br&gt;&lt;br&gt;Please note that even for junior or entry-level positions, clients require skills and relevant experience on real-world projects. Additional skills and hands-on experience are vital for candidate selection. If you lack certain skills or project work, we encourage you to consider our skill enhancement programs. We do not accept third-party or c2c candidates.&lt;br&gt;&lt;br&gt;Apply now to embark on an exciting career journey with us!&lt;br&gt;&lt;br&gt;Employment Type: Full-Time&lt;br&gt;&lt;br&gt;Salary: $ 100,000.00 160,000.00 Per Year",Be among the first 25 applicants,3 hours ago,Entry level,FULL_TIME,Information Technology,Human Resources Services,2023-07-14T08:41:19.000Z,"Are you a recent graduate in Computer Science, Engineering, Mathematics, Statistics, or a related field, eager to kick-start your career in the IT industry? Look no further! We are a leading tech company dedicated to empowering job seekers like you and helping you build successful careers. Join us and unlock a world of opportunities!&lt;br&gt;&lt;br&gt;&lt;strong&gt;&lt;u&gt;Why Choose Us&lt;br&gt;&lt;br&gt;&lt;/u&gt;&lt;/strong&gt;Career Development: We go beyond merely securing you a job; we build careers. Our proven track record since 2010 speaks for itself, with thousands of candidates successfully placed at renowned technology companies such as Apple, Google, Paypal, Western Union, Visa, Walmart Labs, and more.&lt;br&gt;&lt;br&gt;Inclusive Hiring: All positions are open to candidates of all visas and US citizens. We understand the challenges of finding the perfect match between employer requirements and employee skills, and we are here to bridge that gap.&lt;br&gt;&lt;br&gt;Skill Enhancement Programs: We offer comprehensive skill enhancement programs designed to bolster your skills and industry/client experience. Whether you're lacking certain skills, struggling to crack interviews, or aiming to enhance your skill portfolio, we have you covered.&lt;br&gt;&lt;br&gt;Visa Support: We provide assistance with filing for STEM extensions, H1B visas, and Green Cards, ensuring a seamless transition for qualified candidates.&lt;br&gt;&lt;br&gt;&lt;strong&gt;&lt;u&gt;Who Should Apply&lt;br&gt;&lt;br&gt;&lt;/u&gt;&lt;/strong&gt;We enthusiastically welcome recent graduates in Computer Science, Engineering, Mathematics, Statistics, or related fields who are passionate about pursuing a rewarding career in the IT industry. Candidates of all visas and US citizens are encouraged to apply.&lt;br&gt;&lt;br&gt;Candidates can benefit from our skill enhancement programs if they fall into the following categories:&lt;br&gt;&lt;br&gt;Lack Experience: Freshers or those with no actual job experience, we offer hands-on projects with clients to provide real-world exposure.&lt;br&gt;&lt;br&gt;Career Break: Candidates who have taken a break in their careers can regain their momentum by acquiring industry/client experience and skills through our programs.&lt;br&gt;&lt;br&gt;Technical Competency: If you lack specific technical skills that are in high demand, our skill enhancement programs will equip you with the necessary expertise.&lt;br&gt;&lt;br&gt;Different Visa Holders: Candidates on OPT, H4EAD, L2EAD visas seeking employment opportunities and a stable career in the USA can rely on our support.&lt;br&gt;&lt;br&gt;&lt;strong&gt;&lt;u&gt;Join Our Successful Candidates&lt;br&gt;&lt;br&gt;&lt;/u&gt;&lt;/strong&gt;Discover the success stories of our candidates on our website at [insert link to candidate outcomes page]. Watch our team in action at industry events, including Oracle Cloud World and Gartner Data Analytics Summit, on our YouTube channel at [insert YouTube channel link].&lt;br&gt;&lt;br&gt;&lt;strong&gt;&lt;u&gt;How To Apply&lt;br&gt;&lt;br&gt;&lt;/u&gt;&lt;/strong&gt;If you possess the required skills and industry experience, don't hesitate to submit your application. However, if you feel the need for skill enhancement, we encourage you to explore our programs. For assistance with interviews, we have a dedicated section on our website offering helpful resources and interview questions at [insert link].&lt;br&gt;&lt;br&gt;&lt;strong&gt;&lt;u&gt;Job Requirements&lt;br&gt;&lt;br&gt;&lt;/u&gt;&lt;/strong&gt;Java / Software Programmers:&lt;br&gt;&lt;br&gt;Bachelor's or Master's degree in Computer Science, Computer Engineering, Electrical Engineering, Information Systems, or IT.&lt;br&gt;&lt;br&gt;Highly motivated, self-learner, and technically inquisitive.&lt;br&gt;&lt;br&gt;Proficiency in Java and understanding of the software development life cycle.&lt;br&gt;&lt;br&gt;Project work and experience in Core Java, JavaScript, C++, or software programming.&lt;br&gt;&lt;br&gt;Familiarity with Spring Boot, Microservices, Docker, Jenkins, and REST APIs.&lt;br&gt;&lt;br&gt;Excellent written and verbal communication skills.&lt;br&gt;&lt;br&gt;&lt;strong&gt;&lt;u&gt;Data Science / Machine Learning&lt;br&gt;&lt;br&gt;&lt;/u&gt;&lt;/strong&gt;Bachelor's or Master's degree in Computer Science, Computer Engineering, Electrical Engineering, Information Systems, or IT.&lt;br&gt;&lt;br&gt;&lt;strong&gt;&lt;u&gt;Project Work And Experience In The Required Technologies.&lt;br&gt;&lt;br&gt;&lt;/u&gt;&lt;/strong&gt;Highly motivated, self-learner, and technically inquisitive.&lt;br&gt;&lt;br&gt;Proficiency in Java and understanding of the software development life cycle.&lt;br&gt;&lt;br&gt;Knowledge of Statistics, SAS, Python, Computer Vision, and data visualization tools.&lt;br&gt;&lt;br&gt;Excellent written and verbal communication skills.&lt;br&gt;&lt;br&gt;Preferred skills: NLP, Text Mining, Tableau, Power BI, Time Series Analysis.&lt;br&gt;&lt;br&gt;Please note that even for junior or entry-level positions, clients require skills and relevant experience on real-world projects. Additional skills and hands-on experience are vital for candidate selection. If you lack certain skills or project work, we encourage you to consider our skill enhancement programs. We do not accept third-party or c2c candidates.&lt;br&gt;&lt;br&gt;Apply now to embark on an exciting career journey with us!&lt;br&gt;&lt;br&gt;Employment Type: Full-Time&lt;br&gt;&lt;br&gt;Salary: $ 100,000.00 160,000.00 Per Year",FULL_TIME,Human Resources Services,41.88323,-87.6324,EducationalOccupationalCredential,bachelor degree,,,TELECOMMUTE,Country,United States
1,2023-07-14,https://www.linkedin.com/jobs/view/data-analyst-at-cays-inc-3662915591?refId=lsIBEfFUwccbuycEnre28Q%3D%3D&trackingId=NafVRfH61JqePDZEBt6vUQ%3D%3D&position=2&pageNum=0&trk=public_jobs_jserp-result_search-card,Data Analyst,CAYS Inc.,https://www.linkedin.com/company/cays-inc?trk=public_jobs_jserp-result_job-search-card-subtitle,"Burr Ridge, IL",Be an early applicant,"We are searching for a data engineer I with python experience who learns quickly and thrives in a fast-paced, innovative environment. The role is to help empower a global technology focused Product Validation team to reliably collect data and deliver product performance insights in the customer use case through the creative use of data. Part of the role also involves helping us build a powerful data platform to provide real data driven value to the Precision Technology group. You will design, develop, and evaluate infrastructure, data processors, and persistence from concept through production stage, and make modifications as needed. The DataOps team is currently fully remote, located in North America, and we are looking to expand our team into Europe to better support the regional Product Validation testing team. Work with teams generating and consuming data to understand the purpose, application, valid states, and interoperability of data needs. Responsible to build and maintain trust with a low error rate by developing data tests that can isolate unhealthy data for accurate analysis and reporting Develop and monitor data pipeline performance, data integrity and usage metrics Identify needs and develop infrastructure to satisfy the data pipeline for consuming data that retains target uptime. Develop data processors to validate data entering the pipeline before it's consumed by end users. May maintain and extend Data Governance and Data catalogs as appropriate. Develop and extend tools to aid in the discovery and reporting of data for system and end user insight. May generate transformed data exports to support other teams. Aid in tracking data utilization to shape enhancements to the Data Catalog. Keep abreast of new developments in the domains of cloud computing and data science. May be called upon to perform comparable duties of a similar or related nature and/or assist in other areas as needed.&lt;br&gt;&lt;br&gt;Minimum of a Bachelor's degree in Engineering, in field related to specific position.&lt;br&gt;&lt;br&gt;Refer to Engineer Level Guide (below) for placement in level: 1- Engineer, 2 Senior Engineer, 3 Staff Engineer, 4 Principal Engineer.&lt;br&gt;&lt;br&gt;Engineering field applicable to this position: Software.&lt;br&gt;&lt;br&gt;Experience with Cloud Computing (Amazon Web Services or Microsoft Azure).&lt;br&gt;&lt;br&gt;Proficiency in Automation, Provisioning, and Orchestration tools (Gitlab Pipelines, Terraform, Ansible, DataKitchen, etc.&lt;br&gt;&lt;br&gt;Understanding of ETL pipelines, streaming services, and storage/access patterns&lt;br&gt;&lt;br&gt;Understanding the development, persistence, and application of Machine Learning datasets is beneficial. Experience writing software to develop efficient pipeline processors; ideally in Python.&lt;br&gt;&lt;br&gt;Big Data specialty certifications are beneficial.&lt;br&gt;&lt;br&gt;Specific skills, proficiencies, and knowledge in field related to position, as identified by department leadership.&lt;br&gt;&lt;br&gt;Ability to apply design theory and methodology.&lt;br&gt;&lt;br&gt;Well-developed problem analysis and problem-solving techniques.&lt;br&gt;&lt;br&gt;Proficiency with a computer, including use of Microsoft Word and Excel.&lt;br&gt;&lt;br&gt;Team player who is self-motivated and has ability to work with minimal supervision. Ability to communicate effectively with team members and leadership staff across a wide variety of specialties.",Be among the first 25 applicants,11 hours ago,Entry level,FULL_TIME,Information Technology,Staffing and Recruiting,2023-07-14T00:30:55.000Z,"We are searching for a data engineer I with python experience who learns quickly and thrives in a fast-paced, innovative environment. The role is to help empower a global technology focused Product Validation team to reliably collect data and deliver product performance insights in the customer use case through the creative use of data. Part of the role also involves helping us build a powerful data platform to provide real data driven value to the Precision Technology group. You will design, develop, and evaluate infrastructure, data processors, and persistence from concept through production stage, and make modifications as needed. The DataOps team is currently fully remote, located in North America, and we are looking to expand our team into Europe to better support the regional Product Validation testing team. Work with teams generating and consuming data to understand the purpose, application, valid states, and interoperability of data needs. Responsible to build and maintain trust with a low error rate by developing data tests that can isolate unhealthy data for accurate analysis and reporting Develop and monitor data pipeline performance, data integrity and usage metrics Identify needs and develop infrastructure to satisfy the data pipeline for consuming data that retains target uptime. Develop data processors to validate data entering the pipeline before it's consumed by end users. May maintain and extend Data Governance and Data catalogs as appropriate. Develop and extend tools to aid in the discovery and reporting of data for system and end user insight. May generate transformed data exports to support other teams. Aid in tracking data utilization to shape enhancements to the Data Catalog. Keep abreast of new developments in the domains of cloud computing and data science. May be called upon to perform comparable duties of a similar or related nature and/or assist in other areas as needed.&lt;br&gt;&lt;br&gt;Minimum of a Bachelor's degree in Engineering, in field related to specific position.&lt;br&gt;&lt;br&gt;Refer to Engineer Level Guide (below) for placement in level: 1- Engineer, 2 Senior Engineer, 3 Staff Engineer, 4 Principal Engineer.&lt;br&gt;&lt;br&gt;Engineering field applicable to this position: Software.&lt;br&gt;&lt;br&gt;Experience with Cloud Computing (Amazon Web Services or Microsoft Azure).&lt;br&gt;&lt;br&gt;Proficiency in Automation, Provisioning, and Orchestration tools (Gitlab Pipelines, Terraform, Ansible, DataKitchen, etc.&lt;br&gt;&lt;br&gt;Understanding of ETL pipelines, streaming services, and storage/access patterns&lt;br&gt;&lt;br&gt;Understanding the development, persistence, and application of Machine Learning datasets is beneficial. Experience writing software to develop efficient pipeline processors; ideally in Python.&lt;br&gt;&lt;br&gt;Big Data specialty certifications are beneficial.&lt;br&gt;&lt;br&gt;Specific skills, proficiencies, and knowledge in field related to position, as identified by department leadership.&lt;br&gt;&lt;br&gt;Ability to apply design theory and methodology.&lt;br&gt;&lt;br&gt;Well-developed problem analysis and problem-solving techniques.&lt;br&gt;&lt;br&gt;Proficiency with a computer, including use of Microsoft Word and Excel.&lt;br&gt;&lt;br&gt;Team player who is self-motivated and has ability to work with minimal supervision. Ability to communicate effectively with team members and leadership staff across a wide variety of specialties.",FULL_TIME,Staffing and Recruiting,41.74564,-87.91868,EducationalOccupationalCredential,bachelor degree,,,,,
