,date,job_link,title,company,company_link,location,benefit,description,applicant_caption,posted_time_ago,seniority_level,employment_type,job_function,industry,date_posted,description_json,employment_type_json,industry_json,latitude,longitude,education_type,education_category,experience_type,experience_time,job_location_type,location_requirement_type,location_requirement_name
0,2023-05-11,https://www.linkedin.com/jobs/view/gbcare-data-insights-analyst-at-gallagher-3598859952?refId=dvMPscB9MN5Cfn4PSX79eQ%3D%3D&trackingId=y20LTb1ij2G2FRueXP88yA%3D%3D&position=1&pageNum=0&trk=public_jobs_jserp-result_search-card,GBCARE Data Insights Analyst,Gallagher,https://www.linkedin.com/company/gallagher-global?trk=public_jobs_jserp-result_job-search-card-subtitle,"Rolling Meadows, IL",Be an early applicant,"This role is focused on answering complex questions by generating hypotheses and quantitatively testing them and identifying opportunities for specific companies to get workers back to work faster.  Essential responsibilities include: generating analyses and reports related to clients inquiries and GB internal requests; packaging and presenting insights from analyses to clients and/or executive team, conducting primary and/or secondary research to identify required data to solve a given business question, and writing white papers on trends that impact the insurance or workers compensation industries.  Minimal direct management oversight required.  Little or no direct client involvement.&lt;p&gt; &lt;br&gt;&lt;br&gt;&lt;/p&gt;Required: Bachelor's degree and a minimum of 1 year professional experience. Prior experience in a quantitative field, through internships or other consultative work, and/or demonstrated ability to perform independent quantitative analyses of a moderate to highly complex nature accepted in lieu of full experience.  Less than 20% travel.&lt;br&gt;&lt;br&gt;&lt;br&gt;&lt;br&gt;Preferred: Master's/MBA degree; Strong academic credentials.  Proficient with Excel and PowerPoint, &lt;br&gt;familiarity with Access or enterprise database programs a plus.&lt;br&gt;&lt;br&gt;&lt;br&gt;&lt;br&gt;Behaviors:  Critical Thinking, Complex Problem Solving, Deductive Reasoning, Mathematical Reasoning, Excellent Judgment &amp;amp; Decision Making skills, and Excellent Communication Skills",Be among the first 25 applicants,20 hours ago,Entry level,FULL_TIME,"Research, Analyst, and Information Technology",Insurance,2023-05-10T18:12:00.000Z,"This role is focused on answering complex questions by generating hypotheses and quantitatively testing them and identifying opportunities for specific companies to get workers back to work faster.  Essential responsibilities include: generating analyses and reports related to clients inquiries and GB internal requests; packaging and presenting insights from analyses to clients and/or executive team, conducting primary and/or secondary research to identify required data to solve a given business question, and writing white papers on trends that impact the insurance or workers compensation industries.  Minimal direct management oversight required.  Little or no direct client involvement.&lt;p&gt; &lt;br&gt;&lt;br&gt;&lt;/p&gt;Required: Bachelor's degree and a minimum of 1 year professional experience. Prior experience in a quantitative field, through internships or other consultative work, and/or demonstrated ability to perform independent quantitative analyses of a moderate to highly complex nature accepted in lieu of full experience.  Less than 20% travel.&lt;br&gt;&lt;br&gt;&lt;br&gt;&lt;br&gt;Preferred: Master's/MBA degree; Strong academic credentials.  Proficient with Excel and PowerPoint, &lt;br&gt;familiarity with Access or enterprise database programs a plus.&lt;br&gt;&lt;br&gt;&lt;br&gt;&lt;br&gt;Behaviors:  Critical Thinking, Complex Problem Solving, Deductive Reasoning, Mathematical Reasoning, Excellent Judgment &amp;amp; Decision Making skills, and Excellent Communication Skills",FULL_TIME,Insurance,42.080162,-88.02519,,,OccupationalExperienceRequirements,12,,,
1,2023-05-11,https://www.linkedin.com/jobs/view/data-analyst-operations-engineering-at-invenergy-llc-3603446948?refId=dvMPscB9MN5Cfn4PSX79eQ%3D%3D&trackingId=0bIzBHQI3E1KHu36z8m1zw%3D%3D&position=2&pageNum=0&trk=public_jobs_jserp-result_search-card,"Data Analyst, Operations Engineering",Invenergy LLC,https://www.linkedin.com/company/invenergy-llc?trk=public_jobs_jserp-result_job-search-card-subtitle,"Chicago, IL",Be an early applicant,"Invenergy drives innovation in energy. Powered by decades of entrepreneurial experience and unparalleled execution, we solve the energy challenges facing our customers and communities. We provide power generation and storage solutions at scale around the world to create a cleaner energy future. We develop. We build. We own. We operate. We are Invenergy.&lt;br&gt;&lt;br&gt;&lt;strong&gt;&lt;u&gt;Job Description&lt;br&gt;&lt;br&gt;&lt;/u&gt;&lt;/strong&gt;&lt;strong&gt;Job Description&lt;br&gt;&lt;br&gt;&lt;/strong&gt;&lt;strong&gt;&lt;u&gt;Data Analyst, Operations Engineering&lt;br&gt;&lt;br&gt;&lt;/u&gt;&lt;/strong&gt;&lt;strong&gt;&lt;u&gt;About Invenergy&lt;br&gt;&lt;br&gt;&lt;/u&gt;&lt;/strong&gt;Invenergy drives innovation in energy. Powered by decades of entrepreneurial experience and unparalleled execution, we solve the energy challenges facing our customers and communities. We provide power generation and storage solutions at scale around the world to create a cleaner energy future. We develop. We build. We own. We operate. We are Invenergy.&lt;br&gt;&lt;br&gt;&lt;strong&gt;&lt;u&gt;Position Overview&lt;br&gt;&lt;br&gt;&lt;/u&gt;&lt;/strong&gt;The Data Analyst, Operations Engineering primarily provides technical support to a large operating fleet of renewable energy projects by transforming data into actionable insights &amp;amp; business intelligence, administering support for analytics tools and platforms, optimizing fleet performance, and guiding data-driven decisions.&lt;br&gt;&lt;br&gt;&lt;strong&gt;&lt;u&gt;Core Responsibilities&lt;br&gt;&lt;/u&gt;&lt;/strong&gt;&lt;ul&gt;&lt;li&gt;Support cross-functional administrative &amp;amp; operational needs for digital data &amp;amp; analytics platform&lt;/li&gt;&lt;li&gt;Collaborate closely with operations engineering, asset management, and site technician teams&lt;/li&gt;&lt;li&gt;Curate metrics, KPI’s, and reports that transform equipment information into operational intelligence &lt;/li&gt;&lt;li&gt;Manage recurring reporting processes and identify actionable items&lt;/li&gt;&lt;li&gt;Perform ad-hoc analyses to quantify energy and revenue impact from operational events&lt;/li&gt;&lt;li&gt;Design and maintain dashboards to drive actionable insights &lt;/li&gt;&lt;li&gt;Support regulatory reporting requirements such as NERC GADS &lt;br&gt;&lt;/li&gt;&lt;/ul&gt;&lt;strong&gt;&lt;u&gt;Required Skills&lt;br&gt;&lt;/u&gt;&lt;/strong&gt;&lt;ul&gt;&lt;li&gt;Bachelor’s degree in a technical discipline, engineering preferred&lt;/li&gt;&lt;li&gt;Proficiency with Excel and Microsoft Office&lt;/li&gt;&lt;li&gt;Proficiency with business intelligence tools such as Power BI or Tableau&lt;/li&gt;&lt;li&gt;Strong communication skills&lt;br&gt;&lt;/li&gt;&lt;/ul&gt;&lt;strong&gt;&lt;u&gt;Preferred Skills&lt;br&gt;&lt;/u&gt;&lt;/strong&gt;&lt;ul&gt;&lt;li&gt;Familiarity with utility-scale wind, solar, natural gas, or battery storage technology and operations&lt;/li&gt;&lt;li&gt;Familiarity with the OSIsoft PI software suite&lt;/li&gt;&lt;li&gt;Familiarity with database environments &amp;amp; query languages (SQL preferred)&lt;/li&gt;&lt;li&gt;Familiarity with Python or other programming experience&lt;br&gt;&lt;/li&gt;&lt;/ul&gt;&lt;strong&gt;&lt;u&gt;Benefits&lt;br&gt;&lt;br&gt;&lt;/u&gt;&lt;/strong&gt;Eligible for medical, dental, vision, 401(k), profit sharing, bonus, paid time off, etc.&lt;br&gt;&lt;br&gt;Invenergy LLC is an equal opportunity employer. All qualified applicants will receive consideration for employment without regard to, among other things, race, color, religion, sex, sexual orientation, gender identity, national origin, age, status as a protected veteran, or disability.",Be among the first 25 applicants,12 hours ago,Entry level,FULL_TIME,Information Technology,Renewable Energy Semiconductor Manufacturing,2023-05-11T02:08:13.000Z,"Invenergy drives innovation in energy. Powered by decades of entrepreneurial experience and unparalleled execution, we solve the energy challenges facing our customers and communities. We provide power generation and storage solutions at scale around the world to create a cleaner energy future. We develop. We build. We own. We operate. We are Invenergy.&lt;br&gt;&lt;br&gt;&lt;strong&gt;&lt;u&gt;Job Description&lt;br&gt;&lt;br&gt;&lt;/u&gt;&lt;/strong&gt;&lt;strong&gt;Job Description&lt;br&gt;&lt;br&gt;&lt;/strong&gt;&lt;strong&gt;&lt;u&gt;Data Analyst, Operations Engineering&lt;br&gt;&lt;br&gt;&lt;/u&gt;&lt;/strong&gt;&lt;strong&gt;&lt;u&gt;About Invenergy&lt;br&gt;&lt;br&gt;&lt;/u&gt;&lt;/strong&gt;Invenergy drives innovation in energy. Powered by decades of entrepreneurial experience and unparalleled execution, we solve the energy challenges facing our customers and communities. We provide power generation and storage solutions at scale around the world to create a cleaner energy future. We develop. We build. We own. We operate. We are Invenergy.&lt;br&gt;&lt;br&gt;&lt;strong&gt;&lt;u&gt;Position Overview&lt;br&gt;&lt;br&gt;&lt;/u&gt;&lt;/strong&gt;The Data Analyst, Operations Engineering primarily provides technical support to a large operating fleet of renewable energy projects by transforming data into actionable insights &amp;amp; business intelligence, administering support for analytics tools and platforms, optimizing fleet performance, and guiding data-driven decisions.&lt;br&gt;&lt;br&gt;&lt;strong&gt;&lt;u&gt;Core Responsibilities&lt;br&gt;&lt;/u&gt;&lt;/strong&gt;&lt;ul&gt;&lt;li&gt;Support cross-functional administrative &amp;amp; operational needs for digital data &amp;amp; analytics platform&lt;/li&gt;&lt;li&gt;Collaborate closely with operations engineering, asset management, and site technician teams&lt;/li&gt;&lt;li&gt;Curate metrics, KPI’s, and reports that transform equipment information into operational intelligence &lt;/li&gt;&lt;li&gt;Manage recurring reporting processes and identify actionable items&lt;/li&gt;&lt;li&gt;Perform ad-hoc analyses to quantify energy and revenue impact from operational events&lt;/li&gt;&lt;li&gt;Design and maintain dashboards to drive actionable insights &lt;/li&gt;&lt;li&gt;Support regulatory reporting requirements such as NERC GADS &lt;br&gt;&lt;/li&gt;&lt;/ul&gt;&lt;strong&gt;&lt;u&gt;Required Skills&lt;br&gt;&lt;/u&gt;&lt;/strong&gt;&lt;ul&gt;&lt;li&gt;Bachelor’s degree in a technical discipline, engineering preferred&lt;/li&gt;&lt;li&gt;Proficiency with Excel and Microsoft Office&lt;/li&gt;&lt;li&gt;Proficiency with business intelligence tools such as Power BI or Tableau&lt;/li&gt;&lt;li&gt;Strong communication skills&lt;br&gt;&lt;/li&gt;&lt;/ul&gt;&lt;strong&gt;&lt;u&gt;Preferred Skills&lt;br&gt;&lt;/u&gt;&lt;/strong&gt;&lt;ul&gt;&lt;li&gt;Familiarity with utility-scale wind, solar, natural gas, or battery storage technology and operations&lt;/li&gt;&lt;li&gt;Familiarity with the OSIsoft PI software suite&lt;/li&gt;&lt;li&gt;Familiarity with database environments &amp;amp; query languages (SQL preferred)&lt;/li&gt;&lt;li&gt;Familiarity with Python or other programming experience&lt;br&gt;&lt;/li&gt;&lt;/ul&gt;&lt;strong&gt;&lt;u&gt;Benefits&lt;br&gt;&lt;br&gt;&lt;/u&gt;&lt;/strong&gt;Eligible for medical, dental, vision, 401(k), profit sharing, bonus, paid time off, etc.&lt;br&gt;&lt;br&gt;Invenergy LLC is an equal opportunity employer. All qualified applicants will receive consideration for employment without regard to, among other things, race, color, religion, sex, sexual orientation, gender identity, national origin, age, status as a protected veteran, or disability.",FULL_TIME,Renewable Energy Semiconductor Manufacturing,41.88323,-87.6324,EducationalOccupationalCredential,bachelor degree,,,,,
2,2023-05-11,https://www.linkedin.com/jobs/view/junior-data-migration-specialist-freelance-remote-at-braintrust-3603314859?refId=dvMPscB9MN5Cfn4PSX79eQ%3D%3D&trackingId=VlQsI3QWLqAaqFzvIVWORw%3D%3D&position=3&pageNum=0&trk=public_jobs_jserp-result_search-card,Junior Data Migration Specialist - Freelance [Remote],Braintrust,https://www.linkedin.com/company/usebraintrust?trk=public_jobs_jserp-result_job-search-card-subtitle,"Chicago, IL",Actively Hiring,"&lt;strong&gt;Discover. A brighter future.&lt;/strong&gt;&lt;p&gt;&lt;br&gt;&lt;/p&gt;With us, you’ll do meaningful work from Day 1. Our collaborative culture is built on three core behaviors: We Play to Win, We Get Better Every Day &amp;amp; We Succeed Together. And we mean it — we want you to grow and make a difference at one of the world's leading digital banking and payments companies. We value what makes you unique so that you have an opportunity to shine.&lt;p&gt;&lt;br&gt;&lt;/p&gt;Come build your future, while being the reason millions of people find a brighter financial future with Discover.&lt;p&gt;&lt;br&gt;&lt;/p&gt;&lt;strong&gt;Job Description:&lt;/strong&gt;&lt;p&gt;&lt;br&gt;&lt;/p&gt;&lt;ul&gt;&lt;li&gt;Develops and troubleshoots data integration solutions with complex data transformations and provides guidance to other team members&lt;/li&gt;&lt;li&gt;Influences other team members to achieve commitments per guidance from Chapter Leads and actively contributes to agile ceremonies&lt;/li&gt;&lt;li&gt;Demonstrates strong technical aptitude across data engineering practices&lt;/li&gt;&lt;li&gt;Utilizing variety of tools to profile, secure the data in transit and at rest; and to enforce data Governance Controls and Alerting&lt;/li&gt;&lt;li&gt;Designing advanced SQL queries&lt;/li&gt;&lt;li&gt;Leveraging metadata-driven framework for solutions&lt;/li&gt;&lt;li&gt;Developing test scripts for unit and integration testing&lt;/li&gt;&lt;li&gt;Develops test methodologies for specific products&lt;/li&gt;&lt;li&gt;Leads code review sessions and other process and operational improvement initiatives&lt;/li&gt;&lt;li&gt;Exhibits fluency with use of supplemental tools and technologies involved in data integration (Unix/Linux, TWS/Control-M or alike, BI stack)&lt;/li&gt;&lt;li&gt;Works on holistic solutions, driving feature and story delivery (Agile)&lt;/li&gt;&lt;li&gt;Identifies and effectively communicates upstream and downstream impacts for changes in the data pipeline&lt;/li&gt;&lt;li&gt;Participates in the on-call rotation for support&lt;/li&gt;&lt;li&gt;Demonstrates effective and clear communication in team and cross-functional meetings, and lead tech communities&lt;/li&gt;&lt;li&gt;Builds strong collaborative working relationship both within the team and cross-functionally&lt;/li&gt;&lt;/ul&gt;&lt;p&gt;&lt;br&gt;&lt;/p&gt;&lt;strong&gt;Minimum Qualifications&lt;/strong&gt;&lt;p&gt;&lt;br&gt;&lt;/p&gt;&lt;strong&gt;At a minimum, here’s what we need from you:&lt;/strong&gt;&lt;p&gt;&lt;br&gt;&lt;/p&gt;&lt;ul&gt;&lt;li&gt; Bachelor's Degree in Computer Science or related field&lt;/li&gt;&lt;li&gt; 3+ years of experience in Data Platform Administration/Engineering&lt;/li&gt;&lt;li&gt; Internal applicants only: technical proficiency rating of competent on the Dreyfus engineering scale&lt;/li&gt;&lt;/ul&gt;&lt;p&gt;&lt;br&gt;&lt;/p&gt;&lt;strong&gt;Preferred Qualifications&lt;/strong&gt;&lt;p&gt;&lt;br&gt;&lt;/p&gt;&lt;strong&gt;If we had our say, we’d also look for:&lt;/strong&gt;&lt;p&gt;&lt;br&gt;&lt;/p&gt;&lt;ul&gt;&lt;li&gt; ETL/ELT Tools (AbInitio, DataStage, Informatica)&lt;/li&gt;&lt;li&gt; Cloud Tools and Databases (AWS, Snowflake)&lt;/li&gt;&lt;li&gt; Other programming languages (Unix scripting, Python, etc.)&lt;/li&gt;&lt;li&gt; Leverage CI/CD framework for data integration, Open Source&lt;/li&gt;&lt;li&gt; Experience working in cloud platforms (AWS, GCP, Azure)&lt;/li&gt;&lt;li&gt; Basic understanding of key infrastructure concepts (data centers as well as cloud hosting platform) to support business data needs&lt;/li&gt;&lt;li&gt; Experience optimizing SQL both relational and nosql&lt;/li&gt;&lt;/ul&gt;&lt;p&gt;&lt;br&gt;&lt;/p&gt;External applicants will be required to perform a technical interview.&lt;p&gt;&lt;br&gt;&lt;/p&gt;&lt;strong&gt;Compensation:&lt;/strong&gt;&lt;p&gt;&lt;br&gt;&lt;/p&gt;The base pay for this position generally ranges between $84,500.00 to $142,500.00. Additional incentives may be provided as part of a market competitive total compensation package. Factors, such as but not limited to, geographical location, relevant experience, education, and skill level may impact the pay for this position.&lt;p&gt;&lt;br&gt;&lt;/p&gt;&lt;strong&gt;&lt;strong&gt;&lt;strong&gt;Benefits:&lt;/strong&gt;&lt;/strong&gt;&lt;/strong&gt;&lt;p&gt;&lt;br&gt;&lt;/p&gt;We also offer a range of benefits and programs based on eligibility. These benefits include:&lt;p&gt;&lt;br&gt;&lt;/p&gt;&lt;ul&gt;&lt;li&gt;Paid Parental Leave&lt;/li&gt;&lt;li&gt;Paid Time Off&lt;/li&gt;&lt;li&gt;401(k) Plan&lt;/li&gt;&lt;li&gt;Medical, Dental, Vision, &amp;amp; Health Savings Account&lt;/li&gt;&lt;li&gt;STD, Life, LTD and AD&amp;amp;D&lt;/li&gt;&lt;li&gt;Recognition Program&lt;/li&gt;&lt;li&gt;Education Assistance&lt;/li&gt;&lt;li&gt;Commuter Benefits&lt;/li&gt;&lt;li&gt;Family Support Programs&lt;/li&gt;&lt;li&gt;Employee Stock Purchase Plan&lt;/li&gt;&lt;/ul&gt;&lt;p&gt;&lt;br&gt;&lt;/p&gt;Learn more at MyDiscoverBenefits.com.&lt;p&gt;&lt;br&gt;&lt;/p&gt;What are you waiting for? Apply today!&lt;p&gt;&lt;br&gt;&lt;/p&gt;All Discover employees place our customers at the very center of our work. To deliver on our promises to our customers, each of us contribute every day to a culture that values compliance and risk management.&lt;p&gt;&lt;br&gt;&lt;/p&gt;Discover is committed to a diverse and inclusive workplace. Discover is an equal opportunity employer and does not discriminate on the basis of race, color, religion, sex, sexual orientation, gender identity, national origin, age, disability, protected veteran status, or other legally protected status. (Know Your Rights)&lt;p&gt;&lt;br&gt;&lt;/p&gt;",Be among the first 25 applicants,8 hours ago,Entry level,FULL_TIME,Information Technology,"Banking, Financial Services, and Hospitality",2023-05-11T05:45:21.000Z,"&lt;strong&gt;Discover. A brighter future.&lt;/strong&gt;&lt;p&gt;&lt;br&gt;&lt;/p&gt;With us, you’ll do meaningful work from Day 1. Our collaborative culture is built on three core behaviors: We Play to Win, We Get Better Every Day &amp;amp; We Succeed Together. And we mean it — we want you to grow and make a difference at one of the world's leading digital banking and payments companies. We value what makes you unique so that you have an opportunity to shine.&lt;p&gt;&lt;br&gt;&lt;/p&gt;Come build your future, while being the reason millions of people find a brighter financial future with Discover.&lt;p&gt;&lt;br&gt;&lt;/p&gt;&lt;strong&gt;Job Description:&lt;/strong&gt;&lt;p&gt;&lt;br&gt;&lt;/p&gt;&lt;ul&gt;&lt;li&gt;Develops and troubleshoots data integration solutions with complex data transformations and provides guidance to other team members&lt;/li&gt;&lt;li&gt;Influences other team members to achieve commitments per guidance from Chapter Leads and actively contributes to agile ceremonies&lt;/li&gt;&lt;li&gt;Demonstrates strong technical aptitude across data engineering practices&lt;/li&gt;&lt;li&gt;Utilizing variety of tools to profile, secure the data in transit and at rest; and to enforce data Governance Controls and Alerting&lt;/li&gt;&lt;li&gt;Designing advanced SQL queries&lt;/li&gt;&lt;li&gt;Leveraging metadata-driven framework for solutions&lt;/li&gt;&lt;li&gt;Developing test scripts for unit and integration testing&lt;/li&gt;&lt;li&gt;Develops test methodologies for specific products&lt;/li&gt;&lt;li&gt;Leads code review sessions and other process and operational improvement initiatives&lt;/li&gt;&lt;li&gt;Exhibits fluency with use of supplemental tools and technologies involved in data integration (Unix/Linux, TWS/Control-M or alike, BI stack)&lt;/li&gt;&lt;li&gt;Works on holistic solutions, driving feature and story delivery (Agile)&lt;/li&gt;&lt;li&gt;Identifies and effectively communicates upstream and downstream impacts for changes in the data pipeline&lt;/li&gt;&lt;li&gt;Participates in the on-call rotation for support&lt;/li&gt;&lt;li&gt;Demonstrates effective and clear communication in team and cross-functional meetings, and lead tech communities&lt;/li&gt;&lt;li&gt;Builds strong collaborative working relationship both within the team and cross-functionally&lt;/li&gt;&lt;/ul&gt;&lt;p&gt;&lt;br&gt;&lt;/p&gt;&lt;strong&gt;Minimum Qualifications&lt;/strong&gt;&lt;p&gt;&lt;br&gt;&lt;/p&gt;&lt;strong&gt;At a minimum, here’s what we need from you:&lt;/strong&gt;&lt;p&gt;&lt;br&gt;&lt;/p&gt;&lt;ul&gt;&lt;li&gt; Bachelor's Degree in Computer Science or related field&lt;/li&gt;&lt;li&gt; 3+ years of experience in Data Platform Administration/Engineering&lt;/li&gt;&lt;li&gt; Internal applicants only: technical proficiency rating of competent on the Dreyfus engineering scale&lt;/li&gt;&lt;/ul&gt;&lt;p&gt;&lt;br&gt;&lt;/p&gt;&lt;strong&gt;Preferred Qualifications&lt;/strong&gt;&lt;p&gt;&lt;br&gt;&lt;/p&gt;&lt;strong&gt;If we had our say, we’d also look for:&lt;/strong&gt;&lt;p&gt;&lt;br&gt;&lt;/p&gt;&lt;ul&gt;&lt;li&gt; ETL/ELT Tools (AbInitio, DataStage, Informatica)&lt;/li&gt;&lt;li&gt; Cloud Tools and Databases (AWS, Snowflake)&lt;/li&gt;&lt;li&gt; Other programming languages (Unix scripting, Python, etc.)&lt;/li&gt;&lt;li&gt; Leverage CI/CD framework for data integration, Open Source&lt;/li&gt;&lt;li&gt; Experience working in cloud platforms (AWS, GCP, Azure)&lt;/li&gt;&lt;li&gt; Basic understanding of key infrastructure concepts (data centers as well as cloud hosting platform) to support business data needs&lt;/li&gt;&lt;li&gt; Experience optimizing SQL both relational and nosql&lt;/li&gt;&lt;/ul&gt;&lt;p&gt;&lt;br&gt;&lt;/p&gt;External applicants will be required to perform a technical interview.&lt;p&gt;&lt;br&gt;&lt;/p&gt;&lt;strong&gt;Compensation:&lt;/strong&gt;&lt;p&gt;&lt;br&gt;&lt;/p&gt;The base pay for this position generally ranges between $84,500.00 to $142,500.00. Additional incentives may be provided as part of a market competitive total compensation package. Factors, such as but not limited to, geographical location, relevant experience, education, and skill level may impact the pay for this position.&lt;p&gt;&lt;br&gt;&lt;/p&gt;&lt;strong&gt;&lt;strong&gt;&lt;strong&gt;Benefits:&lt;/strong&gt;&lt;/strong&gt;&lt;/strong&gt;&lt;p&gt;&lt;br&gt;&lt;/p&gt;We also offer a range of benefits and programs based on eligibility. These benefits include:&lt;p&gt;&lt;br&gt;&lt;/p&gt;&lt;ul&gt;&lt;li&gt;Paid Parental Leave&lt;/li&gt;&lt;li&gt;Paid Time Off&lt;/li&gt;&lt;li&gt;401(k) Plan&lt;/li&gt;&lt;li&gt;Medical, Dental, Vision, &amp;amp; Health Savings Account&lt;/li&gt;&lt;li&gt;STD, Life, LTD and AD&amp;amp;D&lt;/li&gt;&lt;li&gt;Recognition Program&lt;/li&gt;&lt;li&gt;Education Assistance&lt;/li&gt;&lt;li&gt;Commuter Benefits&lt;/li&gt;&lt;li&gt;Family Support Programs&lt;/li&gt;&lt;li&gt;Employee Stock Purchase Plan&lt;/li&gt;&lt;/ul&gt;&lt;p&gt;&lt;br&gt;&lt;/p&gt;Learn more at MyDiscoverBenefits.com.&lt;p&gt;&lt;br&gt;&lt;/p&gt;What are you waiting for? Apply today!&lt;p&gt;&lt;br&gt;&lt;/p&gt;All Discover employees place our customers at the very center of our work. To deliver on our promises to our customers, each of us contribute every day to a culture that values compliance and risk management.&lt;p&gt;&lt;br&gt;&lt;/p&gt;Discover is committed to a diverse and inclusive workplace. Discover is an equal opportunity employer and does not discriminate on the basis of race, color, religion, sex, sexual orientation, gender identity, national origin, age, disability, protected veteran status, or other legally protected status. (Know Your Rights)&lt;p&gt;&lt;br&gt;&lt;/p&gt;",FULL_TIME,"Banking,Financial Services,Hospitality",42.16751,-87.896996,EducationalOccupationalCredential,bachelor degree,OccupationalExperienceRequirements,36,,,
