,date,job_link,title,company,company_link,location,benefit,description,applicant_caption,posted_time_ago,seniority_level,employment_type,job_function,industry,date_posted,description_json,employment_type_json,industry_json,latitude,longitude,education_type,education_category,experience_type,experience_time,job_location_type,location_requirement_type,location_requirement_name
0,2023-06-11,https://www.linkedin.com/jobs/view/junior-infrastructure-engineer-at-epic-3509893117?refId=drxUP2Y31UuDczhWPOuSTA%3D%3D&trackingId=G25UopI2WPjMYM2%2Ffqy%2F4A%3D%3D&position=1&pageNum=0&trk=public_jobs_jserp-result_search-card,Junior Infrastructure Engineer,Epic,https://www.linkedin.com/company/epic1979?trk=public_jobs_jserp-result_job-search-card-subtitle,"Chicago, IL",Actively Hiring,"We are looking for a talented Server Infrastructure Engineer to join our multi-tenant hosting team. As a team member for our server team, you'll provide design and implementation support of our large x86 server infrastructure in the US and the UK. You'll build and manage complex data center interoperability and configuration. Additionally, you'll troubleshoot performance issues that require hands-on experience with OS Support (VMware, Windows, Linux), Servers (Blade, rack-mount), storage, and networking. Learn more about the team at https //careers.epic.com/Jobs/Hosting.&lt;p&gt;&lt;br&gt;&lt;/p&gt;&lt;strong&gt;More than just important work&lt;/strong&gt;.&lt;p&gt;&lt;br&gt;&lt;/p&gt;Epic is located in Madison, Wisconsin, a city regularly ranked as one of America's best places to live. Epic's environment is one of continuous learning; you'll have access to opportunities to expand your skill set and share your knowledge with others. We offer comprehensive benefits to keep you healthy and happy as you grow in your life and career, and your merit-based compensation will reflect the impact your work has on the company and our customers. You'll also be eligible for annual raises and bonuses, as well as stock grants, which give you an even greater stake in the success of Epic and our customers. Epic is an Equal Opportunity employer. We seek diverse perspectives, backgrounds, and experiences in our mission to improve healthcare. Research has shown that job-seekers who are women, LGBTQ+, or members of the global majority are less likely to apply for roles they don't seem completely qualified for, so we encourage all who are interested to apply. Please see our full non-discrimination statement at https //careers.epic.com/EEO.&lt;p&gt;&lt;br&gt;&lt;/p&gt;This position features three different starting points, based upon prior experience. All relevant backgrounds are considered.&lt;p&gt;&lt;br&gt;&lt;/p&gt;&lt;em&gt;Junior Infrastructure Engineer&lt;/em&gt; requires 0-2 years of the following&lt;p&gt;&lt;br&gt;&lt;/p&gt;&lt;em&gt;Server Infrastructure Engineer&lt;/em&gt; requires 2-5 years of the following&lt;p&gt;&lt;br&gt;&lt;/p&gt;&lt;em&gt;Senior Infrastructure Engineer&lt;/em&gt; requires 5+ years of the following&lt;p&gt;&lt;br&gt;&lt;/p&gt;&lt;ul&gt;&lt;li&gt;Hands-on administration and troubleshooting experience with blade, rack-mount, and virtual server infrastructure&lt;/li&gt;&lt;li&gt;Experience with server management products such as Cisco UCS Central, Lenovo xClarity Administrator, or Dell OpenManage Enterprise&lt;/li&gt;&lt;li&gt;Practical application of scripting languages such as PowerShell, Go, or Python&lt;/li&gt;&lt;li&gt;Server resource capacity management and system tuning&lt;/li&gt;&lt;/ul&gt;&lt;p&gt;&lt;br&gt;&lt;/p&gt;&lt;strong&gt;&lt;u&gt;Other Preferred Skills And Experience&lt;/u&gt;&lt;/strong&gt;&lt;p&gt;&lt;br&gt;&lt;/p&gt;&lt;ul&gt;&lt;li&gt;Experience with Cisco's Unified Computing System (B/C Series and Fabric Interconnects), Dell, or Lenovo servers&lt;/li&gt;&lt;li&gt;Knowledge of VMware HA, DRS, and server/storage VMotion&lt;/li&gt;&lt;li&gt;Experience troubleshooting Server side SAN and network configurations&lt;/li&gt;&lt;li&gt;Experience in replacing CPUs, DIMMs, power supplies, or other server hardware&lt;/li&gt;&lt;li&gt;Certifications in one or more of the following is a plus VCP, CCNA-DC, CCNP-DC&lt;/li&gt;&lt;/ul&gt;&lt;p&gt;&lt;br&gt;&lt;/p&gt;&lt;strong&gt;&lt;u&gt;Other Requirements&lt;/u&gt;&lt;/strong&gt;&lt;p&gt;&lt;br&gt;&lt;/p&gt;&lt;ul&gt;&lt;li&gt;Relocation to Madison, WI (reimbursed)&lt;/li&gt;&lt;li&gt;Eligibility to work in the U.S. without visa sponsorship&lt;/li&gt;&lt;li&gt;COVID-19 vaccination&lt;/li&gt;&lt;/ul&gt;&lt;p&gt;&lt;br&gt;&lt;/p&gt;As a member of the Hosting team at Epic you'll be responsible for the confidentiality, integrity, and availability of Epic Hosting. Those responsibilities include:&lt;p&gt;&lt;br&gt;&lt;/p&gt;&lt;ul&gt;&lt;li&gt;Following policies and procedures and escalating when policies or procedures are not followed&lt;/li&gt;&lt;li&gt;Escalating potential security incidents and providing relevant information&lt;/li&gt;&lt;li&gt;Meeting all security responsibilities defined in policies and procedures&lt;/li&gt;&lt;/ul&gt;",,23 hours ago,Entry level,FULL_TIME,Information Technology,"Computer Networking, Computer and Network Security, and Information Technology & Services",2023-06-10T12:53:00.000Z,"We are looking for a talented Server Infrastructure Engineer to join our multi-tenant hosting team. As a team member for our server team, you'll provide design and implementation support of our large x86 server infrastructure in the US and the UK. You'll build and manage complex data center interoperability and configuration. Additionally, you'll troubleshoot performance issues that require hands-on experience with OS Support (VMware, Windows, Linux), Servers (Blade, rack-mount), storage, and networking. Learn more about the team at https //careers.epic.com/Jobs/Hosting.&lt;p&gt;&lt;br&gt;&lt;/p&gt;&lt;strong&gt;More than just important work&lt;/strong&gt;.&lt;p&gt;&lt;br&gt;&lt;/p&gt;Epic is located in Madison, Wisconsin, a city regularly ranked as one of America's best places to live. Epic's environment is one of continuous learning; you'll have access to opportunities to expand your skill set and share your knowledge with others. We offer comprehensive benefits to keep you healthy and happy as you grow in your life and career, and your merit-based compensation will reflect the impact your work has on the company and our customers. You'll also be eligible for annual raises and bonuses, as well as stock grants, which give you an even greater stake in the success of Epic and our customers. Epic is an Equal Opportunity employer. We seek diverse perspectives, backgrounds, and experiences in our mission to improve healthcare. Research has shown that job-seekers who are women, LGBTQ+, or members of the global majority are less likely to apply for roles they don't seem completely qualified for, so we encourage all who are interested to apply. Please see our full non-discrimination statement at https //careers.epic.com/EEO.&lt;p&gt;&lt;br&gt;&lt;/p&gt;This position features three different starting points, based upon prior experience. All relevant backgrounds are considered.&lt;p&gt;&lt;br&gt;&lt;/p&gt;&lt;em&gt;Junior Infrastructure Engineer&lt;/em&gt; requires 0-2 years of the following&lt;p&gt;&lt;br&gt;&lt;/p&gt;&lt;em&gt;Server Infrastructure Engineer&lt;/em&gt; requires 2-5 years of the following&lt;p&gt;&lt;br&gt;&lt;/p&gt;&lt;em&gt;Senior Infrastructure Engineer&lt;/em&gt; requires 5+ years of the following&lt;p&gt;&lt;br&gt;&lt;/p&gt;&lt;ul&gt;&lt;li&gt;Hands-on administration and troubleshooting experience with blade, rack-mount, and virtual server infrastructure&lt;/li&gt;&lt;li&gt;Experience with server management products such as Cisco UCS Central, Lenovo xClarity Administrator, or Dell OpenManage Enterprise&lt;/li&gt;&lt;li&gt;Practical application of scripting languages such as PowerShell, Go, or Python&lt;/li&gt;&lt;li&gt;Server resource capacity management and system tuning&lt;/li&gt;&lt;/ul&gt;&lt;p&gt;&lt;br&gt;&lt;/p&gt;&lt;strong&gt;&lt;u&gt;Other Preferred Skills And Experience&lt;/u&gt;&lt;/strong&gt;&lt;p&gt;&lt;br&gt;&lt;/p&gt;&lt;ul&gt;&lt;li&gt;Experience with Cisco's Unified Computing System (B/C Series and Fabric Interconnects), Dell, or Lenovo servers&lt;/li&gt;&lt;li&gt;Knowledge of VMware HA, DRS, and server/storage VMotion&lt;/li&gt;&lt;li&gt;Experience troubleshooting Server side SAN and network configurations&lt;/li&gt;&lt;li&gt;Experience in replacing CPUs, DIMMs, power supplies, or other server hardware&lt;/li&gt;&lt;li&gt;Certifications in one or more of the following is a plus VCP, CCNA-DC, CCNP-DC&lt;/li&gt;&lt;/ul&gt;&lt;p&gt;&lt;br&gt;&lt;/p&gt;&lt;strong&gt;&lt;u&gt;Other Requirements&lt;/u&gt;&lt;/strong&gt;&lt;p&gt;&lt;br&gt;&lt;/p&gt;&lt;ul&gt;&lt;li&gt;Relocation to Madison, WI (reimbursed)&lt;/li&gt;&lt;li&gt;Eligibility to work in the U.S. without visa sponsorship&lt;/li&gt;&lt;li&gt;COVID-19 vaccination&lt;/li&gt;&lt;/ul&gt;&lt;p&gt;&lt;br&gt;&lt;/p&gt;As a member of the Hosting team at Epic you'll be responsible for the confidentiality, integrity, and availability of Epic Hosting. Those responsibilities include:&lt;p&gt;&lt;br&gt;&lt;/p&gt;&lt;ul&gt;&lt;li&gt;Following policies and procedures and escalating when policies or procedures are not followed&lt;/li&gt;&lt;li&gt;Escalating potential security incidents and providing relevant information&lt;/li&gt;&lt;li&gt;Meeting all security responsibilities defined in policies and procedures&lt;/li&gt;&lt;/ul&gt;",FULL_TIME,"Computer Networking,Computer and Network Security,Information Technology &amp; Services",41.88323,-87.6324,EducationalOccupationalCredential,bachelor degree,OccupationalExperienceRequirements,60,,,
1,2023-06-11,https://www.linkedin.com/jobs/view/junior-windows-engineer-at-epic-3509823348?refId=drxUP2Y31UuDczhWPOuSTA%3D%3D&trackingId=4fpMjEG3fU0jj8E4fL6O7Q%3D%3D&position=2&pageNum=0&trk=public_jobs_jserp-result_search-card,Junior Windows Engineer,Epic,https://www.linkedin.com/company/epic1979?trk=public_jobs_jserp-result_job-search-card-subtitle,"Chicago, IL",Actively Hiring,"We are looking for a Windows Engineer to join our multi-tenant hosting team. You’ll be responsible for the design, implementation, and health of our domain architecture including but not limited to Active Directory, authentication technologies, and DNS. As part of Epic's hosting team, you'll enjoy opportunities to keep abreast of the latest technologies and work collaboratively with experts in a variety of knowledge areas to ensure a robust and secure environment that forms the foundation of our hosting service. Learn more about the team at https //careers.epic.com/Jobs/Hosting.&lt;p&gt;&lt;br&gt;&lt;/p&gt;&lt;strong&gt;&lt;u&gt;Desired Skills And Knowledge Areas&lt;/u&gt;&lt;/strong&gt;&lt;p&gt;&lt;br&gt;&lt;/p&gt;&lt;ul&gt;&lt;li&gt; Expertise in Active Directory design and maintenance&lt;/li&gt;&lt;li&gt; Expertise in automation using scripting tools like Powershell&lt;/li&gt;&lt;li&gt; Experience with AD trusts and replication&lt;/li&gt;&lt;li&gt; Experience administering Azure Active Directory and Azure Active Directory Connect&lt;/li&gt;&lt;li&gt; Experience with deployment and troubleshooting of DNS &amp;amp; DHCP&lt;/li&gt;&lt;li&gt; Knowledge of configuration management tools like Puppet, Chef, or Ansible&lt;/li&gt;&lt;li&gt; Knowledge of Active Directory Federation Services&lt;/li&gt;&lt;li&gt; Knowledge of authentication technologies Kerberos, LDAP, SAML&lt;/li&gt;&lt;/ul&gt;&lt;p&gt;&lt;br&gt;&lt;/p&gt;&lt;strong&gt;More than just important work&lt;/strong&gt;.&lt;p&gt;&lt;br&gt;&lt;/p&gt;Epic is located in Madison, Wisconsin, a city regularly ranked as one of America's best places to live. Epic's environment is one of continuous learning; you'll have access to opportunities to expand your skill set and share your knowledge with others. We offer comprehensive benefits to keep you healthy and happy as you grow in your life and career, and your merit-based compensation will reflect the impact your work has on the company and our customers. You'll also be eligible for annual raises and bonuses, as well as stock grants, which give you an even greater stake in the success of Epic and our customers. Epic is an Equal Opportunity employer. We seek diverse perspectives, backgrounds, and experiences in our mission to improve healthcare. Research has shown that job-seekers who are women, LGBTQ+, or members of the global majority are less likely to apply for roles they don't seem completely qualified for, so we encourage all who are interested to apply. Please see our full non-discrimination statement at https //careers.epic.com/EEO.&lt;p&gt;&lt;br&gt;&lt;/p&gt;This position features three different starting points, based upon prior experience.&lt;p&gt;&lt;br&gt;&lt;/p&gt;&lt;em&gt;Junior Windows Engineer&lt;/em&gt; requires 0-2 years prior experience&lt;p&gt;&lt;br&gt;&lt;/p&gt;&lt;em&gt;Windows Engineer&lt;/em&gt; requires 2-5 years prior experience&lt;p&gt;&lt;br&gt;&lt;/p&gt;&lt;em&gt;Senior Windows Engineer&lt;/em&gt; requires 5+ years prior experience&lt;p&gt;&lt;br&gt;&lt;/p&gt;&lt;strong&gt;&lt;u&gt;Additional Requirements&lt;/u&gt;&lt;/strong&gt;&lt;p&gt;&lt;br&gt;&lt;/p&gt;&lt;ul&gt;&lt;li&gt;A history of academic and professional success&lt;/li&gt;&lt;li&gt;Eligibility to work in the U.S. without visa sponsorship.&lt;/li&gt;&lt;li&gt;Troubleshooting skills and good customer service are required&lt;/li&gt;&lt;li&gt;Relocation to the Madison, WI, area (reimbursed)&lt;/li&gt;&lt;li&gt;Available to work 1st, 2nd, or 3rd shift&lt;/li&gt;&lt;li&gt;COVID-19 vaccination&lt;/li&gt;&lt;/ul&gt;&lt;p&gt;&lt;br&gt;&lt;/p&gt;As a member of the Hosting team at Epic you'll be responsible for the confidentiality, integrity, and availability of Epic Hosting. Those responsibilities include:&lt;p&gt;&lt;br&gt;&lt;/p&gt;&lt;ul&gt;&lt;li&gt;Following policies and procedures and escalating when policies or procedures are not followed&lt;/li&gt;&lt;li&gt;Escalating potential security incidents and providing relevant information&lt;/li&gt;&lt;li&gt;Meeting all security responsibilities defined in policies and procedures&lt;/li&gt;&lt;/ul&gt;",,21 hours ago,Entry level,FULL_TIME,Information Technology,Information Services and Information Technology & Services,2023-06-10T14:06:46.000Z,"We are looking for a Windows Engineer to join our multi-tenant hosting team. You’ll be responsible for the design, implementation, and health of our domain architecture including but not limited to Active Directory, authentication technologies, and DNS. As part of Epic's hosting team, you'll enjoy opportunities to keep abreast of the latest technologies and work collaboratively with experts in a variety of knowledge areas to ensure a robust and secure environment that forms the foundation of our hosting service. Learn more about the team at https //careers.epic.com/Jobs/Hosting.&lt;p&gt;&lt;br&gt;&lt;/p&gt;&lt;strong&gt;&lt;u&gt;Desired Skills And Knowledge Areas&lt;/u&gt;&lt;/strong&gt;&lt;p&gt;&lt;br&gt;&lt;/p&gt;&lt;ul&gt;&lt;li&gt; Expertise in Active Directory design and maintenance&lt;/li&gt;&lt;li&gt; Expertise in automation using scripting tools like Powershell&lt;/li&gt;&lt;li&gt; Experience with AD trusts and replication&lt;/li&gt;&lt;li&gt; Experience administering Azure Active Directory and Azure Active Directory Connect&lt;/li&gt;&lt;li&gt; Experience with deployment and troubleshooting of DNS &amp;amp; DHCP&lt;/li&gt;&lt;li&gt; Knowledge of configuration management tools like Puppet, Chef, or Ansible&lt;/li&gt;&lt;li&gt; Knowledge of Active Directory Federation Services&lt;/li&gt;&lt;li&gt; Knowledge of authentication technologies Kerberos, LDAP, SAML&lt;/li&gt;&lt;/ul&gt;&lt;p&gt;&lt;br&gt;&lt;/p&gt;&lt;strong&gt;More than just important work&lt;/strong&gt;.&lt;p&gt;&lt;br&gt;&lt;/p&gt;Epic is located in Madison, Wisconsin, a city regularly ranked as one of America's best places to live. Epic's environment is one of continuous learning; you'll have access to opportunities to expand your skill set and share your knowledge with others. We offer comprehensive benefits to keep you healthy and happy as you grow in your life and career, and your merit-based compensation will reflect the impact your work has on the company and our customers. You'll also be eligible for annual raises and bonuses, as well as stock grants, which give you an even greater stake in the success of Epic and our customers. Epic is an Equal Opportunity employer. We seek diverse perspectives, backgrounds, and experiences in our mission to improve healthcare. Research has shown that job-seekers who are women, LGBTQ+, or members of the global majority are less likely to apply for roles they don't seem completely qualified for, so we encourage all who are interested to apply. Please see our full non-discrimination statement at https //careers.epic.com/EEO.&lt;p&gt;&lt;br&gt;&lt;/p&gt;This position features three different starting points, based upon prior experience.&lt;p&gt;&lt;br&gt;&lt;/p&gt;&lt;em&gt;Junior Windows Engineer&lt;/em&gt; requires 0-2 years prior experience&lt;p&gt;&lt;br&gt;&lt;/p&gt;&lt;em&gt;Windows Engineer&lt;/em&gt; requires 2-5 years prior experience&lt;p&gt;&lt;br&gt;&lt;/p&gt;&lt;em&gt;Senior Windows Engineer&lt;/em&gt; requires 5+ years prior experience&lt;p&gt;&lt;br&gt;&lt;/p&gt;&lt;strong&gt;&lt;u&gt;Additional Requirements&lt;/u&gt;&lt;/strong&gt;&lt;p&gt;&lt;br&gt;&lt;/p&gt;&lt;ul&gt;&lt;li&gt;A history of academic and professional success&lt;/li&gt;&lt;li&gt;Eligibility to work in the U.S. without visa sponsorship.&lt;/li&gt;&lt;li&gt;Troubleshooting skills and good customer service are required&lt;/li&gt;&lt;li&gt;Relocation to the Madison, WI, area (reimbursed)&lt;/li&gt;&lt;li&gt;Available to work 1st, 2nd, or 3rd shift&lt;/li&gt;&lt;li&gt;COVID-19 vaccination&lt;/li&gt;&lt;/ul&gt;&lt;p&gt;&lt;br&gt;&lt;/p&gt;As a member of the Hosting team at Epic you'll be responsible for the confidentiality, integrity, and availability of Epic Hosting. Those responsibilities include:&lt;p&gt;&lt;br&gt;&lt;/p&gt;&lt;ul&gt;&lt;li&gt;Following policies and procedures and escalating when policies or procedures are not followed&lt;/li&gt;&lt;li&gt;Escalating potential security incidents and providing relevant information&lt;/li&gt;&lt;li&gt;Meeting all security responsibilities defined in policies and procedures&lt;/li&gt;&lt;/ul&gt;",FULL_TIME,"Information Services,Information Technology &amp; Services",41.88323,-87.6324,EducationalOccupationalCredential,bachelor degree,OccupationalExperienceRequirements,60,,,
2,2023-06-11,https://www.linkedin.com/jobs/view/data-engineer-at-dice-3625474777?refId=drxUP2Y31UuDczhWPOuSTA%3D%3D&trackingId=WksOuPaG1CjGtgCDf7cvOA%3D%3D&position=3&pageNum=0&trk=public_jobs_jserp-result_search-card,Data Engineer,Dice,https://www.linkedin.com/company/dice?trk=public_jobs_jserp-result_job-search-card-subtitle,"Lisle, IL",Be an early applicant,"We are looking for a Data Engineer to join a Logistics company with an office in Naperville. This is a dynamic and innovative company at the forefront of revolutionizing the transportation industry by partnering with 5-star carriers and security/law enforcement to ensure timely delivery for high-priority cargo.&lt;p&gt;&lt;br&gt;&lt;/p&gt;In this role you'll be focusing on building ETL solutions, web apps using Python/Django, and deploying with Azure cloud. Required Skills &amp;amp; Experience&lt;p&gt;&lt;br&gt;&lt;/p&gt;&lt;ul&gt;&lt;li&gt;Bachelor's degree in Computer Science, Engineering, or a related field.&lt;/li&gt;&lt;li&gt;Proven experience as a Data Engineer, with a focus on data modeling, ETL processes, and data integration.&lt;/li&gt;&lt;li&gt;Strong programming skills in Python and experience with Django framework.&lt;/li&gt;&lt;li&gt;Proficiency in cloud platforms, particularly Microsoft Azure, and familiarity with Azure data services.&lt;/li&gt;&lt;li&gt;Hands-on experience with Snaplogic or similar data integration tools.&lt;/li&gt;&lt;/ul&gt; Desired Skills &amp;amp; Experience&lt;p&gt;&lt;br&gt;&lt;/p&gt;&lt;ul&gt;&lt;li&gt;Experience in the logistics or supply chain industry is a plus.&lt;/li&gt;&lt;li&gt;Knowledge of data visualization tools (e.g., Power BI, Tableau) is advantageous.&lt;/li&gt;&lt;li&gt;Familiarity with big data technologies (e.g., Hadoop, Spark) is a bonus.&lt;/li&gt;&lt;li&gt;Familiarity with Machine Learning is a bonus&lt;/li&gt;&lt;/ul&gt; The Offer&lt;p&gt;&lt;br&gt;&lt;/p&gt;&lt;ul&gt;&lt;li&gt;Bonus OR Commission eligible&lt;/li&gt;&lt;/ul&gt; You will receive the following benefits:&lt;p&gt;&lt;br&gt;&lt;/p&gt;&lt;ul&gt;&lt;li&gt;Medical Insurance &lt;/li&gt;&lt;li&gt;Dental Benefits&lt;/li&gt;&lt;li&gt;Vision Benefits&lt;/li&gt;&lt;li&gt;Paid Time Off (PTO)&lt;/li&gt;&lt;li&gt;401(k) {including match- if applicable}&lt;/li&gt;&lt;/ul&gt;&lt;p&gt;&lt;br&gt;&lt;/p&gt;Applicants must be currently authorized to work in the US on a full-time basis now and in the future.",Be among the first 25 applicants,3 hours ago,Entry level,FULL_TIME,Information Technology,"Technology, Information and Internet",2023-06-11T08:56:54.000Z,"We are looking for a Data Engineer to join a Logistics company with an office in Naperville. This is a dynamic and innovative company at the forefront of revolutionizing the transportation industry by partnering with 5-star carriers and security/law enforcement to ensure timely delivery for high-priority cargo.&lt;p&gt;&lt;br&gt;&lt;/p&gt;In this role you'll be focusing on building ETL solutions, web apps using Python/Django, and deploying with Azure cloud. Required Skills &amp;amp; Experience&lt;p&gt;&lt;br&gt;&lt;/p&gt;&lt;ul&gt;&lt;li&gt;Bachelor's degree in Computer Science, Engineering, or a related field.&lt;/li&gt;&lt;li&gt;Proven experience as a Data Engineer, with a focus on data modeling, ETL processes, and data integration.&lt;/li&gt;&lt;li&gt;Strong programming skills in Python and experience with Django framework.&lt;/li&gt;&lt;li&gt;Proficiency in cloud platforms, particularly Microsoft Azure, and familiarity with Azure data services.&lt;/li&gt;&lt;li&gt;Hands-on experience with Snaplogic or similar data integration tools.&lt;/li&gt;&lt;/ul&gt; Desired Skills &amp;amp; Experience&lt;p&gt;&lt;br&gt;&lt;/p&gt;&lt;ul&gt;&lt;li&gt;Experience in the logistics or supply chain industry is a plus.&lt;/li&gt;&lt;li&gt;Knowledge of data visualization tools (e.g., Power BI, Tableau) is advantageous.&lt;/li&gt;&lt;li&gt;Familiarity with big data technologies (e.g., Hadoop, Spark) is a bonus.&lt;/li&gt;&lt;li&gt;Familiarity with Machine Learning is a bonus&lt;/li&gt;&lt;/ul&gt; The Offer&lt;p&gt;&lt;br&gt;&lt;/p&gt;&lt;ul&gt;&lt;li&gt;Bonus OR Commission eligible&lt;/li&gt;&lt;/ul&gt; You will receive the following benefits:&lt;p&gt;&lt;br&gt;&lt;/p&gt;&lt;ul&gt;&lt;li&gt;Medical Insurance &lt;/li&gt;&lt;li&gt;Dental Benefits&lt;/li&gt;&lt;li&gt;Vision Benefits&lt;/li&gt;&lt;li&gt;Paid Time Off (PTO)&lt;/li&gt;&lt;li&gt;401(k) {including match- if applicable}&lt;/li&gt;&lt;/ul&gt;&lt;p&gt;&lt;br&gt;&lt;/p&gt;Applicants must be currently authorized to work in the US on a full-time basis now and in the future.",FULL_TIME,"Technology, Information and Internet",41.80125,-88.07478,EducationalOccupationalCredential,bachelor degree,,,,,
