,date,job_link,title,company,company_link,location,benefit,description,applicant_caption,posted_time_ago,seniority_level,employment_type,job_function,industry,date_posted,description_json,employment_type_json,industry_json,latitude,longitude,education_type,education_category,experience_type,experience_time,job_location_type,location_requirement_type,location_requirement_name
0,2023-07-15,https://www.linkedin.com/jobs/view/data-analyst-at-cays-inc-3661558549?refId=BI%2F07r6F2pnOj%2BxxbndMag%3D%3D&trackingId=sBLnKSyanu9PMSlr3B30JQ%3D%3D&position=1&pageNum=0&trk=public_jobs_jserp-result_search-card,Data Analyst,CAYS Inc.,https://www.linkedin.com/company/cays-inc?trk=public_jobs_jserp-result_job-search-card-subtitle,"Burr Ridge, IL",Be an early applicant,"We are searching for a data engineer I with python experience who learns quickly and thrives in a fast-paced, innovative environment. The role is to help empower a global technology focused Product Validation team to reliably collect data and deliver product performance insights in the customer use case through the creative use of data. Part of the role also involves helping us build a powerful data platform to provide real data driven value to the Precision Technology group. You will design, develop, and evaluate infrastructure, data processors, and persistence from concept through production stage, and make modifications as needed. The DataOps team is currently fully remote, located in North America, and we are looking to expand our team into Europe to better support the regional Product Validation testing team. Work with teams generating and consuming data to understand the purpose, application, valid states, and interoperability of data needs. Responsible to build and maintain trust with a low error rate by developing data tests that can isolate unhealthy data for accurate analysis and reporting Develop and monitor data pipeline performance, data integrity and usage metrics Identify needs and develop infrastructure to satisfy the data pipeline for consuming data that retains target uptime. Develop data processors to validate data entering the pipeline before it's consumed by end users. May maintain and extend Data Governance and Data catalogs as appropriate. Develop and extend tools to aid in the discovery and reporting of data for system and end user insight. May generate transformed data exports to support other teams. Aid in tracking data utilization to shape enhancements to the Data Catalog. Keep abreast of new developments in the domains of cloud computing and data science. May be called upon to perform comparable duties of a similar or related nature and/or assist in other areas as needed.&lt;br&gt;&lt;br&gt;Minimum of a Bachelor's degree in Engineering, in field related to specific position.&lt;br&gt;&lt;br&gt;Refer to Engineer Level Guide (below) for placement in level: 1- Engineer, 2 Senior Engineer, 3 Staff Engineer, 4 Principal Engineer.&lt;br&gt;&lt;br&gt;Engineering field applicable to this position: Software.&lt;br&gt;&lt;br&gt;Experience with Cloud Computing (Amazon Web Services or Microsoft Azure).&lt;br&gt;&lt;br&gt;Proficiency in Automation, Provisioning, and Orchestration tools (Gitlab Pipelines, Terraform, Ansible, DataKitchen, etc.&lt;br&gt;&lt;br&gt;Understanding of ETL pipelines, streaming services, and storage/access patterns&lt;br&gt;&lt;br&gt;Understanding the development, persistence, and application of Machine Learning datasets is beneficial. Experience writing software to develop efficient pipeline processors; ideally in Python.&lt;br&gt;&lt;br&gt;Big Data specialty certifications are beneficial.&lt;br&gt;&lt;br&gt;Specific skills, proficiencies, and knowledge in field related to position, as identified by department leadership.&lt;br&gt;&lt;br&gt;Ability to apply design theory and methodology.&lt;br&gt;&lt;br&gt;Well-developed problem analysis and problem-solving techniques.&lt;br&gt;&lt;br&gt;Proficiency with a computer, including use of Microsoft Word and Excel.&lt;br&gt;&lt;br&gt;Team player who is self-motivated and has ability to work with minimal supervision. Ability to communicate effectively with team members and leadership staff across a wide variety of specialties.",Be among the first 25 applicants,5 hours ago,Entry level,FULL_TIME,Information Technology,Staffing and Recruiting,2023-07-15T06:25:55.000Z,"We are searching for a data engineer I with python experience who learns quickly and thrives in a fast-paced, innovative environment. The role is to help empower a global technology focused Product Validation team to reliably collect data and deliver product performance insights in the customer use case through the creative use of data. Part of the role also involves helping us build a powerful data platform to provide real data driven value to the Precision Technology group. You will design, develop, and evaluate infrastructure, data processors, and persistence from concept through production stage, and make modifications as needed. The DataOps team is currently fully remote, located in North America, and we are looking to expand our team into Europe to better support the regional Product Validation testing team. Work with teams generating and consuming data to understand the purpose, application, valid states, and interoperability of data needs. Responsible to build and maintain trust with a low error rate by developing data tests that can isolate unhealthy data for accurate analysis and reporting Develop and monitor data pipeline performance, data integrity and usage metrics Identify needs and develop infrastructure to satisfy the data pipeline for consuming data that retains target uptime. Develop data processors to validate data entering the pipeline before it's consumed by end users. May maintain and extend Data Governance and Data catalogs as appropriate. Develop and extend tools to aid in the discovery and reporting of data for system and end user insight. May generate transformed data exports to support other teams. Aid in tracking data utilization to shape enhancements to the Data Catalog. Keep abreast of new developments in the domains of cloud computing and data science. May be called upon to perform comparable duties of a similar or related nature and/or assist in other areas as needed.&lt;br&gt;&lt;br&gt;Minimum of a Bachelor's degree in Engineering, in field related to specific position.&lt;br&gt;&lt;br&gt;Refer to Engineer Level Guide (below) for placement in level: 1- Engineer, 2 Senior Engineer, 3 Staff Engineer, 4 Principal Engineer.&lt;br&gt;&lt;br&gt;Engineering field applicable to this position: Software.&lt;br&gt;&lt;br&gt;Experience with Cloud Computing (Amazon Web Services or Microsoft Azure).&lt;br&gt;&lt;br&gt;Proficiency in Automation, Provisioning, and Orchestration tools (Gitlab Pipelines, Terraform, Ansible, DataKitchen, etc.&lt;br&gt;&lt;br&gt;Understanding of ETL pipelines, streaming services, and storage/access patterns&lt;br&gt;&lt;br&gt;Understanding the development, persistence, and application of Machine Learning datasets is beneficial. Experience writing software to develop efficient pipeline processors; ideally in Python.&lt;br&gt;&lt;br&gt;Big Data specialty certifications are beneficial.&lt;br&gt;&lt;br&gt;Specific skills, proficiencies, and knowledge in field related to position, as identified by department leadership.&lt;br&gt;&lt;br&gt;Ability to apply design theory and methodology.&lt;br&gt;&lt;br&gt;Well-developed problem analysis and problem-solving techniques.&lt;br&gt;&lt;br&gt;Proficiency with a computer, including use of Microsoft Word and Excel.&lt;br&gt;&lt;br&gt;Team player who is self-motivated and has ability to work with minimal supervision. Ability to communicate effectively with team members and leadership staff across a wide variety of specialties.",FULL_TIME,Staffing and Recruiting,41.74564,-87.91868,EducationalOccupationalCredential,bachelor degree,,,,,
1,2023-07-15,https://www.linkedin.com/jobs/view/sr-data-analyst-data-analytics-at-cardinal-health-3663776407?refId=BI%2F07r6F2pnOj%2BxxbndMag%3D%3D&trackingId=YX4brK7smiROw6iZJ%2Bq9JQ%3D%3D&position=2&pageNum=0&trk=public_jobs_jserp-result_search-card,"Sr. Data Analyst, Data Analytics",Cardinal Health,https://www.linkedin.com/company/cardinal-health?trk=public_jobs_jserp-result_job-search-card-subtitle,"Chicago, IL",Be an early applicant,"&lt;strong&gt;Discover. A brighter future.&lt;/strong&gt;&lt;p&gt;&lt;br&gt;&lt;/p&gt;With us, you’ll do meaningful work from Day 1. Our collaborative culture is built on three core behaviors: We Play to Win, We Get Better Every Day &amp;amp; We Succeed Together. And we mean it — we want you to grow and make a difference at one of the world's leading digital banking and payments companies. We value what makes you unique so that you have an opportunity to shine.&lt;p&gt;&lt;br&gt;&lt;/p&gt;Come build your future, while being the reason millions of people find a brighter financial future with Discover.&lt;p&gt;&lt;br&gt;&lt;/p&gt;&lt;strong&gt;Job Description:&lt;/strong&gt;&lt;p&gt;&lt;br&gt;&lt;/p&gt;&lt;strong&gt;What You’ll Do&lt;/strong&gt;&lt;p&gt;&lt;br&gt;&lt;/p&gt;&lt;ul&gt;&lt;li&gt;Analyze moderate business problems to be solved with automated systems.&lt;/li&gt;&lt;li&gt;Analyze and design business systems.&lt;/li&gt;&lt;li&gt;Diagnose business needs and develop requirements.&lt;/li&gt;&lt;li&gt;Create and implement test plans, and provide on-going project support during development phase.&lt;/li&gt;&lt;li&gt;Perform post-facto comparisons of delivered solutions against original specifications.&lt;/li&gt;&lt;li&gt;Act as an intermediary between technology and internal clients.&lt;/li&gt;&lt;li&gt;Implement improvements to existing processes and methodologies.&lt;/li&gt;&lt;/ul&gt;&lt;p&gt;&lt;br&gt;&lt;/p&gt;&lt;strong&gt;How You’ll Do It&lt;/strong&gt;&lt;p&gt;&lt;br&gt;&lt;/p&gt;&lt;ul&gt;&lt;li&gt;Works with client management to identify and specify business requirements and processes for diverse development platforms, computing environments (e.g., host based, distributed systems, client server), software, hardware, technologies and tools. Clearly identifies all known defects are understood and agreed by the business and technology teams prior to implementations.&lt;/li&gt;&lt;li&gt;Researches and evaluates solutions and recommends the most efficient and cost effective solutions for systems/program design. Develops system specifications and procedures. Delivers technology solutions that support business goals. Provides realistic project/release estimates and meets committed delivery dates. Work with business partners to develop final requirements/user stories by the target dates. Identifies and resolves any gaps and negotiates problematic requirements. Manages and maintains overall project/release tasks and timelines. Communicates status updates and issues with management, the business, and other technology teams.&lt;/li&gt;&lt;li&gt;Formulates logical statements of business requirements. Devises, tests and implements efficient and cost effective application program solutions (e.g., codes and/or reuses existing codes through the use of program development software alternatives and/or integrates purchased solutions).&lt;/li&gt;&lt;li&gt;Devises data verification methods and standard system procedures. May be required to participate in system testing.&lt;/li&gt;&lt;/ul&gt;&lt;p&gt;&lt;br&gt;&lt;/p&gt;&lt;strong&gt;Qualifications You’ll Need&lt;/strong&gt;&lt;p&gt;&lt;br&gt;&lt;/p&gt;&lt;strong&gt;The Basics&lt;/strong&gt;&lt;p&gt;&lt;br&gt;&lt;/p&gt;&lt;ul&gt;&lt;li&gt;Bachelor's degree in business administration, information technology or related field&lt;/li&gt;&lt;li&gt;In lieu of a degree, 2+ years of experience in application, business analysis, business process or related field&lt;/li&gt;&lt;/ul&gt;&lt;p&gt;&lt;br&gt;&lt;/p&gt;&lt;strong&gt;Compensation:&lt;/strong&gt;&lt;p&gt;&lt;br&gt;&lt;/p&gt;The base pay for this position generally ranges between $51,000.00 to $75,000.00. Additional incentives may be provided as part of a market competitive total compensation package. Factors, such as but not limited to, geographical location, relevant experience, education, and skill level may impact the pay for this position.&lt;p&gt;&lt;br&gt;&lt;/p&gt;&lt;strong&gt;&lt;strong&gt;&lt;strong&gt;Benefits:&lt;/strong&gt;&lt;/strong&gt;&lt;/strong&gt;&lt;p&gt;&lt;br&gt;&lt;/p&gt;We also offer a range of benefits and programs based on eligibility. These benefits include:&lt;p&gt;&lt;br&gt;&lt;/p&gt;&lt;ul&gt;&lt;li&gt;Paid Parental Leave&lt;/li&gt;&lt;li&gt;Paid Time Off&lt;/li&gt;&lt;li&gt;401(k) Plan&lt;/li&gt;&lt;li&gt;Medical, Dental, Vision, &amp;amp; Health Savings Account&lt;/li&gt;&lt;li&gt;STD, Life, LTD and AD&amp;amp;D&lt;/li&gt;&lt;li&gt;Recognition Program&lt;/li&gt;&lt;li&gt;Education Assistance&lt;/li&gt;&lt;li&gt;Commuter Benefits&lt;/li&gt;&lt;li&gt;Family Support Programs&lt;/li&gt;&lt;li&gt;Employee Stock Purchase Plan&lt;/li&gt;&lt;/ul&gt;&lt;p&gt;&lt;br&gt;&lt;/p&gt;Learn more at MyDiscoverBenefits.com.&lt;p&gt;&lt;br&gt;&lt;/p&gt;What are you waiting for? Apply today!&lt;p&gt;&lt;br&gt;&lt;/p&gt;All Discover employees place our customers at the very center of our work. To deliver on our promises to our customers, each of us contribute every day to a culture that values compliance and risk management.&lt;p&gt;&lt;br&gt;&lt;/p&gt;Discover is committed to a diverse and inclusive workplace. Discover is an equal opportunity employer and does not discriminate on the basis of race, color, religion, sex, sexual orientation, gender identity, national origin, age, disability, protected veteran status, or other legally protected status. (Know Your Rights)",Be among the first 25 applicants,6 hours ago,Entry level,FULL_TIME,"Research, Analyst, and Information Technology","Banking, Financial Services, and Hospitality",2023-07-15T05:43:54.000Z,"&lt;strong&gt;Discover. A brighter future.&lt;/strong&gt;&lt;p&gt;&lt;br&gt;&lt;/p&gt;With us, you’ll do meaningful work from Day 1. Our collaborative culture is built on three core behaviors: We Play to Win, We Get Better Every Day &amp;amp; We Succeed Together. And we mean it — we want you to grow and make a difference at one of the world's leading digital banking and payments companies. We value what makes you unique so that you have an opportunity to shine.&lt;p&gt;&lt;br&gt;&lt;/p&gt;Come build your future, while being the reason millions of people find a brighter financial future with Discover.&lt;p&gt;&lt;br&gt;&lt;/p&gt;&lt;strong&gt;Job Description:&lt;/strong&gt;&lt;p&gt;&lt;br&gt;&lt;/p&gt;&lt;strong&gt;What You’ll Do&lt;/strong&gt;&lt;p&gt;&lt;br&gt;&lt;/p&gt;&lt;ul&gt;&lt;li&gt;Analyze moderate business problems to be solved with automated systems.&lt;/li&gt;&lt;li&gt;Analyze and design business systems.&lt;/li&gt;&lt;li&gt;Diagnose business needs and develop requirements.&lt;/li&gt;&lt;li&gt;Create and implement test plans, and provide on-going project support during development phase.&lt;/li&gt;&lt;li&gt;Perform post-facto comparisons of delivered solutions against original specifications.&lt;/li&gt;&lt;li&gt;Act as an intermediary between technology and internal clients.&lt;/li&gt;&lt;li&gt;Implement improvements to existing processes and methodologies.&lt;/li&gt;&lt;/ul&gt;&lt;p&gt;&lt;br&gt;&lt;/p&gt;&lt;strong&gt;How You’ll Do It&lt;/strong&gt;&lt;p&gt;&lt;br&gt;&lt;/p&gt;&lt;ul&gt;&lt;li&gt;Works with client management to identify and specify business requirements and processes for diverse development platforms, computing environments (e.g., host based, distributed systems, client server), software, hardware, technologies and tools. Clearly identifies all known defects are understood and agreed by the business and technology teams prior to implementations.&lt;/li&gt;&lt;li&gt;Researches and evaluates solutions and recommends the most efficient and cost effective solutions for systems/program design. Develops system specifications and procedures. Delivers technology solutions that support business goals. Provides realistic project/release estimates and meets committed delivery dates. Work with business partners to develop final requirements/user stories by the target dates. Identifies and resolves any gaps and negotiates problematic requirements. Manages and maintains overall project/release tasks and timelines. Communicates status updates and issues with management, the business, and other technology teams.&lt;/li&gt;&lt;li&gt;Formulates logical statements of business requirements. Devises, tests and implements efficient and cost effective application program solutions (e.g., codes and/or reuses existing codes through the use of program development software alternatives and/or integrates purchased solutions).&lt;/li&gt;&lt;li&gt;Devises data verification methods and standard system procedures. May be required to participate in system testing.&lt;/li&gt;&lt;/ul&gt;&lt;p&gt;&lt;br&gt;&lt;/p&gt;&lt;strong&gt;Qualifications You’ll Need&lt;/strong&gt;&lt;p&gt;&lt;br&gt;&lt;/p&gt;&lt;strong&gt;The Basics&lt;/strong&gt;&lt;p&gt;&lt;br&gt;&lt;/p&gt;&lt;ul&gt;&lt;li&gt;Bachelor's degree in business administration, information technology or related field&lt;/li&gt;&lt;li&gt;In lieu of a degree, 2+ years of experience in application, business analysis, business process or related field&lt;/li&gt;&lt;/ul&gt;&lt;p&gt;&lt;br&gt;&lt;/p&gt;&lt;strong&gt;Compensation:&lt;/strong&gt;&lt;p&gt;&lt;br&gt;&lt;/p&gt;The base pay for this position generally ranges between $51,000.00 to $75,000.00. Additional incentives may be provided as part of a market competitive total compensation package. Factors, such as but not limited to, geographical location, relevant experience, education, and skill level may impact the pay for this position.&lt;p&gt;&lt;br&gt;&lt;/p&gt;&lt;strong&gt;&lt;strong&gt;&lt;strong&gt;Benefits:&lt;/strong&gt;&lt;/strong&gt;&lt;/strong&gt;&lt;p&gt;&lt;br&gt;&lt;/p&gt;We also offer a range of benefits and programs based on eligibility. These benefits include:&lt;p&gt;&lt;br&gt;&lt;/p&gt;&lt;ul&gt;&lt;li&gt;Paid Parental Leave&lt;/li&gt;&lt;li&gt;Paid Time Off&lt;/li&gt;&lt;li&gt;401(k) Plan&lt;/li&gt;&lt;li&gt;Medical, Dental, Vision, &amp;amp; Health Savings Account&lt;/li&gt;&lt;li&gt;STD, Life, LTD and AD&amp;amp;D&lt;/li&gt;&lt;li&gt;Recognition Program&lt;/li&gt;&lt;li&gt;Education Assistance&lt;/li&gt;&lt;li&gt;Commuter Benefits&lt;/li&gt;&lt;li&gt;Family Support Programs&lt;/li&gt;&lt;li&gt;Employee Stock Purchase Plan&lt;/li&gt;&lt;/ul&gt;&lt;p&gt;&lt;br&gt;&lt;/p&gt;Learn more at MyDiscoverBenefits.com.&lt;p&gt;&lt;br&gt;&lt;/p&gt;What are you waiting for? Apply today!&lt;p&gt;&lt;br&gt;&lt;/p&gt;All Discover employees place our customers at the very center of our work. To deliver on our promises to our customers, each of us contribute every day to a culture that values compliance and risk management.&lt;p&gt;&lt;br&gt;&lt;/p&gt;Discover is committed to a diverse and inclusive workplace. Discover is an equal opportunity employer and does not discriminate on the basis of race, color, religion, sex, sexual orientation, gender identity, national origin, age, disability, protected veteran status, or other legally protected status. (Know Your Rights)",FULL_TIME,"Banking,Financial Services,Hospitality",42.16751,-87.896996,EducationalOccupationalCredential,bachelor degree,OccupationalExperienceRequirements,24,,,
