,date,job_link,title,company,company_link,location,benefit,description,applicant_caption,posted_time_ago,seniority_level,employment_type,job_function,industry,date_posted,description_json,employment_type_json,industry_json,latitude,longitude,education_type,education_category,experience_type,experience_time,job_location_type,location_requirement_type,location_requirement_name
0,2023-05-30,https://www.linkedin.com/jobs/view/data-analyst-document-control-at-ageatia-global-solutions-3620052611?refId=3z3xOmZH6aUwah%2BtN02uRA%3D%3D&trackingId=MStTxkezfAwA804cDJxUQA%3D%3D&position=1&pageNum=0&trk=public_jobs_jserp-result_search-card,Data Analyst/ Document Control,Ageatia Global Solutions,https://www.linkedin.com/company/ageatia-global-solutions?trk=public_jobs_jserp-result_job-search-card-subtitle,"Lisle, IL",Be an early applicant,"&lt;ul&gt;&lt;li&gt;Develops and executes test processes related to end-user data and databases; documents and tracks data-related issues, and facilitates resolution of such issues&lt;/li&gt;&lt;li&gt; Provide leadership team with a clear picture, information, and status summary reports&lt;/li&gt;&lt;li&gt; Responsible for providing detailed analysis of quality data, (i.e., defects, units status)&lt;/li&gt;&lt;li&gt; Resolve data quality problems through appropriate process design strategies, as well as error detection and correction tests and procedures&lt;/li&gt;&lt;li&gt; Participate in continuous improvement projects /activities&lt;/li&gt;&lt;li&gt; Collaborates to prepare and review data required for the quality manager&lt;/li&gt;&lt;li&gt; Utilize existing reports to collect data for all reporting needs&lt;/li&gt;&lt;li&gt; Analyze and validate data in preparation of internal dashboards and external reporting warranty&lt;/li&gt;&lt;li&gt; Configure the MES Quality Data entry and reporting system&lt;/li&gt;&lt;li&gt; Maintain the Quality Data entry and reporting system&lt;/li&gt;&lt;li&gt; Train the organization in the use of the MES Quality Data System&lt;/li&gt;&lt;li&gt; Generate KPI tracking reports&lt;/li&gt;&lt;li&gt; Conduct Warranty tracking and investigation&lt;/li&gt;&lt;li&gt; Identify Corrective Action Report and follow up&lt;/li&gt;&lt;li&gt; Demonstrate effective problem-solving methods&lt;/li&gt;&lt;/ul&gt;",Be among the first 25 applicants,41 minutes ago,Entry level,CONTRACTOR,Information Technology,IT Services and IT Consulting,2023-05-30T11:18:42.000Z,"&lt;ul&gt;&lt;li&gt;Develops and executes test processes related to end-user data and databases; documents and tracks data-related issues, and facilitates resolution of such issues&lt;/li&gt;&lt;li&gt; Provide leadership team with a clear picture, information, and status summary reports&lt;/li&gt;&lt;li&gt; Responsible for providing detailed analysis of quality data, (i.e., defects, units status)&lt;/li&gt;&lt;li&gt; Resolve data quality problems through appropriate process design strategies, as well as error detection and correction tests and procedures&lt;/li&gt;&lt;li&gt; Participate in continuous improvement projects /activities&lt;/li&gt;&lt;li&gt; Collaborates to prepare and review data required for the quality manager&lt;/li&gt;&lt;li&gt; Utilize existing reports to collect data for all reporting needs&lt;/li&gt;&lt;li&gt; Analyze and validate data in preparation of internal dashboards and external reporting warranty&lt;/li&gt;&lt;li&gt; Configure the MES Quality Data entry and reporting system&lt;/li&gt;&lt;li&gt; Maintain the Quality Data entry and reporting system&lt;/li&gt;&lt;li&gt; Train the organization in the use of the MES Quality Data System&lt;/li&gt;&lt;li&gt; Generate KPI tracking reports&lt;/li&gt;&lt;li&gt; Conduct Warranty tracking and investigation&lt;/li&gt;&lt;li&gt; Identify Corrective Action Report and follow up&lt;/li&gt;&lt;li&gt; Demonstrate effective problem-solving methods&lt;/li&gt;&lt;/ul&gt;",CONTRACTOR,IT Services and IT Consulting,41.80125,-88.07478,EducationalOccupationalCredential,bachelor degree,,,,,
1,2023-05-30,https://www.linkedin.com/jobs/view/data-governance-analyst-at-skiltrek-3620043982?refId=3z3xOmZH6aUwah%2BtN02uRA%3D%3D&trackingId=e%2FPPUMVpuLj41OjO9o4ZXQ%3D%3D&position=2&pageNum=0&trk=public_jobs_jserp-result_search-card,Data Governance Analyst,Skiltrek,https://www.linkedin.com/company/skiltrek?trk=public_jobs_jserp-result_job-search-card-subtitle,"Chicago, IL",Be an early applicant,"&lt;ul&gt;&lt;li&gt;Looking for:* *-Proficient in Excel (Highly proficient skills: create spreadsheets, formulas, Vlook ups and pivot tables is a plus)* *-2-4 years of data heavy position* *-HS Diploma or GED*&lt;/li&gt;&lt;li&gt;Hours:* Monday through Friday&lt;/li&gt;&lt;li&gt;8am to 5pm* 2 days in office, 3 days remote&lt;/li&gt;&lt;li&gt;Description:* The new business job family roles will be responsible for the retrieval, validation, and processing of all worksite and group benefit enrollment files and manual production submissions inclusive of file balancing and audits. The team will be responsible for accurate processing of new enrollments, routing of benefit changes, and handling of termination notifications. Job responsibilities:&lt;/li&gt;&lt;li&gt;Ability to work with large data sets and run simple formula (VLOOKUP and logic functions are a plus)&lt;/li&gt;&lt;li&gt;Perform quality assurance and testing to ensure accuracy of setup and ability to process new business&lt;/li&gt;&lt;li&gt;Retrieve data files from various enrollment platforms and secure server transmissions; validate format and completeness of information received based upon product requirements, and prepare to load into administrative system&lt;/li&gt;&lt;li&gt;Review state and product compliance requirements, ensure appropriate approvals have been received&lt;/li&gt;&lt;li&gt;Provide support to field sales, brokers, and employer groups to resolve issues, collect missing information, and ensure accuracy of information received&lt;/li&gt;&lt;li&gt;Investigate errors that occur on assigned employer groups, research issue and follow through to resolution partnering with internal stakeholders&lt;/li&gt;&lt;li&gt;Escalate errors and risks as appropriate to bring to resolution and management intervention&lt;/li&gt;&lt;li&gt;Meet or exceed department established production and quality goals, ensuring service levels are met&lt;/li&gt;&lt;li&gt;Provide superior customer support to internal and external customers&lt;br&gt;&lt;br&gt;&lt;/li&gt;&lt;/ul&gt;About Aston Carter:&lt;br&gt;&lt;br&gt;Please Note: Scammers are posing as Aston Carter. We'll never contact you via Gmail, Telegram, or WhatsApp and we'll never solicit money from you.&lt;br&gt;&lt;br&gt;At Aston Carter, we’re dedicated to expanding career opportunities for the skilled professionals who power our business. Our success is driven by the talented, motivated people who join our team across a range of positions – from recruiting, sales and delivery to corporate roles. As part of our team, employees have the opportunity for long-term career success, where hard work is rewarded and the potential for growth is limitless. Established in 1997, Aston Carter is a leading staffing and consulting firm, providing high-caliber talent and premium services to more than 7,000 companies across North America. Spanning four continents and more than 200 offices, we extend our clients’ capabilities by seeking solvers and delivering solutions to address today’s workforce challenges. For organizations looking for innovative solutions shaped by critical-thinking professionals, visit [AstonCarter.com.](AstonCarter.com) Aston Carter is a company within Allegis Group, a global leader in talent solutions. The company is an equal opportunity employer and will consider all applications without regards to race, sex, age, color, religion, national origin, veteran status, disability, sexual orientation, gender identity, genetic information or any characteristic protected by law. If you would like to request a reasonable accommodation, such as the modification or adjustment of the job application process or interviewing process due to a disability, please call 888-237-6835 or email [astoncarteraccommodation@astoncarter.com](mailto:%20astoncarteraccommodation@astoncarter.com) for other accommodation options. However, if you have questions about this position, please contact the Recruiter located at the bottom of the job posting. The Recruiter is the sole point of contact for questions about this position.",Be among the first 25 applicants,1 hour ago,Entry level,FULL_TIME,Information Technology,Staffing and Recruiting,2023-05-30T10:27:21.000Z,"&lt;ul&gt;&lt;li&gt;Looking for:* *-Proficient in Excel (Highly proficient skills: create spreadsheets, formulas, Vlook ups and pivot tables is a plus)* *-2-4 years of data heavy position* *-HS Diploma or GED*&lt;/li&gt;&lt;li&gt;Hours:* Monday through Friday&lt;/li&gt;&lt;li&gt;8am to 5pm* 2 days in office, 3 days remote&lt;/li&gt;&lt;li&gt;Description:* The new business job family roles will be responsible for the retrieval, validation, and processing of all worksite and group benefit enrollment files and manual production submissions inclusive of file balancing and audits. The team will be responsible for accurate processing of new enrollments, routing of benefit changes, and handling of termination notifications. Job responsibilities:&lt;/li&gt;&lt;li&gt;Ability to work with large data sets and run simple formula (VLOOKUP and logic functions are a plus)&lt;/li&gt;&lt;li&gt;Perform quality assurance and testing to ensure accuracy of setup and ability to process new business&lt;/li&gt;&lt;li&gt;Retrieve data files from various enrollment platforms and secure server transmissions; validate format and completeness of information received based upon product requirements, and prepare to load into administrative system&lt;/li&gt;&lt;li&gt;Review state and product compliance requirements, ensure appropriate approvals have been received&lt;/li&gt;&lt;li&gt;Provide support to field sales, brokers, and employer groups to resolve issues, collect missing information, and ensure accuracy of information received&lt;/li&gt;&lt;li&gt;Investigate errors that occur on assigned employer groups, research issue and follow through to resolution partnering with internal stakeholders&lt;/li&gt;&lt;li&gt;Escalate errors and risks as appropriate to bring to resolution and management intervention&lt;/li&gt;&lt;li&gt;Meet or exceed department established production and quality goals, ensuring service levels are met&lt;/li&gt;&lt;li&gt;Provide superior customer support to internal and external customers&lt;br&gt;&lt;br&gt;&lt;/li&gt;&lt;/ul&gt;About Aston Carter:&lt;br&gt;&lt;br&gt;Please Note: Scammers are posing as Aston Carter. We'll never contact you via Gmail, Telegram, or WhatsApp and we'll never solicit money from you.&lt;br&gt;&lt;br&gt;At Aston Carter, we’re dedicated to expanding career opportunities for the skilled professionals who power our business. Our success is driven by the talented, motivated people who join our team across a range of positions – from recruiting, sales and delivery to corporate roles. As part of our team, employees have the opportunity for long-term career success, where hard work is rewarded and the potential for growth is limitless. Established in 1997, Aston Carter is a leading staffing and consulting firm, providing high-caliber talent and premium services to more than 7,000 companies across North America. Spanning four continents and more than 200 offices, we extend our clients’ capabilities by seeking solvers and delivering solutions to address today’s workforce challenges. For organizations looking for innovative solutions shaped by critical-thinking professionals, visit [AstonCarter.com.](AstonCarter.com) Aston Carter is a company within Allegis Group, a global leader in talent solutions. The company is an equal opportunity employer and will consider all applications without regards to race, sex, age, color, religion, national origin, veteran status, disability, sexual orientation, gender identity, genetic information or any characteristic protected by law. If you would like to request a reasonable accommodation, such as the modification or adjustment of the job application process or interviewing process due to a disability, please call 888-237-6835 or email [astoncarteraccommodation@astoncarter.com](mailto:%20astoncarteraccommodation@astoncarter.com) for other accommodation options. However, if you have questions about this position, please contact the Recruiter located at the bottom of the job posting. The Recruiter is the sole point of contact for questions about this position.",FULL_TIME,Staffing and Recruiting,41.991886,-87.86332,EducationalOccupationalCredential,bachelor degree,OccupationalExperienceRequirements,24,,,
2,2023-05-30,https://www.linkedin.com/jobs/view/data-analyst-19-22-hr-at-aston-carter-3622345712?refId=3z3xOmZH6aUwah%2BtN02uRA%3D%3D&trackingId=Ft9Mr0cIG%2B95ckGgIoqqdQ%3D%3D&position=3&pageNum=0&trk=public_jobs_jserp-result_search-card,Data Analyst (19-22/hr),Aston Carter,https://www.linkedin.com/company/aston-carter?trk=public_jobs_jserp-result_job-search-card-subtitle,"Rosemont, IL",Be an early applicant,"&lt;strong&gt;&lt;u&gt;Key Responsibilities&lt;/u&gt;&lt;/strong&gt;&lt;p&gt;&lt;br&gt;&lt;/p&gt;"" Advise on, design, and implement solutions that prepares data for additional analytical or operational uses, e.g. data provision to data scientists&lt;p&gt;&lt;br&gt;&lt;/p&gt;"" Gather needs and requirements from end users to facilitate development of solutions to satisfy data needs for data analysis and integrations.&lt;p&gt;&lt;br&gt;&lt;/p&gt;"" Build data pipelines to pull together information from different source systems; integrating, consolidating and cleansing data; and structuring it for use in individual analytics applications and other operational uses&lt;p&gt;&lt;br&gt;&lt;/p&gt;"" Design, develop, and implement architecture and processes to populate and store data for use by data analysts and integrations with other operations.&lt;p&gt;&lt;br&gt;&lt;/p&gt;"" Work closely with other data analysts to coordinate the use of end-user tools to facilitate the analysis and reporting process.&lt;p&gt;&lt;br&gt;&lt;/p&gt;"" Be a consultant for projects, products and initiatives when it comes to data topics.&lt;p&gt;&lt;br&gt;&lt;/p&gt;"" Work together with IT enterprise architects in order to help to implement the data model and any other data aspects into the system landscape of AGCS.&lt;p&gt;&lt;br&gt;&lt;/p&gt;"" Understand and promote meta-data management and data modelling.&lt;p&gt;&lt;br&gt;&lt;/p&gt;"" Support products, projects and initiatives in harmonizing data, documentation of business data terms and definitions and technical lineage.&lt;p&gt;&lt;br&gt;&lt;/p&gt;"" Provide and maintain the respective documents/ frameworks including a Business Data Model and the data requirements capturing process instructions.&lt;p&gt;&lt;br&gt;&lt;/p&gt;"" Define and implement systematic Data Governance processes using the Allianz Group Data management tool and exchange with the wider AGCS and Allianz Data Community.&lt;p&gt;&lt;br&gt;&lt;/p&gt;Internal&lt;p&gt;&lt;br&gt;&lt;/p&gt;&lt;strong&gt;&lt;u&gt;Behavioural Competencies&lt;/u&gt;&lt;/strong&gt;&lt;p&gt;&lt;br&gt;&lt;/p&gt;"" Is effective in a variety of communication settings: one-on-one, small and large groups and among diverse styles and position levels and flexes communication style accordingly.&lt;p&gt;&lt;br&gt;&lt;/p&gt;"" Works cooperatively and partners with others across the organisation to get work done&lt;p&gt;&lt;br&gt;&lt;/p&gt;"" Gains trust and support of others&lt;p&gt;&lt;br&gt;&lt;/p&gt;"" Consulting and Change Management skills: relationship management, customer satisfaction, understand customer needs, facilitation, consulting with business leading to overall goal of promoting Importance of aligned data structures for AGCS&lt;p&gt;&lt;br&gt;&lt;/p&gt;"" Strong analysis, problem solving, judgment and decision making skills&lt;p&gt;&lt;br&gt;&lt;/p&gt;"" Is resilient and confident under pressure&lt;p&gt;&lt;br&gt;&lt;/p&gt;"" Handles and manages crisis effectively&lt;p&gt;&lt;br&gt;&lt;/p&gt;"" Grows from hardships and negative experiences&lt;p&gt;&lt;br&gt;&lt;/p&gt;&lt;strong&gt;&lt;u&gt;Technical Competencies&lt;/u&gt;&lt;/strong&gt;&lt;p&gt;&lt;br&gt;&lt;/p&gt;"" Insurance knowledge in general is required. Specialization in functions like Accounting/Actuarial, Claims, Operations, Underwriting specifically from a data perspective a plus.&lt;p&gt;&lt;br&gt;&lt;/p&gt;"" Understanding of information systems and data life-cycle management best practices and methodologies.&lt;p&gt;&lt;br&gt;&lt;/p&gt;"" Good understanding of Agile development methodologies like SAFe&lt;p&gt;&lt;br&gt;&lt;/p&gt;"" Experience with enterprise wide data management technologies&lt;p&gt;&lt;br&gt;&lt;/p&gt;"" Experience with Erwin Data Modeller, Power Designer or comparable data modelling tools&lt;p&gt;&lt;br&gt;&lt;/p&gt;"" Knows how to document data flows and enable the connection between data governance functions like a business glossary and metadata tools in an automated way.&lt;p&gt;&lt;br&gt;&lt;/p&gt;"" High competency in SQL and Data modelling Standards for 3NF and Data Vault&lt;p&gt;&lt;br&gt;&lt;/p&gt;"" Good understanding of extract, transform and load (ETL) tools and REST-oriented APIs for creating and managing data integration jobs&lt;p&gt;&lt;br&gt;&lt;/p&gt;"" Ability to work with both structured and unstructured data sets&lt;p&gt;&lt;br&gt;&lt;/p&gt;"" Exposure to data ingestion and processing frameworks&lt;p&gt;&lt;br&gt;&lt;/p&gt;"" Preferred knowledge in industry standard frameworks such as DAMA, DMBOK "" MS Office skills (particularly Excel, PowerPoint, Access, VBA). "" Advanced Data Analysis skills (Data Profiling, PL/SQL for Oracle, ETL Tools, Reporting tools like SAS) a strong advantage "" Metadata &amp;amp; data governance suits (e.g. Informatica, IBM, DAG, Collibra and Metadata Bridges) "" Data Integration (e.g. Informatica, Talend, Ab Initio and IBM) "" Data visualisation (e.g. Composite/Tibco and Denodo) "" Visualization &amp;amp; BI (e.g. Microsoft, Cognos, MicroStrategy, Tableau, Qlik, OBIEE, Hyperion)&lt;p&gt;&lt;br&gt;&lt;/p&gt;&lt;em&gt;Diverse Lynx LLC is an Equal Employment Opportunity employer. All qualified applicants will receive due consideration for employment without any discrimination. All applicants will be evaluated solely on the basis of their ability, competence and their proven capability to perform the functions outlined in the corresponding role. We promote and support a diverse workforce across all levels in the company.&lt;/em&gt;",Be among the first 25 applicants,35 minutes ago,Entry level,CONTRACTOR,Information Technology,Software Development,2023-05-30T11:24:48.000Z,"&lt;strong&gt;&lt;u&gt;Key Responsibilities&lt;/u&gt;&lt;/strong&gt;&lt;p&gt;&lt;br&gt;&lt;/p&gt;"" Advise on, design, and implement solutions that prepares data for additional analytical or operational uses, e.g. data provision to data scientists&lt;p&gt;&lt;br&gt;&lt;/p&gt;"" Gather needs and requirements from end users to facilitate development of solutions to satisfy data needs for data analysis and integrations.&lt;p&gt;&lt;br&gt;&lt;/p&gt;"" Build data pipelines to pull together information from different source systems; integrating, consolidating and cleansing data; and structuring it for use in individual analytics applications and other operational uses&lt;p&gt;&lt;br&gt;&lt;/p&gt;"" Design, develop, and implement architecture and processes to populate and store data for use by data analysts and integrations with other operations.&lt;p&gt;&lt;br&gt;&lt;/p&gt;"" Work closely with other data analysts to coordinate the use of end-user tools to facilitate the analysis and reporting process.&lt;p&gt;&lt;br&gt;&lt;/p&gt;"" Be a consultant for projects, products and initiatives when it comes to data topics.&lt;p&gt;&lt;br&gt;&lt;/p&gt;"" Work together with IT enterprise architects in order to help to implement the data model and any other data aspects into the system landscape of AGCS.&lt;p&gt;&lt;br&gt;&lt;/p&gt;"" Understand and promote meta-data management and data modelling.&lt;p&gt;&lt;br&gt;&lt;/p&gt;"" Support products, projects and initiatives in harmonizing data, documentation of business data terms and definitions and technical lineage.&lt;p&gt;&lt;br&gt;&lt;/p&gt;"" Provide and maintain the respective documents/ frameworks including a Business Data Model and the data requirements capturing process instructions.&lt;p&gt;&lt;br&gt;&lt;/p&gt;"" Define and implement systematic Data Governance processes using the Allianz Group Data management tool and exchange with the wider AGCS and Allianz Data Community.&lt;p&gt;&lt;br&gt;&lt;/p&gt;Internal&lt;p&gt;&lt;br&gt;&lt;/p&gt;&lt;strong&gt;&lt;u&gt;Behavioural Competencies&lt;/u&gt;&lt;/strong&gt;&lt;p&gt;&lt;br&gt;&lt;/p&gt;"" Is effective in a variety of communication settings: one-on-one, small and large groups and among diverse styles and position levels and flexes communication style accordingly.&lt;p&gt;&lt;br&gt;&lt;/p&gt;"" Works cooperatively and partners with others across the organisation to get work done&lt;p&gt;&lt;br&gt;&lt;/p&gt;"" Gains trust and support of others&lt;p&gt;&lt;br&gt;&lt;/p&gt;"" Consulting and Change Management skills: relationship management, customer satisfaction, understand customer needs, facilitation, consulting with business leading to overall goal of promoting Importance of aligned data structures for AGCS&lt;p&gt;&lt;br&gt;&lt;/p&gt;"" Strong analysis, problem solving, judgment and decision making skills&lt;p&gt;&lt;br&gt;&lt;/p&gt;"" Is resilient and confident under pressure&lt;p&gt;&lt;br&gt;&lt;/p&gt;"" Handles and manages crisis effectively&lt;p&gt;&lt;br&gt;&lt;/p&gt;"" Grows from hardships and negative experiences&lt;p&gt;&lt;br&gt;&lt;/p&gt;&lt;strong&gt;&lt;u&gt;Technical Competencies&lt;/u&gt;&lt;/strong&gt;&lt;p&gt;&lt;br&gt;&lt;/p&gt;"" Insurance knowledge in general is required. Specialization in functions like Accounting/Actuarial, Claims, Operations, Underwriting specifically from a data perspective a plus.&lt;p&gt;&lt;br&gt;&lt;/p&gt;"" Understanding of information systems and data life-cycle management best practices and methodologies.&lt;p&gt;&lt;br&gt;&lt;/p&gt;"" Good understanding of Agile development methodologies like SAFe&lt;p&gt;&lt;br&gt;&lt;/p&gt;"" Experience with enterprise wide data management technologies&lt;p&gt;&lt;br&gt;&lt;/p&gt;"" Experience with Erwin Data Modeller, Power Designer or comparable data modelling tools&lt;p&gt;&lt;br&gt;&lt;/p&gt;"" Knows how to document data flows and enable the connection between data governance functions like a business glossary and metadata tools in an automated way.&lt;p&gt;&lt;br&gt;&lt;/p&gt;"" High competency in SQL and Data modelling Standards for 3NF and Data Vault&lt;p&gt;&lt;br&gt;&lt;/p&gt;"" Good understanding of extract, transform and load (ETL) tools and REST-oriented APIs for creating and managing data integration jobs&lt;p&gt;&lt;br&gt;&lt;/p&gt;"" Ability to work with both structured and unstructured data sets&lt;p&gt;&lt;br&gt;&lt;/p&gt;"" Exposure to data ingestion and processing frameworks&lt;p&gt;&lt;br&gt;&lt;/p&gt;"" Preferred knowledge in industry standard frameworks such as DAMA, DMBOK "" MS Office skills (particularly Excel, PowerPoint, Access, VBA). "" Advanced Data Analysis skills (Data Profiling, PL/SQL for Oracle, ETL Tools, Reporting tools like SAS) a strong advantage "" Metadata &amp;amp; data governance suits (e.g. Informatica, IBM, DAG, Collibra and Metadata Bridges) "" Data Integration (e.g. Informatica, Talend, Ab Initio and IBM) "" Data visualisation (e.g. Composite/Tibco and Denodo) "" Visualization &amp;amp; BI (e.g. Microsoft, Cognos, MicroStrategy, Tableau, Qlik, OBIEE, Hyperion)&lt;p&gt;&lt;br&gt;&lt;/p&gt;&lt;em&gt;Diverse Lynx LLC is an Equal Employment Opportunity employer. All qualified applicants will receive due consideration for employment without any discrimination. All applicants will be evaluated solely on the basis of their ability, competence and their proven capability to perform the functions outlined in the corresponding role. We promote and support a diverse workforce across all levels in the company.&lt;/em&gt;",CONTRACTOR,Software Development,41.88323,-87.6324,EducationalOccupationalCredential,bachelor degree,,,,,
