,date,job_link,title,company,company_link,location,benefit,description,applicant_caption,posted_time_ago,seniority_level,employment_type,job_function,industry,date_posted,description_json,employment_type_json,industry_json,latitude,longitude,education_type,education_category,experience_type,experience_time,job_location_type,location_requirement_type,location_requirement_name
34,2023-07-14,https://www.linkedin.com/jobs/view/java-production-support-engineer-contract-at-capgemini-3662366630?refId=zoNYwiF4UzGelWSN%2BtJd%2FA%3D%3D&trackingId=fQEuyIkXUI%2Fa3yaavnBsrw%3D%3D&position=10&pageNum=1&trk=public_jobs_jserp-result_search-card,Java Production Support Engineer (contract),Capgemini,https://fr.linkedin.com/company/capgemini?trk=public_jobs_jserp-result_job-search-card-subtitle,"Des Plaines, IL",Be an early applicant,"Join an exciting and dynamic team at NORC at the University of Chicago, a reputable and unbiased research organization with over 75 years of expertise in data collection, program evaluation, data analysis, and information dissemination. We are currently seeking talented Financial Analysts to join our Financial Management and Analysis team. As a Financial Analyst, you will provide ongoing support for multiple projects, including project tracking, budget monitoring, forecasting and modeling, and pricing for proposals.&lt;br&gt;&lt;br&gt;we value expertise in project accounting, project management, and experience in working with government contracts and grants. As an integral part of our team, you will collaborate with senior financial analysts and project teams while enjoying the opportunity to work both independently and in a supportive environment.&lt;br&gt;&lt;br&gt;the company currently has openings in our Chicago office and an exciting opportunity for a candidate based in the Hyde Park office. The selected candidate will have the flexibility to work from NORC's Chicago Loop office on varying days throughout the week when office-based work resumes.&lt;br&gt;&lt;br&gt;We offer flexible work arrangements, allowing employees to choose between remote, hybrid, or in-office work options.&lt;br&gt;&lt;br&gt;Department: Financial Management and Analysis&lt;br&gt;&lt;br&gt;company's Financial Management and Analysis department plays a crucial role in supporting NORC's mission of providing trustworthy data to decision-makers around the world. Our team ensures that NORC's financial management functions are fully aligned and integrated, working closely with research departments, as well as other administrative departments, to navigate the complex government regulatory environment.&lt;br&gt;&lt;br&gt;&lt;strong&gt;&lt;u&gt;Responsibilities&lt;br&gt;&lt;br&gt;&lt;/u&gt;&lt;/strong&gt;Review, approve, and track project expenses, including processing vendor invoices and monitoring spending against purchase orders.&lt;br&gt;&lt;br&gt;Manage project billing, monitor project receivables, and address client budget and billing inquiries as necessary.&lt;br&gt;&lt;br&gt;Contribute to periodic client financial reports as required by projects.&lt;br&gt;&lt;br&gt;Assist Senior Financial Analysts with cost estimation for project budget modifications or cost over/underrun scenarios.&lt;br&gt;&lt;br&gt;Review and provide quality assurance for client and vendor invoices, expense reports, cost reports, purchase requisitions, and other project-related expenses to ensure compliance with accounting standards and regulations.&lt;br&gt;&lt;br&gt;Close out project accounts upon completion.&lt;br&gt;&lt;br&gt;Support Senior Financial Analysts in revenue and cost-estimating efforts for proposals.&lt;br&gt;&lt;br&gt;Perform other duties as assigned.&lt;br&gt;&lt;br&gt;&lt;strong&gt;&lt;u&gt;Required Skills&lt;br&gt;&lt;br&gt;&lt;/u&gt;&lt;/strong&gt;Bachelor's Degree in finance, accounting, economics, or a related area is required.&lt;br&gt;&lt;br&gt;Minimum of 6 months of experience in project-based account management is highly desired.&lt;br&gt;&lt;br&gt;Strong interpersonal and communication skills.&lt;br&gt;&lt;br&gt;Proficiency in budget development, forecasting, and analysis.&lt;br&gt;&lt;br&gt;Ability to manage multiple tasks under time pressure while maintaining accuracy and attention to detail.&lt;br&gt;&lt;br&gt;Ability to work with minimal supervision.&lt;br&gt;&lt;br&gt;Familiarity with federal government accounting regulations and accounting and contractual structures (i.e., FAR, OMB, FTR) is preferred.&lt;br&gt;&lt;br&gt;Experience in Microsoft Office Suite; intermediate to advanced knowledge of Excel is preferred.&lt;br&gt;&lt;br&gt;Skills in the use of Enterprise Resource Planning (ERP) software. Costpoint and FocusPoint experience is a plus.&lt;br&gt;&lt;br&gt;&lt;strong&gt;&lt;u&gt;What We Do&lt;br&gt;&lt;br&gt;&lt;/u&gt;&lt;/strong&gt;NORC at the University of Chicago is an objective, non-partisan research institution that delivers reliable data and rigorous analysis to guide critical programmatic, business, and policy decisions. With a rich history dating back to 1941, our teams have conducted groundbreaking studies, applied innovative methods and tools, and upheld principles of scientific integrity and collaboration. Today, clients from government, corporate, and nonprofit sectors around the world partner with us to transform complex information into actionable knowledge.&lt;br&gt;&lt;br&gt;&lt;strong&gt;&lt;u&gt;Who We Are&lt;br&gt;&lt;br&gt;&lt;/u&gt;&lt;/strong&gt;For over 75 years, NORC has been at the forefront of research innovation, constantly pushing boundaries in research methods, technical applications, and groundbreaking findings. While we take pride in our stellar research and analysis work, we also foster a supportive and collaborative environment where relationships flourish. With world-class benefits, a business casual environment, and a commitment to continuous learning, NORC offers a place where your work can make a global impact and where you can build lasting connections with colleagues.&lt;br&gt;&lt;br&gt;&lt;strong&gt;&lt;u&gt;Equal Employment Opportunity Statement&lt;br&gt;&lt;br&gt;&lt;/u&gt;&lt;/strong&gt;NORC is an affirmative action, equal opportunity employer that values and actively seeks diversity in the workforce. We evaluate qualified applicants without regard to race, color, religion, sex, national origin, disability, veteran status, sexual orientation, gender identity, and other legally protected characteristics.&lt;br&gt;&lt;br&gt;Employment Type: Full-Time&lt;br&gt;&lt;br&gt;Salary: $ 50,000.00 Per Year",Be among the first 25 applicants,3 hours ago,Entry level,FULL_TIME,Finance and Sales,Human Resources Services,2023-07-14T08:42:00.000Z,"Join an exciting and dynamic team at NORC at the University of Chicago, a reputable and unbiased research organization with over 75 years of expertise in data collection, program evaluation, data analysis, and information dissemination. We are currently seeking talented Financial Analysts to join our Financial Management and Analysis team. As a Financial Analyst, you will provide ongoing support for multiple projects, including project tracking, budget monitoring, forecasting and modeling, and pricing for proposals.&lt;br&gt;&lt;br&gt;we value expertise in project accounting, project management, and experience in working with government contracts and grants. As an integral part of our team, you will collaborate with senior financial analysts and project teams while enjoying the opportunity to work both independently and in a supportive environment.&lt;br&gt;&lt;br&gt;the company currently has openings in our Chicago office and an exciting opportunity for a candidate based in the Hyde Park office. The selected candidate will have the flexibility to work from NORC's Chicago Loop office on varying days throughout the week when office-based work resumes.&lt;br&gt;&lt;br&gt;We offer flexible work arrangements, allowing employees to choose between remote, hybrid, or in-office work options.&lt;br&gt;&lt;br&gt;Department: Financial Management and Analysis&lt;br&gt;&lt;br&gt;company's Financial Management and Analysis department plays a crucial role in supporting NORC's mission of providing trustworthy data to decision-makers around the world. Our team ensures that NORC's financial management functions are fully aligned and integrated, working closely with research departments, as well as other administrative departments, to navigate the complex government regulatory environment.&lt;br&gt;&lt;br&gt;&lt;strong&gt;&lt;u&gt;Responsibilities&lt;br&gt;&lt;br&gt;&lt;/u&gt;&lt;/strong&gt;Review, approve, and track project expenses, including processing vendor invoices and monitoring spending against purchase orders.&lt;br&gt;&lt;br&gt;Manage project billing, monitor project receivables, and address client budget and billing inquiries as necessary.&lt;br&gt;&lt;br&gt;Contribute to periodic client financial reports as required by projects.&lt;br&gt;&lt;br&gt;Assist Senior Financial Analysts with cost estimation for project budget modifications or cost over/underrun scenarios.&lt;br&gt;&lt;br&gt;Review and provide quality assurance for client and vendor invoices, expense reports, cost reports, purchase requisitions, and other project-related expenses to ensure compliance with accounting standards and regulations.&lt;br&gt;&lt;br&gt;Close out project accounts upon completion.&lt;br&gt;&lt;br&gt;Support Senior Financial Analysts in revenue and cost-estimating efforts for proposals.&lt;br&gt;&lt;br&gt;Perform other duties as assigned.&lt;br&gt;&lt;br&gt;&lt;strong&gt;&lt;u&gt;Required Skills&lt;br&gt;&lt;br&gt;&lt;/u&gt;&lt;/strong&gt;Bachelor's Degree in finance, accounting, economics, or a related area is required.&lt;br&gt;&lt;br&gt;Minimum of 6 months of experience in project-based account management is highly desired.&lt;br&gt;&lt;br&gt;Strong interpersonal and communication skills.&lt;br&gt;&lt;br&gt;Proficiency in budget development, forecasting, and analysis.&lt;br&gt;&lt;br&gt;Ability to manage multiple tasks under time pressure while maintaining accuracy and attention to detail.&lt;br&gt;&lt;br&gt;Ability to work with minimal supervision.&lt;br&gt;&lt;br&gt;Familiarity with federal government accounting regulations and accounting and contractual structures (i.e., FAR, OMB, FTR) is preferred.&lt;br&gt;&lt;br&gt;Experience in Microsoft Office Suite; intermediate to advanced knowledge of Excel is preferred.&lt;br&gt;&lt;br&gt;Skills in the use of Enterprise Resource Planning (ERP) software. Costpoint and FocusPoint experience is a plus.&lt;br&gt;&lt;br&gt;&lt;strong&gt;&lt;u&gt;What We Do&lt;br&gt;&lt;br&gt;&lt;/u&gt;&lt;/strong&gt;NORC at the University of Chicago is an objective, non-partisan research institution that delivers reliable data and rigorous analysis to guide critical programmatic, business, and policy decisions. With a rich history dating back to 1941, our teams have conducted groundbreaking studies, applied innovative methods and tools, and upheld principles of scientific integrity and collaboration. Today, clients from government, corporate, and nonprofit sectors around the world partner with us to transform complex information into actionable knowledge.&lt;br&gt;&lt;br&gt;&lt;strong&gt;&lt;u&gt;Who We Are&lt;br&gt;&lt;br&gt;&lt;/u&gt;&lt;/strong&gt;For over 75 years, NORC has been at the forefront of research innovation, constantly pushing boundaries in research methods, technical applications, and groundbreaking findings. While we take pride in our stellar research and analysis work, we also foster a supportive and collaborative environment where relationships flourish. With world-class benefits, a business casual environment, and a commitment to continuous learning, NORC offers a place where your work can make a global impact and where you can build lasting connections with colleagues.&lt;br&gt;&lt;br&gt;&lt;strong&gt;&lt;u&gt;Equal Employment Opportunity Statement&lt;br&gt;&lt;br&gt;&lt;/u&gt;&lt;/strong&gt;NORC is an affirmative action, equal opportunity employer that values and actively seeks diversity in the workforce. We evaluate qualified applicants without regard to race, color, religion, sex, national origin, disability, veteran status, sexual orientation, gender identity, and other legally protected characteristics.&lt;br&gt;&lt;br&gt;Employment Type: Full-Time&lt;br&gt;&lt;br&gt;Salary: $ 50,000.00 Per Year",FULL_TIME,Human Resources Services,41.88323,-87.6324,EducationalOccupationalCredential,bachelor degree,OccupationalExperienceRequirements,6,TELECOMMUTE,Country,United States
35,2023-07-14,https://www.linkedin.com/jobs/view/infrastructure-engineer-sharepoint-at-discover-financial-services-3661023092?refId=zoNYwiF4UzGelWSN%2BtJd%2FA%3D%3D&trackingId=XFJWk9byMz2PD69wb5DIkQ%3D%3D&position=11&pageNum=1&trk=public_jobs_jserp-result_search-card,Infrastructure Engineer (SharePoint),Discover Financial Services,https://www.linkedin.com/company/discover-financial-services?trk=public_jobs_jserp-result_job-search-card-subtitle,"Riverwoods, IL",Be an early applicant,"Dice is the leading career destination for tech experts at every stage of their careers. Our client, CLIECON SOLUTIONS, is seeking the following. Apply via Dice today!&lt;p&gt;&lt;br&gt;&lt;/p&gt;&lt;strong&gt;Cliecon Solutions Inc,&lt;/strong&gt; (head quartered in central NJ ) is one of the fastest growing and a leading consulting and management firm with 12 years of experience in Staff Augmentation. We handle complete recruiting cycle for fortune 500 clients, major implementing partners and tier -1 vendors. We specialized in recruiting for Application development, Big data, Databases, Infrastructure, Cloud, Mobile and ERP based solutions projects.&lt;p&gt;&lt;br&gt;&lt;/p&gt;Hi,&lt;p&gt;&lt;br&gt;&lt;/p&gt;Greetings from Cliecon Solutions Inc.,&lt;p&gt;&lt;br&gt;&lt;/p&gt;I am Vishnu, I work as a Senior Technical Recruiter for Cliecon Solutions Inc., We have an urgent requirement with one of our major client. Please check review the below requirement and reply me back with your Updated resume, contact details at the earliest and feel free to call/mail me at and Call: O: Ext 114&lt;p&gt;&lt;br&gt;&lt;/p&gt;&lt;strong&gt;Job Title: &lt;/strong&gt;&lt;strong&gt;Linux&lt;/strong&gt; &lt;strong&gt;Engineer&lt;/strong&gt;&lt;p&gt;&lt;br&gt;&lt;/p&gt;&lt;strong&gt;Location: &lt;/strong&gt;&lt;strong&gt;Chicago, IL(Onsite)&lt;/strong&gt;&lt;p&gt;&lt;br&gt;&lt;/p&gt;&lt;strong&gt;Duration: Long Term&lt;/strong&gt;&lt;p&gt;&lt;br&gt;&lt;/p&gt;&lt;strong&gt;Job Description:&lt;/strong&gt;&lt;p&gt;&lt;br&gt;&lt;/p&gt;&lt;ul&gt;&lt;li&gt;8 plus years of Linux Patching along with Apache Tomcat&lt;/li&gt;&lt;li&gt;We need resource in Chicago with close proximity to our YASH office and need to travel to customer site in case of critical break fix during the patching window/cycle.&lt;/li&gt;&lt;/ul&gt; Linux Engineer / Middleware on W2 (Chicago, IL)",Be among the first 25 applicants,15 hours ago,Entry level,FULL_TIME,Information Technology,"Technology, Information and Internet",2023-07-13T20:58:21.000Z,"Dice is the leading career destination for tech experts at every stage of their careers. Our client, CLIECON SOLUTIONS, is seeking the following. Apply via Dice today!&lt;p&gt;&lt;br&gt;&lt;/p&gt;&lt;strong&gt;Cliecon Solutions Inc,&lt;/strong&gt; (head quartered in central NJ ) is one of the fastest growing and a leading consulting and management firm with 12 years of experience in Staff Augmentation. We handle complete recruiting cycle for fortune 500 clients, major implementing partners and tier -1 vendors. We specialized in recruiting for Application development, Big data, Databases, Infrastructure, Cloud, Mobile and ERP based solutions projects.&lt;p&gt;&lt;br&gt;&lt;/p&gt;Hi,&lt;p&gt;&lt;br&gt;&lt;/p&gt;Greetings from Cliecon Solutions Inc.,&lt;p&gt;&lt;br&gt;&lt;/p&gt;I am Vishnu, I work as a Senior Technical Recruiter for Cliecon Solutions Inc., We have an urgent requirement with one of our major client. Please check review the below requirement and reply me back with your Updated resume, contact details at the earliest and feel free to call/mail me at and Call: O: Ext 114&lt;p&gt;&lt;br&gt;&lt;/p&gt;&lt;strong&gt;Job Title: &lt;/strong&gt;&lt;strong&gt;Linux&lt;/strong&gt; &lt;strong&gt;Engineer&lt;/strong&gt;&lt;p&gt;&lt;br&gt;&lt;/p&gt;&lt;strong&gt;Location: &lt;/strong&gt;&lt;strong&gt;Chicago, IL(Onsite)&lt;/strong&gt;&lt;p&gt;&lt;br&gt;&lt;/p&gt;&lt;strong&gt;Duration: Long Term&lt;/strong&gt;&lt;p&gt;&lt;br&gt;&lt;/p&gt;&lt;strong&gt;Job Description:&lt;/strong&gt;&lt;p&gt;&lt;br&gt;&lt;/p&gt;&lt;ul&gt;&lt;li&gt;8 plus years of Linux Patching along with Apache Tomcat&lt;/li&gt;&lt;li&gt;We need resource in Chicago with close proximity to our YASH office and need to travel to customer site in case of critical break fix during the patching window/cycle.&lt;/li&gt;&lt;/ul&gt; Linux Engineer / Middleware on W2 (Chicago, IL)",FULL_TIME,"Technology, Information and Internet",41.88323,-87.6324,EducationalOccupationalCredential,bachelor degree,OccupationalExperienceRequirements,144,,,
36,2023-07-14,https://www.linkedin.com/jobs/view/employee-technology-systems-engineer-at-morningstar-3643339843?refId=zoNYwiF4UzGelWSN%2BtJd%2FA%3D%3D&trackingId=kduANbseorVJHU%2BUJvo93Q%3D%3D&position=12&pageNum=1&trk=public_jobs_jserp-result_search-card,Employee Technology Systems Engineer,Morningstar,https://www.linkedin.com/company/morningstar?trk=public_jobs_jserp-result_job-search-card-subtitle,"Chicago, IL",Be an early applicant,"We're on the lookout for an enthusiastic and talented IT Web/Mobile Application Developer to join our dynamic team! If you're passionate about crafting innovative web and mobile applications, this is the perfect opportunity for you. As our developer, you'll have the chance to collaborate across various business functions, creating high-performing applications that are both scalable and user-friendly. Get ready to showcase your technical expertise as you tackle challenges, troubleshoot issues, and make a real impact by saving the day for our users!&lt;br&gt;&lt;br&gt;At our company, we embrace the New Ways of Work, allowing you to work remotely from anywhere in the United States (except Hawaii or United States Territories). With this flexibility, you'll enjoy a perfect work-life balance. While most of your work will be remote, occasional travel of up to 20% may be required, including a week-long stay in Rosemont, IL, each month (Monday morning to Friday afternoon). Additionally, you may need to make infrequent visits to divisions and attend vendor seminars.&lt;br&gt;&lt;br&gt;What we're looking for in our ideal Web/Mobile Application Developer:&lt;br&gt;&lt;br&gt;Proficiency in Angular, React, Rest API, Node, and AWS is a must. Show us what you've got!&lt;br&gt;&lt;br&gt;&lt;strong&gt;&lt;u&gt;Your Responsibilities Will Include&lt;br&gt;&lt;br&gt;&lt;/u&gt;&lt;/strong&gt;Actively participating in project ideation, from concept to delivery&lt;br&gt;&lt;br&gt;Gathering information from existing systems and analyzing program and time requirements&lt;br&gt;&lt;br&gt;Creating detailed specifications for program development and coding&lt;br&gt;&lt;br&gt;Developing moderately complex programs that meet technical standards and specifications&lt;br&gt;&lt;br&gt;Designing and implementing effective test plans to verify program logic&lt;br&gt;&lt;br&gt;Documenting your work assignments, including program code and technical documentation&lt;br&gt;&lt;br&gt;Assisting support and project personnel in resolving program-related issues&lt;br&gt;&lt;br&gt;&lt;strong&gt;&lt;u&gt;To Qualify For This Role, You Should Have&lt;br&gt;&lt;br&gt;&lt;/u&gt;&lt;/strong&gt;A B.S. degree in Computer Science, Engineering, Information Systems, or a related field (required)&lt;br&gt;&lt;br&gt;&lt;strong&gt;&lt;u&gt;Experience In Requirements Gathering, Design, Implementation, Integration, And Testing&lt;br&gt;&lt;br&gt;&lt;/u&gt;&lt;/strong&gt;Coursework or demonstrated skill in object-oriented programming&lt;br&gt;&lt;br&gt;Previous experience in web application development or hands-on website development&lt;br&gt;&lt;br&gt;The ability to seamlessly integrate front-end templates with back-end functionality&lt;br&gt;&lt;br&gt;Excellent written and verbal communication skills&lt;br&gt;&lt;br&gt;Strong organizational and multitasking abilities&lt;br&gt;&lt;br&gt;&lt;strong&gt;&lt;u&gt;Preferred Skills&lt;br&gt;&lt;br&gt;&lt;/u&gt;&lt;/strong&gt;Knowledge of microservice architecture&lt;br&gt;&lt;br&gt;Proficiency in JDBC, JMS, Web Services, J2EE, Applet, Servlet, JSP, JSON&lt;br&gt;&lt;br&gt;Experience with HTML5, CSS3, Angular, JavaScript/jQuery&lt;br&gt;&lt;br&gt;Familiarity with WebLogic, Tomcat&lt;br&gt;&lt;br&gt;Exposure to Docker, Kubernetes, Kafka, and Swagger&lt;br&gt;&lt;br&gt;Experience with AWS services such as API Gateway, WebSocket, Lambda, EC2, S3&lt;br&gt;&lt;br&gt;Familiarity with New Relic and Git&lt;br&gt;&lt;br&gt;We strive to provide competitive compensation based on experience, geographic location, and other factors permitted by law, in accordance with state and local regulations.&lt;br&gt;&lt;br&gt;Join our team and be part of an exciting journey in the world of web and mobile application development! Apply today and let your skills shine in our collaborative and innovative environment.&lt;br&gt;&lt;br&gt;Employment Type: Full-Time&lt;br&gt;&lt;br&gt;Salary: $ 64,000.00 86,000.00 Per Year",Be among the first 25 applicants,3 hours ago,Entry level,FULL_TIME,Engineering and Information Technology,Human Resources Services,2023-07-14T08:41:58.000Z,"We're on the lookout for an enthusiastic and talented IT Web/Mobile Application Developer to join our dynamic team! If you're passionate about crafting innovative web and mobile applications, this is the perfect opportunity for you. As our developer, you'll have the chance to collaborate across various business functions, creating high-performing applications that are both scalable and user-friendly. Get ready to showcase your technical expertise as you tackle challenges, troubleshoot issues, and make a real impact by saving the day for our users!&lt;br&gt;&lt;br&gt;At our company, we embrace the New Ways of Work, allowing you to work remotely from anywhere in the United States (except Hawaii or United States Territories). With this flexibility, you'll enjoy a perfect work-life balance. While most of your work will be remote, occasional travel of up to 20% may be required, including a week-long stay in Rosemont, IL, each month (Monday morning to Friday afternoon). Additionally, you may need to make infrequent visits to divisions and attend vendor seminars.&lt;br&gt;&lt;br&gt;What we're looking for in our ideal Web/Mobile Application Developer:&lt;br&gt;&lt;br&gt;Proficiency in Angular, React, Rest API, Node, and AWS is a must. Show us what you've got!&lt;br&gt;&lt;br&gt;&lt;strong&gt;&lt;u&gt;Your Responsibilities Will Include&lt;br&gt;&lt;br&gt;&lt;/u&gt;&lt;/strong&gt;Actively participating in project ideation, from concept to delivery&lt;br&gt;&lt;br&gt;Gathering information from existing systems and analyzing program and time requirements&lt;br&gt;&lt;br&gt;Creating detailed specifications for program development and coding&lt;br&gt;&lt;br&gt;Developing moderately complex programs that meet technical standards and specifications&lt;br&gt;&lt;br&gt;Designing and implementing effective test plans to verify program logic&lt;br&gt;&lt;br&gt;Documenting your work assignments, including program code and technical documentation&lt;br&gt;&lt;br&gt;Assisting support and project personnel in resolving program-related issues&lt;br&gt;&lt;br&gt;&lt;strong&gt;&lt;u&gt;To Qualify For This Role, You Should Have&lt;br&gt;&lt;br&gt;&lt;/u&gt;&lt;/strong&gt;A B.S. degree in Computer Science, Engineering, Information Systems, or a related field (required)&lt;br&gt;&lt;br&gt;&lt;strong&gt;&lt;u&gt;Experience In Requirements Gathering, Design, Implementation, Integration, And Testing&lt;br&gt;&lt;br&gt;&lt;/u&gt;&lt;/strong&gt;Coursework or demonstrated skill in object-oriented programming&lt;br&gt;&lt;br&gt;Previous experience in web application development or hands-on website development&lt;br&gt;&lt;br&gt;The ability to seamlessly integrate front-end templates with back-end functionality&lt;br&gt;&lt;br&gt;Excellent written and verbal communication skills&lt;br&gt;&lt;br&gt;Strong organizational and multitasking abilities&lt;br&gt;&lt;br&gt;&lt;strong&gt;&lt;u&gt;Preferred Skills&lt;br&gt;&lt;br&gt;&lt;/u&gt;&lt;/strong&gt;Knowledge of microservice architecture&lt;br&gt;&lt;br&gt;Proficiency in JDBC, JMS, Web Services, J2EE, Applet, Servlet, JSP, JSON&lt;br&gt;&lt;br&gt;Experience with HTML5, CSS3, Angular, JavaScript/jQuery&lt;br&gt;&lt;br&gt;Familiarity with WebLogic, Tomcat&lt;br&gt;&lt;br&gt;Exposure to Docker, Kubernetes, Kafka, and Swagger&lt;br&gt;&lt;br&gt;Experience with AWS services such as API Gateway, WebSocket, Lambda, EC2, S3&lt;br&gt;&lt;br&gt;Familiarity with New Relic and Git&lt;br&gt;&lt;br&gt;We strive to provide competitive compensation based on experience, geographic location, and other factors permitted by law, in accordance with state and local regulations.&lt;br&gt;&lt;br&gt;Join our team and be part of an exciting journey in the world of web and mobile application development! Apply today and let your skills shine in our collaborative and innovative environment.&lt;br&gt;&lt;br&gt;Employment Type: Full-Time&lt;br&gt;&lt;br&gt;Salary: $ 64,000.00 86,000.00 Per Year",FULL_TIME,Human Resources Services,42.042297,-87.88932,EducationalOccupationalCredential,bachelor degree,,,TELECOMMUTE,Country,United States
